,College,City,State,Course,Duration,Study mode,Approved intake,Course level,Course Fee,Approval,Eligiblity,Course_Detail
0,"All India Shri Shivaji Memorial Society's College of Hotel Management and Catering Technology, Pune",Pune,Maharashtra,BHMCT,4 years,Full time,60,UG,,(AICTE) All India Council of Technical Education,,
1,"All India Shri Shivaji Memorial Society's College of Hotel Management and Catering Technology, Pune",Pune,Maharashtra,MHMCT,2 years,Full time,24,PG,,(AICTE) All India Council of Technical Education,,
2,"Lady Amritbai Daga College for women of Arts Science and Commerce and Smt Ratnidevi Purohit College of Home Science and Home Science Technology, Nagpur",Nagpur,Maharashtra,BHMCT,4 years,Full time,,UG,,NCHMCT,"HSSC exam of MS Board or equivalent recognized exam, with Physics, Chemistry, Mathematics and English subjects Weightage will be given to Vocational Electronics courses Final admission will depend on merit/interview for Lateral Admission Anyone who holds a diploma in Electronics and Telecommunications or Diploma in Electronics or Diploma in Computers or Diploma in Information Technology form anyone of the polytechnics in Maharashtra state shall be eligible for admission to second year of Bachelor of Applied Electronics and Software Technology",Bachelor of Hotel Management and Catering Technology is a four year full time course.
3,"Utkal University of Culture, Bhubaneswar",Jagasarapatna,Odisha,BHM,4 years,Full time,,UG,,UGC,Candidate must have passed 10+2 in any stream from recognized board,Bachelor in Hotel Management is full time four year undergraduate degree course
4,"Utkal University of Culture, Bhubaneswar",Jagasarapatna,Odisha,MHM,,Full time,,PG,,UGC,Candidate must have passed BHM Degree or Any Graduate or equivalent degree from recognized University,Master of Hotel Management is full time two year course
5,"Indira Gandhi National Tribal University, Amarkantak",Lalpur,Madhya Pradesh,BA Tourism,3 years,Full time,60,UG,,UGC,Minimum eligibility 10+2 or equivalent.,It is 3 year full time course.
6,"BJB Autonomous College, Bhubaneswar",Bhubaneswar,Odisha,MA Tourism and Hospitality Management,2 years,Full time,30,PG,0.6 lakhs,UGC,Minimum 40% aggregate at the 3 year Bachelor’s Degree Examination in any stream from a recognized College /University,"Tourism & Hospitality Management (THM) is a multidisciplinary field of study with the purpose of preparing people with the expertise, commitment, and skills for management, marketing, and operations positions in the expanding industry that provides food, accommodations, and tourism services to people away from home.
A Masters in Tourism and Hospitality Management ...See More"
7,"Kapol College, Mumbai",Mumbai,Maharashtra,B. Sc Hotel Management,3 years,Full time,,UG,,YCMOU,Any student who has successfully completed any 10+2 level examination with minium 45% marks (40% in case of SC/ST candidates) from any Government recognized Board in India is eligible to enroll for the Graduate programme.,3 - years full - time Degree course
8,"Kapol College, Mumbai",Mumbai,Maharashtra,B. Sc Hotel Management and Catering,3 years,Full time,,UG,,YCMOU,"Any Student who has successfully completed any 10+2 level examination, from any Government recognized Board of University in India is eligible to enroll for the Graduate Programme. A student who has not completed the 10+2 level can appear for a preparatory conducted by the University.",3 years full time Degree course.
9,"Madhav University, Sirohi",Bharja,Rajasthan,B.Sc Hotel Management,3 years,Full time,60,UG,,,The candidate should have passed 12th any stream.,Bachelor of Science in Hotel Management is three-years duration full-time course.
10,"Madhav University, Sirohi",Bharja,Rajasthan,Diploma in Hotel Management,2 years,Full time,60,Diploma,,,The candidate should have passed 12th any stream.,Diploma in Hotel Management is two-year duration full-time course.
11,"Madhav University, Sirohi",Bharja,Rajasthan,MHMCT,2 years,Full time,60,PG,,,The candidate should have passed BHMCT.,Master of Hotel Management and Catering Technology is two-year duration full-time course.
12,"North East Frontier Technical University, West Siang",Aalo,Arunachal Pradesh,B.Sc Hospitality Management,3 years,Full time,,UG,,,The candidate should have passed 10+2 from recognized board.,Bachelor of Science in Hospitality Management is three-years duration full-time course.
13,"North East Frontier Technical University, West Siang",Aalo,Arunachal Pradesh,B.Sc Tourism Management,3 years,Full time,,UG,,,The candidate should have passed 10+2 from recognized board.,Bachelor of Science in Tourism Management is three-years duration full-time course.
14,"North East Frontier Technical University, West Siang",Aalo,Arunachal Pradesh,BHMCT,3 years,Full time,,UG,,,The candidate should have passed 10+2 from recognized board.,Bachelor Of Hotel Management And Catering Technology is four-years duration full-time course.
15,"Sri Satya Sai University of Technology and Medical Sciences, Sehore",Sehore,Madhya Pradesh,BHMCT,4 years,Full time,60,UG,2.4 lakhs,(AICTE) All India Council of Technical Education,"The candidate should have passed 10+2 or its equivalent with 45% (UR), 40%(ST/SC/OBC).",Bachelor of Hotel Management and Catering Technology is four-years duration full-time course.
16,"Institute of Management Research and Technology, Nashik",Nashik,Maharashtra,PGDHM,2 years,Full time,,PG,,,Graduate in any faculty of a recognized Statutory University or Diploma of DTE /State or central Gov. ( Post SSC 3 years Diploma with 2 years post Diploma experience or Post HSC 2 years Diploma with one year post Diploma Experience.),This is a two year full time Programme leading to a Master Degree in Management.
17,"St Philomena's College, Mysore",Mysuru,Karnataka,BTHM,3 years,Full time,,UG,,UGC,Pass in Pre-University Course of Karnataka State or equivalent in any stream. A course with practical hands on experience in various aspects of hotel management.,"Bachelor of Tourism and Hospitality Management is three-year duration full-time course approved University Grants Commission and affiliated to University of Mysore, Mysore."
18,"Bhupal Nobles University, Udaipur",Udaipur,Rajasthan,BA Tourism Management,3 years,Full time,,UG,,UGC,The candidate should have passed in 10+2 from any stream with 50%.,"This is a full time three year course affiliated to Bhupal Nobles University, Udaipur and approved by UGC."
19,"Bhupal Nobles University, Udaipur",Udaipur,Rajasthan,BHM,4 years,Full time,,UG,,UGC,The candidate should have passed in 10+2 from any stream with 50%.,"This is a full time four year course affiliated to Bhupal Nobles University, Udaipur and approved by UGC."
20,"Maya Institute of Technology and Management, Dehradun",Selakui,Uttarakhand,BHM,3 years,Full time,60,UG,,,"10+2 , 45% with any stream",Bachelor Hotel Management is a three-year full-time course.
21,"Chandravati Group of Institution, Bharatpur",Bharatpur,Rajasthan,BHMCT,4 years,Full time,60,UG,1.4 lakhs,(AICTE) All India Council of Technical Education,The candidate should have passed in 10+2 with the relevant subject in any recognized board.,"Approved by AICTE and affiliated to Rajasthan Technical University, Kota, the only AICTE approved hotel Management College in Bharatpur division; Chandravati Hotel Management College has a wide mission to provide educational program in Hotel and Tourism Management of the highest quality by keeping the current and future needs of India and abroad in mind.
Run on the b...See More"
22,"Welcomgroup Graduate School of Hotel Administration, Manipal University, Manipal",Manipal,Karnataka,BAHM,3 years,Full time,180,UG,2.2 lakhs,(AICTE) All India Council of Technical Education,A pass in 10+2 or an equivalent examination approved by Manipal University with 40% marks.2.1.2 Eligible NRI/Foreign students are admitted based on their qualifying,Bachelor of Arts in Hotel Management is a 3 year degree course in hotel management</p>
23,"Mahatama Gandhi Vidyamandir's College of Hotel Management and Catering Technology, Nashik",Nashik,Maharashtra,BHMCT,4 years,Full time,40,UG,3.28 lakhs,(AICTE) All India Council of Technical Education,12th (H.S.C) Examination or its equivalent with minimum of 45% marks for open category candidate and 40% marks for reserved category candidate and MAH-HM-.CET,"Bachelor in Hotel Management & Catering Technology is full time four year under graduate course, approved by AICTE"
24,"Martin Luther Christian University, Shillong",Shillong,Meghalaya,Bachelor in Tourism Administration,3 years,Full time,,PG,1.54 lakhs,UGC,Pass in Higher Secondary (or equivalent+2 examination in any stream),"The Bachelors course will give an insight into the history and development of tourism and its impact in the economies of countries, some of which are predominantly dependent on tourism as a major industry. The course will also include areas of study in management, marketing, human resources, IT, entrepreneurship, current world issues amongst others."
25,"Martin Luther Christian University, Shillong",Shillong,Meghalaya,Master of Tourism Administration,2 years,Full time,,PG,,UGC,Any bachelor’s degree/BD/BTh,
26,"Karnataka Janapada Vishwavidyalaya, Shiggavi",Gotagodi,Karnataka,M.A Folk Tourism,2 years,Full time,,PG,0.09 lakhs,UGC,"A candidate, who has successfully completed Bachelor’s Degree programme or any other Degree programme of this University or of any other University recognized as equivalent thereto by this University, shall be eligible for admission to the post Graduates Programmes provided the candidate also satisfies the conditions like the minimum percentage of marks and other eligibility conditions as prescribed by the University from time to time.",
27,"University College, Kurukshetra University, Kurukshetra",Thanesar,Haryana,Bachelor in Tourism Management,3 years,Full time,45,UG,,UGC,10+2 examination in any discipline with English as one of the subjects.,"This is a full time three year course affiliated to Kurukshetra University, Kurukshetra and approved by UGC."
28,"Viva College, Virar",Virar,Maharashtra,Bachelor of Hotel and Tourism Management Studies,3 years,Full time,,UG,,,Minimum 45% for GENERAL Category & Minimum 40% for RESERVED Category in H.S.C. (Arts / Commerce / Science) or its equivalent in aggregate. B.SC.(H.S) is a three year full time Degree Affi liated to University of Mumbai.,It is a three year full time course.
