,College,City,State,Course,Duration,Study mode,Approved intake,Course level,Course Fee,Approval,Eligiblity,Course_Detail
0,"VLB Janakiammal College of Arts and Science, Coimbatore",Coimbatore,Tamil Nadu,B.Sc Catering Science and Hotel Management,3 years,Full time,,UG,,UGC,Candidate must have passed 10+2 in related stream from recognized board,B.Sc Catering Science and Hotel Management is full time three year undergraduate degree course
1,"Nehru Memorial College, Puthanampatti",Puthanampatti,Tamil Nadu,B.Sc Hotel Management and Catering Science,3 years,Full time,,UG,,UGC,The candidate should have passed 10+2 from recognized board.,"Bachelor of Science in Hotel Management and Catering Science is three-years duration full-time course affiliated to Bharathidasan University, Tiruchirappalli and approved by University Grants Commission."
2,"Nehru Memorial College, Puthanampatti",Puthanampatti,Tamil Nadu,Post Graduate Diploma in Hotel Management and Catering Science,1 year,Full time,,PG,,UGC,The candidate should have Graduation degree from any recognized University.,"Post Graduate Diploma in Hotel Management and Catering Science is one-year duration full-time course affiliated to Bharathidasan University, Tiruchirappalli and approved by University Grants Commission."
3,"Inspiria Knowledge Campus, Siliguri",Siliguri,West Bengal,Bachelor in Hospitality Management,3 years,Full time,,UG,,,Candidates applying for admission in Bachelor in Hospitality Management should have passed 10+2 from any board with English as a subject. Students from any stream can apply.,"Bachelor in Hospitality Management (BHM) is designed to build your management skills through hands-on training, internships and innovative business courses. This program will prepare you to enter a wide range of management positions in the hospitality industry"
4,"Sai Nath College, Agra",Agra,Uttar Pradesh,B.Sc Hotel Management,3 years,Full time,,UG,,UGC,The candidate should have passed in 10+2.,"This is a three year full time course degree offered By Sai Nath University, Ranchi and Approved By UGC."
5,"GitaRam Institute of Management, Berhampore",Berhampore,West Bengal,BHM Hons,3 years,Full time,,UG,,,Any student who has passed 10+2 (General/Vocational) examinaton with English/Functional Engilish is eligible for admission.,"Course Content:
Some of the subjects which are taught in the course are Health Care Planing, Hospital Administration, Organization and management, Personnel Management, Concept of Epidemiology (Public health Administration), Anatomy, Physiology and Medical Terminology, Financial Management, Inventory Control, Behavioral Science, Health Management, Information Techn...See More"
6,"Subhas Bose Institute of Hotel Management, Kolkata",Kolkata,West Bengal,BHM,3 years,Full time,,UG,,UGC,"10+2 passed or appeared in any stream from any recognized or Govt.Boards, within 17 to 24 Years old.",This is a full-time three-year course.
7,"Subhas Bose Institute of Hotel Management, Kolkata",Kolkata,West Bengal,BBM,3 years,Full time,,UG,,UGC,"10+2 passed or appeared in any stream from any recognized or Govt.Boards, within 17 to 24 Years old.",This is a full-time three-year course.
8,"Subhas Bose Institute of Hotel Management, Kolkata",Kolkata,West Bengal,MBA Hotel Management,2 years,Full time,,PG,,UGC,Graduation from a recognised university in any stream within the age of 19-26 years.,This is a full-time two-year course.
9,"Subhas Bose Institute of Hotel Management, Kolkata",Kolkata,West Bengal,MHM,2 years,Full time,,PG,,UGC,Graduation from a recognised university in any stream within the age of 19-26 years.,This is a full-time two-year course.
10,"Apex Professional University, Pasighat",Pasighat,Arunachal Pradesh,B.Voc Hotel Management,3 years,Full time,,UG,0.72 lakhs,UGC,10+2 or equivalent,"Bachelor of Vocational in Hotel Management is a full-time three-year course affiliated to Apex Professional University, Pasighat and approved by UGC."
11,"Apex Professional University, Pasighat",Pasighat,Arunachal Pradesh,Diploma in Hospital Management Part Time,1 year,Part Time,,Diploma,0.16 lakhs,,10+2 or equivalent,"Diploma in Hospital Management is part time one year course diploma offered by Apex Professional University, Pasighat."
12,"Apex Professional University, Pasighat",Pasighat,Arunachal Pradesh,PGD Hospitality Management,1 year,Full time,,Diploma,0.24 lakhs,UGC,Bachelor degree or equivalent,"Post Graduate Diploma in Hospitality Management is full time one year course degree offered by Apex Professional University, Pasighat and approved by UGC."
13,"Apex Professional University, Pasighat",Pasighat,Arunachal Pradesh,PGD Tourism,1 year,Full time,,Diploma,0.24 lakhs,UGC,Bachelor degree or equivalent,"Post Graduate Diploma in Tourism is full time one year course degree offered by Apex Professional University, Pasighat and approved by UGC."
14,"ABS Academy of Science Technology and Management, Durgapur",Durgapur,West Bengal,Bachelor of Hospitality Management,3 years,Full time,,UG,6.37 lakhs,,H.S; 10+2 OR equivalent examination in any stream.,"Objectives: Three Yrs. Degree Course. Unparalleled growth in global demand in the Hospitality sector has generated unprecedented demand for professionals in this sector.
The chance to see the world has always fascinated mankind. A degree in hospitality hands you the key to the global scene. At ABS Academy interaction with professionals from the arena of hospitality...See More"
15,"Dr IT Institute of Management, Chandigarh",Chandigarh,Chandigarh,B.Sc Airlines Tourism and Hospitality Management,3 years,Full time,40,UG,,(AICTE) All India Council of Technical Education,"All those candidates who have passed the 10+2 or its equivalent examination in any stream conducted by a recognized Board / University / Council.
Or
Those candidates who have passed their Matriculation examination and have also passed three year Diploma in any Trade from Punjab State Board of Technical Education & Industrial Training, Chandigarh or such Examination from any other recognized State Board of Technical Education, or Sant Longowal Institute of Engineering & Technology, Longowal","Bachelor of Science in Airlines Tourism and Hospitality Management is three-years duration full-time course affiliated to Punjab Technical University, Jalandhar."
16,"RVS College of Arts and Science, Karaikal",Kalikuppam,Puducherry,B.Sc Catering Science and Hotel Management,3 years,Full time,,UG,,(AICTE) All India Council of Technical Education,A pass in Higher Secondary exam / Equivalent.,"Bachelor of Catering Science and Hotel Management is a full-time three year course affiliated to Bharathiar University, Coimbatore and approved by AICTE."
17,"Government Polytechnic, Beronkhal Pauri Garhwal",Pauri Garhwal,Uttarakhand,Diploma in Hotel Management and Catering Technology,3 years,Full time,,Diploma,0.17 lakhs,(AICTE) All India Council of Technical Education,The Candidate should have passed 10+2 for admission in this course.,Diploma in Hotel Management and Catering Technology is 3 years fulltime course and it is approved by AICTE.
18,"Institute of Hotel Management Studies, Kotdwar",Kotdwara,Uttarakhand,BHM,4 years,Full time,90,PG,,UGC,The candidate should have passed in 10+2 in any discipline with English as a subject.,Bachelor of Hotel Management is a 4 year full time course.
19,"Sri Vijay Vidyalaya College of Arts and Science, Dharmapuri",Nallampalli,Tamil Nadu,B.Sc Hotel Management and Catering Science,3 years,Full time,50,UG,,UGC,The candidate should have passed in 10+2 science stream.,B.Sc Hotel Management and Catering Science is full time three year undergraduate degree course
20,"Global Institute of Hotel Management, Hyderabad",Hyderabad,Telangana,BHMCT,3 years,Full time,100,PG,,NCHMCT,The candidate should have passed in 10+2 any stream.,Bachelors In Hotel Management And Catering Technology is a 3 year full time course.
21,"Chennai National Arts and Science College, Chennai",Avadi,Tamil Nadu,B.Sc Hotel and Catering Management,3 years,Full time,,UG,,,The candidate should have passed 10+2 level with related combination.,"Bachelor of Science in Hotel and Catering Management is three years full time course and affiliated to University of Madras, Chennai."
22,"Holy Cross Institute of Management and Technology, Calicut",Kozhikode,Kerala,B.Sc Hotel Management and Catering Science,3 years,Full time,,UG,1.98 lakhs,,The candidate should have passed the 10+2 with 50% marks.,"B.Sc Hotel Management and Catering Science is 3-year duration full-time course affiliated to University of Calicut, Malappuram."
23,"Holy Cross Institute of Management and Technology, Calicut",Kozhikode,Kerala,Diploma in Hotel Management and Catering Science,1 year,Full time,,Diploma,,,"The candidate should have passed SLC and above
Age Limit: 25 Years","It is 1-year duration full-time English medium course affiliated to University of Calicut, Malappuram."
24,"MS College of Arts Science Commerce and BMS, Thane",Thane,Maharashtra,BHM,4 years,Full time,,UG,,NCHMCT,The candidate should have passed in 10+2 related stream.,Bachelor Hotel Management is a 4 year full time course.
25,"MS College of Arts Science Commerce and BMS, Thane",Thane,Maharashtra,Diploma in Travel and Tourism Management,2 years,Full time,,Diploma,,,The candidate should have passed in 10+2 related stream.,Diploma in Travel and Tourism Management is a 2 year full time course.
26,"Oriental College of Hotel Management and Culinary Arts, Wayanad",Kunnathidavaka,Kerala,B.Sc Hospitality and Hotel Administration,3 years,Full time,,UG,2.33 lakhs,NCHMCT,The candidate should have passed 10+2 level with related combination.,"Bachelor of Science in Hospitality and Hotel Administration is three years full time course. Approved by National Council for Hotel Management and Catering Technology and affiliated to University of Calicut, Malappuram."
27,"Oriental College of Hotel Management and Culinary Arts, Wayanad",Kunnathidavaka,Kerala,B.Sc Hotel Management and Catering Science,3 years,Full time,36,UG,2.1 lakhs,,Minimum qualification for admission to the above course is a pass in the examination of 10+2 system of Senior Secondary education or its equivalent with 50% marks. Those who are waiting for the result also can apply.,"Bachelor of Science in Hotel Management and Catering Science is three years full time course and affiliated to University of Calicut, Malappuram."
28,"Oriental College of Hotel Management and Culinary Arts, Wayanad",Kunnathidavaka,Kerala,B.Sc Hotel Management and Culinary Arts,3 years,Full time,36,UG,2.1 lakhs,,Minimum qualification for admission to the above course is a pass in the examination of 10+2 system of Senior Secondary education or its equivalent. Those who are waiting for the result also can apply.,"Bachelor of Science in Hotel Management and Culinary Arts is three years full time course and affiliated to University of Calicut, Malappuram."
29,"Oriental College of Hotel Management and Culinary Arts, Wayanad",Kunnathidavaka,Kerala,BHA,3 years,Full time,,UG,1.92 lakhs,,Minimum qualification for admission to the above course is a pass in the examination of 10+2 system of Senior Secondary education or its equivalent. Those who are waiting for the result also can apply.,"Bachelor of Hotel Administration is three years full time course and affiliated to University of Calicut, Malappuram."
30,"Oriental College of Hotel Management and Culinary Arts, Wayanad",Kunnathidavaka,Kerala,BHM,4 years,Full time,,UG,2.52 lakhs,(AICTE) All India Council of Technical Education,Minimum qualification for admission to the above course is a pass in the examination of 10+2 system of Senior Secondary education or its equivalent. Those who are waiting for the result also can apply. Selections / Admissions are based on the performance in the Written Test and interview conducted by the University of Calicut at the Institute on a date notified by the University.,"Bachelor in Hotel Management is four years full time course. Approved by AICTE and affiliated to University of Calicut, Malappuram."
31,"Oriental College of Hotel Management and Culinary Arts, Wayanad",Kunnathidavaka,Kerala,MHM,2 years,Full time,,PG,1.52 lakhs,,Any candidate who has passed degree in Tourism or Hotel Management or in both from University of Calicut or the same degree of any other University or Institute in any state recognized by UGC or AICTE with a minimum of 45% marks is eligible for admission. The 70% of the total seats are reserved for above graduates. The remaining 30% are reserved for the candidates who have passed degree from any other stream with a minimum of 45% marks.,"Master Of Hotel Management is two years full time course and affiliated to University of Calicut, Malappuram"
32,"Kodaikanal Christian College, Kodaikanal",Kodaikanal,Tamil Nadu,B.Sc Hotel Management and Catering Science,3 years,Full time,,UG,,UGC,The candidate should have passed in 10+2 with the relevant subject.,"Bachelor of Science in Hotel Management and Catering Science is a full-time three year course affiliated to Madurai Kamaraj University, Madurai and approved by UGC."
