,College,City,State,Course,Duration,Study mode,Approved intake,Course level,Course Fee,Approval,Eligiblity,Course_Detail
0,"Srinivas College of Hotel Management, Mangalore",Pandeshwar,Karnataka,BHM,4 years,Full time,100,UG,1.62 lakhs,(AICTE) All India Council of Technical Education,"The candidate who has passed the two year Pre-University Examination in any general or vocational stream (class XII or 10+2) Examination conducted by the Pre-University Education Board in the State of Karnataka or any other Board considered equivalent thereto by Mangalore University with a minimum of 45% marks in the aggregate is eligible (40% in the case of SC/ST).
Documents to be provided by the student during admission of BHM course","Bachelors Degree in Hotel Management is a four year full time course affiliated by Mangalore University, Mangalore"
1,"Udupi Institute of Hotel and Tourism Science, Udupi",Udupi,Karnataka,B.Sc Hospitality Sciences,3 years,Full time,,UG,,Government of Karnataka,The candidate should have passed in 10+2 science stream,"B.Sc Hospitality Sciences is a three year full time course affiliated by Mangalore University, Mangalore"
2,"Udupi Institute of Hotel and Tourism Science, Udupi",Udupi,Karnataka,B.Sc Hospitality Sciences with Aviation and Hospitality Management,3 years,Full time,,UG,,Government of Karnataka,The candidate should have passed in 10+2 science stream,"B.Sc Hospitality Sciences with Aviation and Hospitality Management is a three year full time course affiliated by Mangalore University, Mangalore"
3,"Udupi Institute of Hotel and Tourism Science, Udupi",Udupi,Karnataka,PGD Hotel and Tourism Management,1 year,Full time,,PG,,Government of Karnataka,The candidate should have passed in any graduate degree,"PGD Hotel and Tourism Management is a one year full time course affiliated by Mangalore University, Mangalore"
4,"Vijayalakshmi Institute of Hospitality Sciences, Mangalore",Mangalore,Karnataka,B.Sc Hospitality Sciences,3 years,Full time,,UG,,,The candidate seeking admission to B.Sc. (H.S) Degree course must have passed the Pre-University (Class 12th or 10+2) examination or its equivalent with an aggregate of 35% marks,"B.Sc Hospitality Sciences is a three year full time course affiliated by Mangalore University, Mangalore"
5,"BMS Evening College of Engineering, Bengaluru",Bengaluru,Karnataka,BHM,3 years,Full time,,UG,1.25 lakhs,,Any Student who has passed 10+2 examination with English / Functional English (in CBSE) is Eligible for Admission.,Bachelor of Hospital Management (BHM) is a full time three years course affiliated to Maulana Abul Kalam Azad University of Technology.
6,"BMS Evening College of Engineering, Bengaluru",Bengaluru,Karnataka,BHSM,3 years,Full time,,UG,1.25 lakhs,,Any Student who has passed 10+2 examination with English / Functional English (in CBSE) is Eligible for Admission.,Bachelor of Hospitality Management (BHSM) is a full time three years course affiliated to Maulana Abul Kalam Azad University of Technology.
7,"SJVP College Autonomous, Harihar",Harihar,Karnataka,BA Tourism,3 years,Full time,,UG,,,The Candidate should have passed 10+2 in relevant stream or equivalent from recognized board.,"BA Tourism is three-year duration full-time course affiliated to Davangere University, Davangere."
8,"KL University Business School, Guntur",Guntur,Andhra Pradesh,BHM,3 years,Full time,,UG,2.85 lakhs,,Any candidate who has passed HSC (10+2)/intermediate/any other equivalent through Arts/ science/ commerce/Vocational - any stream can apply for the above named courses. Aggregate marks min. 45% in Std.XII/intermediate any stream.,"Bachelor of Hotel Management (BHM) is three-year duration full-time course offered by K L University, Guntur."
9,"KL University Business School, Guntur",Guntur,Andhra Pradesh,BHM Catering Technology,4 years,Full time,,UG,3.75 lakhs,,Any candidate who has passed HSC (10+2)/intermediate/any other equivalent through Arts/ science/ commerce/Vocational - any stream can apply for the above named courses. Aggregate marks min. 45% in Std.XII/intermediate any stream.,"Bachelor of Hotel Management - Catering Technology is four-year duration full-time course offered by K L University, Guntur."
10,"International Institute of Hotel Management, Visakhapatnam",Visakhapatnam,Andhra Pradesh,BHM,3 years,Full time,,UG,,,The candidate should have passed 10+2 / Inter any group.,"Bachelor of Hotel Management (BHM) is three-year duration including six months IT in five hotels and affiliated to Dravidian University, Kuppam."
11,"International Institute of Hotel Management, Visakhapatnam",Visakhapatnam,Andhra Pradesh,Diploma in Hotel Management,3 years,Full time,,Diploma,,,The candidate should have passed S.S.C / 10th class.,Diploma in Hotel Management is three-year duration including six months IT in five hotels.
12,"International Institute of Hotel Management, Visakhapatnam",Visakhapatnam,Andhra Pradesh,Diploma in Hotel Management and Catering Technology,1.5 years,Full time,,Diploma,,,The candidate should have passed S.S.C / 10th class.,Diploma in Hotel Management and Catering Technology is 1.5 year duration including six months IT in five hotels.
13,"International Institute of Hotel Management, Visakhapatnam",Visakhapatnam,Andhra Pradesh,Diploma in Hotel Management and Tourism,1.5 years,Full time,,Diploma,,,The candidate should have passed S.S.C / 10th class.,Diploma in Hotel Management and Tourism is 1.5 year duration including six months IT in five hotels.
14,"International Institute of Hotel Management, Visakhapatnam",Visakhapatnam,Andhra Pradesh,Post Diploma in Hotel Management and Tourism,1.5 years,Full time,,Diploma,,,The candidate should have passed 10+2 / Inter any group.,Post Diploma in Hotel Management and Tourism is 1.5 year duration including six months IT in five hotels.
15,"International Institute of Hotel Management, Visakhapatnam",Visakhapatnam,Andhra Pradesh,Post Graduate Diploma in Hotel Management and Catering Technology,1.5 years,Full time,,Diploma,,,The candidate should have passed degree any group.,Post Graduate Diploma in Hotel Management and Catering Technology is 1.5 year duration including six months IT in five hotels.
16,"International Institute of Hotel Management, Visakhapatnam",Visakhapatnam,Andhra Pradesh,Post Graduate Diploma in Hotel Management and Tourism,1.5 years,Full time,,Diploma,,,The candidate should have passed degree any group.,Post Graduate Diploma in Hotel Management and Tourism is 1.5 year duration including six months IT in five hotels.
17,"DSMS College of Tourism and Management, Durgapur",Durgapur,West Bengal,BBA Tourism and Hospitality,3 years,Full time,,UG,,UGC,Candidates must be 10+2 passed in any discipline from a recognized board of education.,Bachelor of Business Administration (BBA) Tourism and Hospitality is a full-time three years course affiliated to Kazi Nazrul University.
18,"George College, Sealdah",Kolkata,West Bengal,BBA Hospital Management,3 years,Full time,90,UG,1 lakh,,Any student who has passed 10+2 Examination with English as a subject is eligible for admission.,Bachelor of Business Administration in Hospital Management is a full-time three years course affiliated to Maulana Abul Kalam Azad University of Technology.
19,"NSHM College of Management and Technology, Durgapur",Durgapur,West Bengal,BBA Hotel Management,3 years,Full time,120,UG,,,10+2 passed from any board with English as a subject. Students from any stream can apply. Candidates appearing for Class XII final can also apply,Bachelor in Business Administration (BBA) in Hotel Management is a full-time three years course affiliated to Maulana Abul Kalam Azad University of Technology.
20,"NSHM College of Management and Technology, Durgapur",Durgapur,West Bengal,BHM,4 years,Full time,60,UG,,,10+2 passed from any board with English as one of the subjects.,Bachelor of Hotel Management (BHM) is a full-time four years course affiliated to Maulana Abul Kalam Azad University of Technology.
21,"Golden Regency Institute of Hospitality Management, Haldia",Haldia,West Bengal,BHM,4 years,Full time,60,UG,,UGC,Candidates must be 10+2 passed in any discipline with a minimum mark of 50% in aggregate from a recognized board of education.,Bachelor of Hotel Management (BHM) is a full-time four years course affiliated to Maulana Abul Kalam Azad University of Technology.
22,"Kotibarsha Institute of Technology and Management, Buniadpur",Buniadpur,West Bengal,BHM,3 years,Full time,,UG,3.76 lakhs,,Candidates seeking admission to Bachelor in Hospital Management should have passed the Higher Secondary Examination with English as a subject.( 75 % Seats are reserved for Girls ).,Bachelor in Hospital Management (BHM) is a full time three years course affiliated to Maulana Abul Kalam Azad University of Technology.
23,"Kotibarsha Institute of Technology and Management, Buniadpur",Buniadpur,West Bengal,BHSM,3 years,Full time,,UG,5.56 lakhs,,Candidates must be 10+2 passed in any discipline from a recognized board of education.,Bachelor in Hospitality Management (BHSM) is a full time three years course affiliated to Maulana Abul Kalam Azad University of Technology.
24,"NIMAS, Kolkata",Kolkata,West Bengal,BHM,4 years,Full time,,UG,2.65 lakhs,,"Higher Secondary or equivalent examination (CBSE, ISCE, A Levels or any other equivalent Board examination) with English as a compulsory subject.
Students who are due to appear for Class XII final exams may be given provisional admission.","Bachelor in Hotel Management is a four year full time course affiliated to Maulana Abul Kalam Azad University of Technology, Kolkata."
25,"Gurukul Management Studies, Kolkata",Kolkata,West Bengal,BHM,3 years,Full time,,UG,,,Pass 10+2 with any stream.,"Bachelor of Hotel Management is a three year full time course affiliated to Maulana Abul Kalam Azad University of Technology, Kolkata."
26,"Gurukul Management Studies, Kolkata",Kolkata,West Bengal,Bachelor in Hospital Management,3 years,Full time,,UG,,,Any student who has passed 12th standard in any Stream can join the BHM course.,"Bachelor in Hospital Management is a three year full time course affiliated to Maulana Abul Kalam Azad University of Technology, Kolkata."
27,"Dolphin School of Hotel Management, Nadia",Haringhata,West Bengal,BHM,4 years,Full time,,UG,,,10+2 Passed or equivalent.,"Bachelor of Hospitality Management is a four year full time course affiliated to Maulana Abul Kalam Azad University of Technology, Kolkata."
28,"Institute of Hotel and Restaurant Management, Kolkata",Rajpur Sonarpur,West Bengal,BHM,4 years,Full time,60,UG,,,Students having passed 12th standard and having English as one of the subject.,"Bachelor of Hotel Management is a four year full time course affiliated to Maulana Abul Kalam Azad University of Technology, Kolkata."
29,"Global Group of Institutions, Haldia",Haldia,West Bengal,BHM,4 years,Full time,90,UG,,,10+2 passed in any stream from recognized Central or State Board.,"Bachelor in Hotel Management is a four year full time course affiliated to Maulana Abul Kalam Azad University of Technology, Kolkata."
30,"Contai College of Learning and Management Science, Purba Medinipur",Contai,West Bengal,BHM Hons,4 years,Full time,30,UG,,,10+2 passed.,"Bachelor in Hospitality Management Honours is a four year full time course affiliated to Maulana Abul Kalam Azad University of Technology, Kolkata."
31,"Sheela Devi Institute of Management and Technology, Faridabad",Gharora,Haryana,BHM,4 years,Full time,,UG,,,Candidates must be 10+2 passed in any discipline from a recognized board of education.,Bachelor of Hotel Management (BHM) is a full time four years course affiliated to Maharshi Dayanand University.
32,"Institute of Hotel Management Catering and Tourism, Udaipur",Lai,Rajasthan,BHM,4 years,Full time,,UG,,NCHMCT,The candidate should have passed in 10+2 Any stream.,"Bachelor in Hotel Management is a four year full time course affiliated by Mohanlal Sukhadia University, Udaipur"
33,"Institute of Hotel Management Catering and Tourism, Udaipur",Lai,Rajasthan,PGD Tourism and Hotel Management,1 year,Full time,,PG,,NCHMCT,The candidate should have passed in Graduation (Any stream),"Post Graduate Diploma in Tourism and Hotel Management is a one year full time course affiliated by Board of Technical Education, Rajasthan"
34,"US Ostwal Institute of Hotel Management, Chittorgarh",Mangalwad,Rajasthan,BHMCT,4 years,Full time,60,UG,,(AICTE) All India Council of Technical Education,12 /10+2/Higher Secondary from Any Stream.,Bachelor of Hotel Management and Catering Technology (BHMCT) is a Four-year full-time course approved by AICTE.
35,"Government College for Women, Faridabad",Faridabad,Haryana,BTM,3 years,Full time,,UG,,UGC,Candidates must be 10+2 passed in any discipline from a recognized board of education.,Bachelor of Tourism Management (BTM) is a full time three years undergraduate course affiliated to Maharshi Dayanand University.
36,"Ch Mani Ram Godara Government College for Women, Bhodia Khera",Bhodia Khera,Haryana,BTHM,3 years,Full time,,UG,,,Candidates must be 10+2 passed in any discipline from a recognized board of education.,Bachelor of Tourism and Hotel Management (BTHM) is a full time three years course affiliated to Chaudhary Devi Lal University.
37,"KM Government College, Jind",Narwana,Haryana,BTM,3 years,Full time,,UG,,,The Candidate should have passed 10+2 in relevant stream or equivalent from recognized board.,"Bachelor of Tourism Management (BTM) is three year duration full time course affiliated to Kurukshetra University, Kurukshetra."
38,"SKVT College, Rajahmundry",Rajahmundry,Andhra Pradesh,B.Sc Hospitality Studies,3 years,Full time,,UG,,UGC,The candidate should have passed in 10+2 relevant subject for any recognized board.,"This is a full time three year course affiliated to Adikavi Nannaya University, Rajahmundry and approved by University Grants Commission."
39,"Garden City College of Science and Management Studies, Bangalore",Bengaluru,Karnataka,BHM,3 years,Full time,60,UG,,,The candidate should have passed in 10+2 relevant subject for any recognized board.,"Bachelor of Hotel Management is a three year full time course affiliated to Bangalore University, Bangalore."
40,"Government PG College, Berkhera",Bhopal,Madhya Pradesh,PGD Tourism and Hotel Management,1 year,Full time,40,PG,0.16 lakhs,,The candidate should have passed in graduation relevant subject for any recognized university.,"Post Graduate Diploma in Tourism and Hotel Management is a one year full time course affiliated to Barkatullah University, Bhopal."
41,"Swayam Siddhi Mitra Sangh's Degree College, Bhiwandi",Bhiwandi,Maharashtra,B.Sc Hospitality Studies,3 years,Full time,,UG,,UGC,The candidate should have passed in 10+2 science stream for any recognized board.,"This is a full-time three-year course affiliated to University of Mumbai, Mumbai and approved by University Grants Commission."
42,"Indian School of Hospitality, Gurugram",Gurugram,Haryana,BHM,4 years,Full time,,UG,,,"The minimum eligibility to apply to the Indian School of Hospitality undergraduate programmes is the following: In the case of Higher Secondary School Certificate or State Boards, CBSE and ICSE, 40% marks in 12th standard with English as one of the subjects is the minimum requirement.In the case of International Baccalaureate students, a diploma is the minimum requirement. International Baccalaureate certificate students are not eligible for admission.In the case of Cambridge University students (GCE/IGCSE/GCSE examinations of the approved British Examination Bodies), ‘A’ Level certificate is the minimum requirement with 5 (Five) subjects in A, B, C Grades including English at Ordinary (‘O’) Level and 2/3 (Two/Three) subjects at Advanced Level.Candidates in their 12th standard or equivalent class can also apply, provided they would be completing their final examination before 30th May, and can produce their 12th passing certificate/mark sheet before 31st August. Admission of such a candidate shall be strictly provisional until they submit the qualifying certificates before the prescribed last date.","The programme offers an unrivalled business education that delivers a balance between theory and practice. The education is grounded in hospitality- the ultimate service business and ideal foundation for leadership training. ISH students learn how to succeed in business and how to tap into a range of key skills, including strategic thinking, big-picture orientation, as well as poise, charisma and emotional in"
43,"Indian School of Hospitality, Gurugram",Gurugram,Haryana,Bachelor of Travel and Tourism Management,4 years,Full time,,UG,,,"The minimum eligibility to apply to the Indian School of Hospitality undergraduate programmes is the following: In the case of Higher Secondary School Certificate or State Boards, CBSE and ICSE, 40% marks in 12th standard with English as one of the subjects is the minimum requirement.In the case of International Baccalaureate students, a diploma is a minimum requirement. International Baccalaureate certificate students are not eligible for admission.In the case of Cambridge University students (GCE/IGCSE/GCSE examinations of the approved British Examination Bodies), ‘A’ Level certificate is the minimum requirement with 5 (Five) subjects in A, B, C Grades including English at Ordinary (‘O’) Level and 2/3 (Two/Three) subjects at Advanced Level.Candidates in their 12th standard or equivalent class can also apply, provided they would be completing their final examination before 30th May, and can produce their 12th passing certificate/mark sheet before 31st August. Admission of such a candidate shall be strictly provisional until they submit the qualifying certificates before the prescribed last date.","Bachelor of Travel and Tourism Management is four years (8 Semester) Undergraduate program offered by Maharshi Dayanand University, Rohtak."
