,College,City,State,Course,Duration,Study mode,Approved intake,Course level,Course Fee,Approval,Eligiblity,Course_Detail
0,"Aligarh School of Nursing, Aligarh",Aligarh,Uttar Pradesh,Diploma in Nursing Ayurved,2 years,Full time,20,Diploma,,,The candidate should have passed in 10+2 with PCB and PCM.,"Diploma in Nursing Ayurved is full-time two-year course Affiliated to Ayurved and Unani Tibbi Chikitsa Padhati Board, Lucknow, U.P."
1,"Aligarh School of Nursing, Aligarh",Aligarh,Uttar Pradesh,Diploma in Optometry,2 years,Full time,30,Diploma,0.75 lakhs,(INC) Indian Nursing Council,The candidate should have passed in 10+2 with PCB and PCM.,"Diploma in Optometry is full time two year course affiliated to U.P. State Medical Faculty, Lucknow and recognized by Govt. of Uttar Pradesh."
2,"Aligarh School of Nursing, Aligarh",Aligarh,Uttar Pradesh,Diploma in Physiotherapy,2 years,Full time,30,Diploma,0.75 lakhs,Government of Uttar Pradesh,The candidate should have passed in 10+2 with PCB and PCM.,"Diploma in Physiotherapy is full time two year course affiliated to U.P. State Medical Faculty, Lucknow and recognized by Govt. of Uttar Pradesh."
3,"Bharati Vidyapeeth Homoeopathic Medical College, Pune",Pune,Maharashtra,BHMS,5.5 years,Full time,100,UG,6.32 lakhs,(CCH) Central Council of Homeopathy,"A candidate passing H.S.C science (10+2) or its equivalent examinations from recognized board and has secured at least 50% marks in physics , chemistry, biology(botany & zoology) together .and should have passed in the subject English in the said examination .Blind (including colour blind),deaf ∨ dumb
candidate shall not be allowed for admission in the course.","The degree courses of B.H.M.S. (Degree) shall comprise a course of study consisting of curriculum and syllabus. Provided in these regulations, spread over a period of 5 /2 years including compulsory internship of 1 year duration after passing the final degree examination."
4,"Bharati Vidyapeeth Homoeopathic Medical College, Pune",Pune,Maharashtra,MD Homeopathic Materia Medica,3 years,Full time,6,PG,3.7 lakhs,(CCH) Central Council of Homeopathy,"Bachelor of Homoeopathic Medicine and Surgery or equivalent qualification in Homoeopathy included in the Second Schedule to the Homoeopathy Central Council Act, 1973., after undergoing a course of study of not less than five years and six months duration including one year compulsory internship; OR Bachelor of Homoeopathic Medicine and Surgery (Graded Degree) or equivalent qualification in Homoeopathy included in the Second Schedule to the Homoeopathy Central Council Act, 1973, after undergoing a course of study of not less than two years duration.","This is full time three year course, recognized by Central Council of Homeopathy"
5,"Bharati Vidyapeeth Homoeopathic Medical College, Pune",Pune,Maharashtra,MD Homoeopathic Repertory,3 years,Full time,6,PG,3.7 lakhs,(CCH) Central Council of Homeopathy,"Bachelor of Homoeopathic Medicine and Surgery or equivalent qualification in Homoeopathy included in the Second Schedule to the Homoeopathy Central Council Act, 1973., after undergoing a course of study of not less than five years and six months duration including one year compulsory internship; OR Bachelor of Homoeopathic Medicine and Surgery (Graded Degree) or equivalent qualification in Homoeopathy included in the Second Schedule to the Homoeopathy Central Council Act, 1973, after undergoing a course of study of not less than two years duration.","This is full time three year course, recognized by Central Council of Homoeopathy"
6,"Bharati Vidyapeeth Homoeopathic Medical College, Pune",Pune,Maharashtra,MD Organon of Medicine,3 years,Full time,6,PG,3.7 lakhs,(CCH) Central Council of Homeopathy,"Bachelor of Homoeopathic Medicine and Surgery or equivalent qualification in Homoeopathy included in the Second Schedule to the Homoeopathy Central Council Act, 1973., after undergoing a course of study of not less than five years and six months duration including one year compulsory internship; OR Bachelor of Homoeopathic Medicine and Surgery (Graded Degree) or equivalent qualification in Homoeopathy included in the Second Schedule to the Homoeopathy Central Council Act, 1973, after undergoing a course of study of not less than two years duration.","This is full time three year course, recognized by Central Council of Homoeopathy"
7,"Bharati Vidyapeeth Homoeopathic Medical College, Pune",Pune,Maharashtra,MD Practice of Medicine,3 years,Full time,6,PG,3.7 lakhs,(CCH) Central Council of Homeopathy,"Bachelor of Homoeopathic Medicine and Surgery or equivalent qualification in Homoeopathy included in the Second Schedule to the Homoeopathy Central Council Act, 1973., after undergoing a course of study of not less than five years and six months duration including one year compulsory internship; OR Bachelor of Homoeopathic Medicine and Surgery (Graded Degree) or equivalent qualification in Homoeopathy included in the Second Schedule to the Homoeopathy Central Council Act, 1973, after undergoing a course of study of not less than two years duration.","This is full time three year course, recognized by Central Council of Homoeopathy"
8,"Hahnemann Homoeopathic Medical College and Hospital, Bhopal",Bhopal,Madhya Pradesh,BHMS,5.5 years,Full time,100,UG,,(CCH) Central Council of Homeopathy,"The student from all over the country who have passed 10+2 or equivalent examination with physics, chemistry and biology subjects from any recognized board/university are eligible for admission to first year of B.H.M.S course.","The college offer 5 ½ year course leading to the Degree of B.H.M.S ( Bachelor of Homoeopathy Medicine & Surgery awarded by the Barkatullah vishwavidyallaya , Bhopal"
9,"SKRP Gujarati Homoeopathic Medical College and Research Center, Indore",Indore,Madhya Pradesh,BHMS,5.5 years,Full time,,UG,,(CCH) Central Council of Homeopathy,"The candidate should have passed in 10+2 science stream with Physics, Chemistry and Biology",BHMS is a five and half year full time course
10,"Vasundhara Raje Homeopathic Medical College and Hospital, Gwalior",Gwalior,Madhya Pradesh,BHMS,5.5 years,Full time,100,UG,,(CCH) Central Council of Homeopathy,"Passed the Intermediate Science or its equivalent examination with Physics, Chemistry, and Biology as his subjects.
Attained the age of 17 years on or before 31st December & not more than 25 Years of the year of his admission to the first year of the Course
Blind (including colour blind), deaf and/or dumb candidates shall not be allowed for admission in the course""","Bachelor of Homoeopathic and Medicine Surgery is a five and half years (including 1-year internship) course Approved by CCH and Affiliated to Jiwaji university, Gwalior."
11,"Shri Ramnath Singh Homeopathic Medical College and Hospital, Bhind",Gwalior,Madhya Pradesh,BHMS,5.5 years,Full time,85,UG,,(CCH) Central Council of Homeopathy,"Candidate must have passed 12th standard under 10+2 scheme or Intermediate or Equivalent examination with Physics, Chemistry & Biology from a recognized Board/ University.
The candidate must have attained the minimum age of 17 years on or before 31st December of the year of his/her admission to the first year of the course. Candidate shall be selected on the basis of merit list of intermediate.
Admission will remain provisional till the proof of the Qualifying Examination and other Documents are submitted.","Bachelor of Homoeopathic Medicine and Surgery is Five and Half Years Full Time Course and Approved By Central Council of Homoeopathic and affiliated to Jiwaji University, Gwalior."
12,"Lord Mahavira Homoeopathic Medical College and Hospital, Ludhiana",Ludhiana,Punjab,BHMS,5.5 years,Full time,50,UG,3.6 lakhs,(CCH) Central Council of Homeopathy,"The Candidate should have passed 10+2 with Physics, Chemistry, Biology & English or its equivalent and the qualifying examination as a candidate from a recognized institution/ University before the time of counseling.","The Course of studies leading to the award of Degree of B.H.M.S.(Bachelor of Homoeopathic Medicine and Surgery) shall be of 5½ years academic years (Including one year of the compulsory rotatory internship) and is subject to the rules of the Guru Ravidas Ayurved University Punjab, Hoshiarpur, and the Central Council of Homoeopathy of India."
13,"White Memorial Homoeo Medical College, Kanyakumari",Attoor,Tamil Nadu,BHMS,4.5 years,Full time,100,UG,,(CCH) Central Council of Homeopathy,"H.Sc or Equivalent course with Physics, Chemistry and Biology / Botany and Zoology.
O.C: A Minimum of 50% marks in aggregate in the science subjects (viz) Physics, Chemistry, Biology or Botany and Zoology
B.C:- A Minimum of 45%marks in aggregate in the science subjects (viz) Physics, Chemistry, Biology or Botany and Zoology
M.B.C: A Minimum of 40% marks in aggregate in the science subjects (viz) Physics, Chemistry, Biology or Botany and Zoology
SC/ST: A Minimum of 35% marks in aggregate in the science subjects (viz) Physics, Chemistry, Biology or Botany and Zoology
Age Limit: The candidate should have completed 17 years at the time of admission.
Eligibility Certificate:
The candidate who has passed Higher Secondary Course Examination conducted by other than the Government of TamilNadu shall obtain an eligibiligy certificate from the Tamil Nadu Dr. M.G.R. Medical University, Chennai.","Bachelor of Homoeopathy Medicine and Surgery this course offered by Tamil Nadu Dr. M.G.R Medical University, Chennai and Recognized by the Central Council of Homoeopathy, New Delhi."
14,"Sarada Krishna Homoeopathic Medical College, Kulasekharam",Kulasekharam,Tamil Nadu,BHMS,5.5 years,Full time,100,UG,,(CCH) Central Council of Homeopathy,"A candidate should have completed the age of 17 years at the time of admission or would complete the said age on or before 31st December of the year of admission to the first BHMS degree course.
Candidates should have passed in all the subjects of the qualifying examination of the Higher Secondary Certificate Examination (Academic) conducted by the Tamil Nadu State Board in one and the same attempt in the following group of subjects with the minimum eligible marks. (Improvement marks will not be considered) Physics, Chemistry, Botany and Zoology (or) Physics, Chemistry, Biology with any other subject.
Other Communities
A minimum of 50% marks in aggregate in the Science subjects namely Physics, Chemistry, Biology or Botany and Zoology.
Backward Classes*
A minimum of 45% marks in aggregate in the Science subjects namely Physics, Chemistry, Biology or Botany and Zoology.
Most Backward Classes*
A minimum of 40% marks in aggregate in the Science subjects namely Physics, Chemistry, Biology or Botany and Zoology.
Scheduled Castes / Tribes
A minimum of 35% marks in aggregate in the Science subjects namely Physics, Chemistry, Biology or Botany and Zoology.","Bachelor of Homoeopathy Medicine and Surgery this course offered by Tamil Nadu Dr. MGR Medical University and approved by Central Council of Homoeopathy, New Delhi , Dept. of AYUSH, M/o. Health and Family Welfare, Govt. of India"
15,"Sarada Krishna Homoeopathic Medical College, Kulasekharam",Kulasekharam,Tamil Nadu,MD Hom Materia Medica,3 years,Full time,6,PG,,(CCH) Central Council of Homeopathy,"A Bachelor of Homoeopathic Medicine and Surgery or an equivalent qualification in Homoeopathy included in the Second Schedule to the HCC Act, after undergoing a course of study of not less than five years and six months' duration including one year compulsory internship OR A Bachelor of Homoeopathic Medicine and Surgery (Graded Degree) or an equivalent qualification in Homoeopathy included in the Second Schedule to the HCC Act after undergoing a course of study of not less than two years' duration.","The course shall be of 3 year's duration having two Parts I & II. Part I is of 18 months duration, out of which the first 12 months shall be of compulsory house job. Part II consists of 18 months devoted to speciality subjects."
16,"Sarada Krishna Homoeopathic Medical College, Kulasekharam",Kulasekharam,Tamil Nadu,MD Hom Practice of Medicine,3 years,Full time,6,PG,,(CCH) Central Council of Homeopathy,"A Bachelor of Homoeopathic Medicine and Surgery or an equivalent qualification in Homoeopathy included in the Second Schedule to the HCC Act, after undergoing a course of study of not less than five years and six months' duration including one year compulsory internship OR A Bachelor of Homoeopathic Medicine and Surgery (Graded Degree) or an equivalent qualification in Homoeopathy included in the Second Schedule to the HCC Act after undergoing a course of study of not less than two years' duration.","The course shall be of 3 year's duration having two Parts I & II. Part I is of 18 months duration, out of which the first 12 months shall be of compulsory house job. Part II consists of 18 months devoted to speciality subjects."
17,"Sarada Krishna Homoeopathic Medical College, Kulasekharam",Kulasekharam,Tamil Nadu,MD Hom Repertory,3 years,Full time,6,PG,,(CCH) Central Council of Homeopathy,"A Bachelor of Homoeopathic Medicine and Surgery or an equivalent qualification in Homoeopathy included in the Second Schedule to the HCC Act, after undergoing a course of study of not less than five years and six months' duration including one year compulsory internship OR A Bachelor of Homoeopathic Medicine and Surgery (Graded Degree) or an equivalent qualification in Homoeopathy included in the Second Schedule to the HCC Act after undergoing a course of study of not less than two years' duration.","The course shall be of 3 year's duration having two Parts I & II. Part I is of 18 months duration, out of which the first 12 months shall be of compulsory house job. Part II consists of 18 months devoted to speciality subjects."
18,"Martin Homoeopathy Medical College and Hospital, Coimbatore",Coimbatore,Tamil Nadu,BHMS,5.5 years,Full time,50,UG,,(CCH) Central Council of Homeopathy,"The candidates belonging to all categories for admission to the Bachelor of Homeopathic Medicine Course should have passed the qualifying examination (Academic Stream) after a period of 12 years of study with Physics, Chemistry and Biology (Botany/Zoology) subjects
A candidate should have completed the age of 17 years at the time of admission or would complete the said age on or before 31st December of the year of admission to the 1st B.H.M.S. Degree Course.
The academic year for the B.H.M.S course shall commence from 1st August of the year. The Medium of instruction for the B.H.M.S degree course shall be English.","The Bachelor of Homoeopathic Medicine and Surgery (B.H.M.S) course period is 5 1/2 Years including 1 Year Compulsory rotatory internship program.
The degree course is approved and affiliated to the Tamilnadu Dr. M.G.R. Medical University, Chennai."
19,"AM Shaikh Homoeopathic Medical College, Belgaum",Belagavi,Karnataka,BHMS,5.5 years,Full time,100,UG,,(CCH) Central Council of Homeopathy,"Students of Indian nationality should have passed the PUC II (10+2) in Science or equivalent examination with a minimum of 40% aggregate marks in Physics, Chemistry, and Biology. Priority will be given to that student whose medium of instruction is English and have a higher percentage in PCB.","Bachelor of Homoeopathic Medicine and Surgery is Five and Half Years Full Time Course and Approved By Central Council of Homeopathy and Affiliated By Rajiv Gandhi University of Health Sciences, Bangalore."
20,"Baroda Homoeopathic Medical College, Vadodara",Vadodara,Gujarat,BHMS,5.5 years,Full time,100,UG,,(CCH) Central Council of Homeopathy,"12th (HSC) Science and minimum requirement for admission includes passing marks in Physics, Chemistry. Biology with English and with compulsory GUJCAT score.",Bachelor of Homoeopathic Medicine and Surgery is a 5 and a half year course approved by Central Council of Homoeopathy.
21,"Baroda Homoeopathic Medical College, Vadodara",Vadodara,Gujarat,MD Hom Materia Medica,3 years,Full time,3,PG,,(INC) Indian Nursing Council,The candidate should have passed in BHMS.,MD Hom Materia Medica is a 3 years full time course approved by Central Council of Homoeopathy.
22,"Baroda Homoeopathic Medical College, Vadodara",Vadodara,Gujarat,MD Hom Organon of Medicine and Homoeopathic Philosophy,3 years,Full time,3,PG,,(CCH) Central Council of Homeopathy,The candidate should have passed in BHMS.,Md Hom Organon of Medicine and Homoeopathic Philosophy is a 3 years full time course approved by Central Council of Homoeopathy.
23,"Baroda Homoeopathic Medical College, Vadodara",Vadodara,Gujarat,MD Hom Repertory and Case Taking,3 years,Full time,3,PG,,(CCH) Central Council of Homeopathy,The candidate should have passed in BHMS.,Md Hom Repertory and Case Taking is a 3 years full time course approved by Central Council of Homoeopathy.
24,"Homeopathic Medical College and Hospital, Gulbarga",Kalaburagi,Karnataka,BHMS,5.5 years,Full time,100,UG,,(CCH) Central Council of Homeopathy,"A candidate must have passed the two years PUC examination or any other examination recognized as equivalent there to with English as one of the language and physics, chemistry and biology as optional subjects with not less then 40% of marks in the aggregate of the relevant science subject (physics, chemistry and biology) to be eligible for admission to BHMS Courses.","Bachelor of Homoeopathic Medicine and Surgery is Five and Half Years Full Time Course and Approved By Central council of Homoeopathy, New Delhi, and Affiliated By Rajiv Gandhi University of Health Sciences, Bangalore."
25,"Homeopathic Medical College and Hospital, Gulbarga",Kalaburagi,Karnataka,MD Hom Materia Medica,3 years,Full time,6,PG,,(CCH) Central Council of Homeopathy,The candidate should have passed in BHMS.,"Doctor Of Medicine Homeopathic in Materia Medica is Three Years Full Time Course and Approved By Central council of Homoeopathy, New Delhi and Affiliated By Rajiv Gandhi University of Health Sciences, Bangalore, Karnataka."
26,"Homeopathic Medical College and Hospital, Gulbarga",Kalaburagi,Karnataka,MD Hom Organon of Medicine and Hom Philosophy,3 years,Full time,6,PG,,(CCH) Central Council of Homeopathy,The candidate should have passed in BHMS.,"Doctor Of Medicine Homeopathic in Organon of Medicine and Hom Philosophy is Three Years Full Time Course and Approved By Central council of Homoeopathy, New Delhi and Affiliated By Rajiv Gandhi University of Health Sciences, Bangalore, Karnataka."
27,"Homeopathic Medical College and Hospital, Gulbarga",Kalaburagi,Karnataka,MD Hom Repretore,3 years,Full time,6,PG,,(CCH) Central Council of Homeopathy,The candidate should have passed in BHMS.,"Doctor Of Medicine Homeopathic in Repretore is Three Years Full Time Course and Approved By Central council of Homoeopathy, New Delhi and Affiliated By Rajiv Gandhi University of Health Sciences, Bangalore, Karnataka."
28,"Swami Vivekanand Homoeopathic Medical College and Hospital, Bhavnagar",Valukad,Gujarat,BHMS,5.5 years,Full time,100,UG,,(CCH) Central Council of Homeopathy,"Candidates who passed Higher Secondary Examination (10+2) with Physics, Chemistry, and Biology as subjects.","The duration of BHMS (Bachelor of Homoeopathic Medicine & Surgery) course is Five and a half years including one year compulsory rotatory internship, as per Central Council of Homoeopathy."
29,"Tirumala Medical Academy, Nizamabad",Armoor,Telangana,BPT,4.5 years,Full time,,UG,,Indian Association Physiotherapist,The candidate should have passed in 10+2 science stream,BPT is a four and half year full time course
30,"TDTR DAV Institute of Physiotherapy and Rehabilitation, Yamunanagar",Yamuna Nagar,Haryana,BPT,4.5 years,Full time,40,UG,2 lakhs,Indian Association of Physiotherapist,"A candidate who has attained the age of 17 years or more on December of the admission year. Has passed one of the following examinations:1. Senior Secondary Certificate Examination (10+2) of board of school education, Haryana or equivalent examination with a minimum of 50% marks in aggregate in the subjects of Physics, Chemistry, Biology and English taken together and should pass in all subjects.2. In case of SC/ST candidates marks obtained should be read as 40% .",Bachelor of Physiotherapy is a four and half years full-time Course. It is Approved by Indian Association of Physiotherapist.
31,"Al Shifa College of Paramedical Science, Perinthalmanna",Perinthalmanna,Kerala,B.Sc Optometry,4 years,Full time,30,UG,,"Directorate of Medical Education, Govt. of Kerala",12th Pass from any recognized board or equivalent.,"It is 4 year full time course with affiliation of Kerala University of Health Sciences, Kerala and approved by UGC."
32,"Al Shifa College of Paramedical Science, Perinthalmanna",Perinthalmanna,Kerala,Diploma in Radiology Techniques,2 years,Full time,30,Diploma,,"Directorate of Medical Education, Govt. of Kerala",10+2 with related combination.,"It is 2 year full time course with affiliation of Director of Medical Education, Govt. of Kerala and approved by UGC."
33,"Indian Institute of Public Health, Delhi",Gurgaon,Haryana,Master in Public Health,2 years,Full time,50,PG,2.76 lakhs,,"Medical graduates (MBBS), dental graduates (BDS),
graduates of ayurvedic medicine, homeopathy and
siddha, and graduates of four-year degree programs
in veterinary/nursing sciences, Bachelor of
Physiotherapy, Bachelor of Occupational Therapy,
Bachelor of Pharmacy, Engineering graduates, or
students with a postgraduate degree in
Statistics/Biostatistics, Demography, Population
Studies, Nutrition, Sociology, Economics, Psychology,
Anthropology, Social Work, Management or Law.
Work experience in a health-related field is desirable.","Masters in Public Health (MPH) is two years full time course offered by Sree Chitra Tirunal Institute for Medical Sciences and Technology, Trivandrum"
34,"BIMR College of Professional Studies, Gwalior",Gwalior,Madhya Pradesh,BPT,4.5 years,Full time,50,UG,,Indian Association of Physiotherapy,The candidate should have passed 10+2 Science stream from any recognized college/ board.,"Bachelor of Physiotherapy is a four and half years course
offered by Jiwaji University, Gwalior and offered by Indian Association of Physiotherapy"
35,"Anand Homoeopathic Medical College and Research Institute, Anand",Anand,Gujarat,BHMS,5.5 years,Full time,100,UG,0.685 lakhs,(CCH) Central Council of Homeopathy,No candidate shall be admitted to B.H.M.S. course unless he has passed the Higher secondary Board exams with physics chemistry & Biology as his subjects,"Bachelor of Homoeopathy and Medical Surgery is a Five and Half Years Including 1 Year Internship Course Approved by CCH and Affiliated to Sardar Patel University, Vallabh Vidyanagar. The Subjects for study and examination for B.H.M.S.course shall be as under
Anatomy
Physiology including Biochemistry
Organon of medicine, Principles of Homoeopathic Philosophy & Psych...See More"
36,"Anand Homoeopathic Medical College and Research Institute, Anand",Anand,Gujarat,MD Homoeopathy Materia Medica,3 years,Full time,6,PG,,(CCH) Central Council of Homeopathy,A must have BHMS degree,"Doctor of Medicine Homoeopathy in Materia Medica is a three-Years Course Approved by Central Council of Homoeopathy and offered by Sardar Patel University, Vallabh Vidyanagar"
37,"Anand Homoeopathic Medical College and Research Institute, Anand",Anand,Gujarat,MD Homoeopathy Organon of Medicine,3 years,Full time,6,PG,,(CCH) Central Council of Homeopathy,A must have BHMS degree,"Doctor of Medicine Homoeopathy in Organon of Medicine is a three-Years Course Approved by Central Council of Homoeopathy and offered by Sardar Patel University, Vallabh Vidyanagar"
38,"Anand Homoeopathic Medical College and Research Institute, Anand",Anand,Gujarat,MD Homoeopathy Repertory since,3 years,Full time,6,PG,,(CCH) Central Council of Homeopathy,A must have BHMS degree,"Doctor of Medicine Homoeopathy in Repertory since is a three-Years Course Approved by Central Council of Homoeopathy and offered by Sardar Patel University, Vallabh Vidyanagar"
39,"State Institute of Nursing and Paramedical Sciences, Badal",Badal,Punjab,BPT,4.5 years,Full time,15,UG,,(INC) Indian Nursing Council,The candidate should have passed 10+2 (Medical).,"Bachelor of Physiotherapy is 4-year 6-months duration course approved by Indian Nursing Council and affiliated with Baba Farid University of Health Sciences, Faridkot."
40,"State Institute of Nursing and Paramedical Sciences, Badal",Badal,Punjab,Diploma in Radiography,2 years,Full time,10,Diploma,,(INC) Indian Nursing Council,The candidate should have passed 10+2 (Medical).,"Diploma in Radiography is 2-year duration course approved by Indian Nursing Council and affiliated with Baba Farid University of Health Sciences, Faridkot."
41,"Subhash Chandra Bose Paramedical Institute, Jabalpur",Jabalpur,Madhya Pradesh,BPT,4.5 years,Full time,50,UG,,,Students who have scored above 45% in High School (Class 12th) with Biology subject are eligible for the courses,"Bachelor of Physiotherapy is a four and half year full time course affiliated by Rani Durgavati Vishwavidyalaya, Jabalpur"
42,"Shri Vaishnav Polytechnic College, Indore",Indore,Madhya Pradesh,Diploma in Ophthalmic Technology,3 years,Full time,60,Diploma,0.405 lakhs,(AICTE) All India Council of Technical Education,A candidate seeking admission in Diploma in Engineering should have passed 10th or High School Examination or its equivalent of an approved Board.,"This is a full time three year course affiliated to Rajiv Gandhi Proudyogiki Vishwavidyalaya, Bhopal and approved by AICTE."
43,"Dispur Paramedical and Nursing Institute, Guwahati",Guwahati,Assam,Diploma in Radiology and Imaging Technology,2 years,Full time,,Diploma,,Government of Assam,Candidates must be 10+2 passed in any discipline from a recognised board of education.,Diploma in Radiology and Imaging Technology is a full time two years course approved by Government of Assam.
