,College,City,State,Course,Duration,Study mode,Approved intake,Course level,Course Fee,Approval,Eligiblity,Course_Detail
317,"Marian International Institute of Management, Peermade",Kuttikkanam,Kerala,MBA,2 years,Full time,120,PG,3.58 lakhs,(AICTE) All India Council of Technical Education,"Admission to the MBA course is done as per the M.G. University Norms. Candidates must secure a good score in the KMAT-Kerala, CMAT, CAT or any other approved tests in order to get admitted to the MBA. Also the aggregate marks for the degree course should be above 50%.","Master of Business Administration is a Full time program spread over 2 years / 4 semesters as per the scheme & syllabus of Mahatma Gandhi University, Kottayam program is approved by AICTE"
318,"Amity Global Business School, Pune",Pune,Maharashtra,GDBA and BBA,3 years,Full time,,PG,3.46 lakhs,UGC,"The candidate should have 10+2 (min. 50%).
In aggregate percentage Physical Education, Fine Arts & Performing Arts will not be considered","Students join AGBS to pursue the GDBA and also enroll in the fleximode* BBA of Amity University.
On successful completion of the respective programs, the student receives a GDBA certificate from AGBS and the fleximode* BBA from Amity University."
319,"Amity Global Business School, Pune",Pune,Maharashtra,PGPM and MBA,2 years,Full time,,PG,5.14 lakhs,UGC,"(1) The candidate should have Graduation (min. 50%) + 10+2(min. 50%).
(2) In aggregate percentage Physical Education, Fine Arts & Performing Arts will not be considered ~ Graduation Final year appearing students should meet minimum eligibility till last qualifying Semester / Year.","Students join AGBS to pursue the PGPM and also enroll in the fleximode MBA of Amity University.
On successful completion of the respective programs, the student receives a PGPM certificate from AGBS and the fleximode* MBA from Amity University."
320,"Amity Global Business School, Pune",Pune,Maharashtra,PGPM and MBA Executive,2 years,Full time,,PG,3 lakhs,UGC,Minimum with 5 years of Post Graduate relevant managerial / supervisor level experience,It is a two year duration full-time course.
321,"St Xaviers College, Goa",Mapusa,Goa,BBA,3 years,Full time,,UG,,UGC,The candidate should have passed 10+2.,It is 3-year duration full-time course.
322,"St Xaviers College, Goa",Mapusa,Goa,MA Human Resource Management,2 years,Full time,,PG,,UGC,The candidate should have passed Graduation in the concerned subject.,It is 2-year duration full-time course.
323,"St Mary's College, Hyderabad",Hyderabad,Telangana,BBA,3 years,Full time,,UG,,,12th Pass from any recognized board or equivalent.,It is 3 year full time course.
324,"Lakshmi Narain College of Technology Excellence, Bhopal",Bhopal,Madhya Pradesh,MBA,2 years,Full time,60,PG,1.1 lakhs,(AICTE) All India Council of Technical Education,"A candidate seeking admission to MBA and Allied Courses should be a Graduate with at least 50% marks and 45% marks in case of SC, ST, OBC category of Madhya Pradesh in aggregate of any UGC/AICTE approved Indian University or from a foreign University recognized by Association of Indian Universities (AIU) or institute recognized by the concerned University as equivalent thereto.
The Bachelor's degree must be of minimum three years duration after passing Higher Secondary (10+2) examination of (10+2) system or equivalent.","MBA is a two year full time course Approved by AICTE, Affiliated to Rajiv Gandhi Proudyogiki Vishwavidyalaya, Bhopal"
325,"Abhilashi University, Mandi",Chail-Chowk,Himachal Pradesh,MBA,2 years,Full time,40,PG,,,"The admission to MBA degree course shall be made in the order of merit of valid score of National Level Tests CAT, CMAT, MAT, etc. respectively.In case seats remain vacant after exhausting the merit of National Level Tests the same shall be filled up n the basis of merit of HPCET of the corresponding year.
In case the seats remain vacant after exhausting the merit level tests and HPCET, the remaining seats will be filled up on the basis of Bachelor degree of examinations conducted by any recognized University.","Master of Business Administration is two-year duration full-time course offered by Abhilashi University, Mandi."
326,"Ch Bansi Lal University, Bhiwani",Bhiwani,Haryana,MBA,2 years,Full time,40,PG,0.7 lakhs,,"Bachelor’s degree of three year duration with at least 50% marks in aggregate or any other examination recognized by Ch. Bansi Lal University, Bhiwani as equivalent thereto.",Master of Business Administration is two-years duration full-time course.
327,"Maharishi University of Information Technology, Lucknow",Lucknow,Uttar Pradesh,MBA Marketing,2 years,Full time,,PG,1 lakh,,The candidate should have passed Graduation with 50%.,Master of Business Administration in Marketing is two-year duration full-time course.
328,"Rai Technology University, Bangalore",Doddabelavangala,Karnataka,MBA,2 years,Full time,,PG,,,The candidate should have Graduation degree from any recognized University.,Master of Business Administration is two-years duration full-time course.
329,"Rai Technology University, Bangalore",Doddabelavangala,Karnataka,MBA Integrated,5 years,Full time,,PG,,,The candidate should have Graduation degree from any recognized University.,Master of Business Administration Integrated is five-years duration full-time course.
330,"OPJS University, Rajgarh",Kerlibas,Rajasthan,BBA,3 years,Full time,,UG,,,The Candidate should have 12th passed in relevant subject from recognized board.,"Bachelor of Business Administration (BBA) is three-year duration full-time course and offered by OPJS University, Rajgarh."
331,"OPJS University, Rajgarh",Kerlibas,Rajasthan,BBA MBA Integrated,4 years,Full time,,PG,2 lakhs,,The candidate should have passed 12th in relevant subject from recognized board.,"BBA MBA Integrated is four-year (8 semester) duration full-time course and offered by OPJS University, Rajgarh."
332,"OPJS University, Rajgarh",Kerlibas,Rajasthan,MBA,2 years,Full time,,PG,3.05 lakhs,,The candidate should have passed Graduation from recognized university.,"Master of Business Administration is two-years duration full-time course. The specializations available in MBA :
1. Human Resource 2. Financial 3. Marketing 4. Biotech 5. Security 6. Retail 7. Sales 8. Agriculture 9. Hospitality Management 10. Construction Power 11. Pharmical Education Institute Management 12. Pharmacy Education Institute Management."
333,"OPJS University, Rajgarh",Kerlibas,Rajasthan,PGDBM,1 year,Full time,,PG,0.91 lakhs,,The candidate should have Graduation degree in relevant subject from any recognized University.,"Post Graduate Diploma In Business Management is one-year duration full-time course and offered by OPJS University, Rajgarh."
334,"Balaji Institute of Engineering and Management Studies, Nellore",North Rajupalem,Andhra Pradesh,MBA,2 years,Full time,120,PG,0.46 lakhs,(AICTE) All India Council of Technical Education,A candidate must have pass in a recognised Bachelor’s degree of minimum three years duration with minimum 50 per cent of marks (45 per cent for reserved category) at graduation.,"MBA is a full-time two years duration course Affiliated to Jawaharlal Nehru Technological University, Anantpur Approved by AICTE."
335,"JDC Bytco Institute of Management Studies and Research, Nashik",Nashik,Maharashtra,MBA,2 years,Full time,60,PG,1.8 lakhs,(AICTE) All India Council of Technical Education,The minimum qualification for entry to the Programme is any Bachelor Degree from recognized Universities.,This is a two year full time Programme leading to a Master Degree in Management.
336,"Indian Institute of Tourism and Travel Management, Bhubaneswar",Bhubaneswar,Odisha,MBA International Business,2 years,Full time,93,PG,,(AICTE) All India Council of Technical Education,The candidate should have graduate degree with 50% marks.,This is a full time two year course.
337,"Indian Institute of Tourism and Travel Management, Bhubaneswar",Bhubaneswar,Odisha,PGDM International Buisness,2 years,Full time,93,PG,5.46 lakhs,(AICTE) All India Council of Technical Education,The candidate should have the graduate degree with 50% marks.,Post graduate in Diploma management in International Buisness is Two-year course approved by AICTE
338,"Arihant Institute of Business Management, Pune",Pune,Maharashtra,MBA,2 years,Full time,120,PG,1.4 lakhs,(AICTE) All India Council of Technical Education,"Students possessing following qualifications are eligible for admission to MBA course-
A Bachelor’s Degree in any faculty of any statutory University with 45% or more marks(40% or more marks for students belonging to SC, ST/DT, NT,OBC, SBC for Maharashtra State Only)
OR
A masters Degree in any faculty of any statutory University with 45% or more marks(40% or more marks for students belonging to SC, ST/DT, NT,OBC, SBC for Maharashtra State Only)
Must have completed selection procedure as prescribed by the competent authority from time to time.","This is a two year full time Programme leading to a Master Degree in Management. Specializations- Marketing Management, Financial Management, Computer Management, Production and Materials Management, Human Resource Management, International Business"
339,"Modern Institute of Business Management, Pune",Pune,Maharashtra,MBA,2 years,Full time,120,PG,1.66 lakhs,(AICTE) All India Council of Technical Education,Passed with minimum of 50% marks in aggregate* ( 45% in case of candidates of backward class categories belonging to Maharashtra State only) in any Bachelor's degree of minimum THREE years duration in any discipline recognized by the Association of Indian Universities.,"This is a two year full time Programme leading to a Master Degree in Management.
Specializations offered at MIBM-
Marketing Management, Financial Management, Information Technology Management, Operations Management, Human Resources Management, International Business Management, Supply Chain Management, Rural and Agribusiness Management, Family Business Management,...See More"
340,"Modern Institute of Business Management, Pune",Pune,Maharashtra,MBA II Shift,2 years,Full time,60,PG,1.66 lakhs,(AICTE) All India Council of Technical Education,Passed with minimum of 50% marks in aggregate* ( 45% in case of candidates of backward class categories belonging to Maharashtra State only) in any Bachelor's degree of minimum THREE years duration in any discipline recognized by the Association of Indian Universities.,"This is a two year full time Programme leading to a Master Degree in Management.
Specializations offered at MIBM-
Marketing Management, Financial Management, Information Technology Management, Operations Management, Human Resources Management, International Business Management, Supply Chain Management, Rural and Agribusiness Management, Family Business Management,...See More"
341,"Agriculture and Food Management Institute, Mysore",Srirangapatna,Karnataka,PGDM Agri Food Business,2 years,Full time,60,PG,3.6 lakhs,(AICTE) All India Council of Technical Education,The candidate should have passed in related degree,"Agri Food Business (PGDM-AFB)- is a two-years full time, AICTE approved, flagship programme of AFMI. It is the first of its kind two years full timeregular programme in the country recognized by AICTE. AFMI prides itself for the learning experience imparted in this programme. AFMI is affiliated to AICTE and have capability to orient the entire teaching and learning pr...See More"
342,"Don Bosco Institute of Management Studies and Computer Applications, Bangalore",Bengaluru,Karnataka,BBA,3 years,Full time,60,UG,1.15 lakhs,UGC,The candidate should have passed in PUC or 10+2 from a recognized board,"Bachelor of Business Administration is three years full-time undergraduate management programme offered by Bangalore University, Bangalore and approved by UGC"
343,"Don Bosco Institute of Management Studies and Computer Applications, Bangalore",Bengaluru,Karnataka,MBA,2 years,Full time,180,PG,3.35 lakhs,UGC,"The candidate should have any Degree with 50% marks with valid score card from MAT, KMAT, CMAT or PGCET","Master of Business Administration is two years full-time Post graduate management programme offered by Bangalore University, Bangalore and approved by UGC
MBA course specialization in Marketing, Finance and HR"
344,"Jawaharlal Nehru Memorial Post Graduate College, Barabanki",Barabanki,Uttar Pradesh,BBA,3 years,Full time,,UG,0.58 lakhs,UGC,The candidate should have passed in 10+2 with relevant subject.,"Bachelor of Business Management is full time three year course affiliated to Dr. Ram Manohar Lohia Awadh University, Faizabad and approved by UGC."
345,"Sardar Vallabhbai Polytechnic College, Bhopal",Bhopal,Madhya Pradesh,Diploma in Modern Office Management,3 years,Full time,65,Diploma,0.3 lakhs,(AICTE) All India Council of Technical Education,The candidates who complete the XIIth Standard are eligible for admission.,"It is 3-year duration full-time diploma course offered by Rajiv Gandhi Proudyogiki Vishwavidyalaya, Bhopal and approved by All India Council for Technical Education."
346,"Government Leather Institute, Kanpur",Kanpur,Uttar Pradesh,Diploma in Saddlery and Export Management,3 years,Full time,60,Diploma,0.3 lakhs,(AICTE) All India Council of Technical Education,The candidates who complete the Xth Standard are eligible for admission.,"Diploma in Leather Technology Tanning is a 3 years full time course offered by Uttar Pradesh Board of Technical Education, Lucknow and approved by AICTE."
347,"BMS College for Women, Bangalore",Bengaluru,Karnataka,BBM,3 years,Full time,120,UG,,UGC,12th Pass from any recognized board or equivalent.,It is 3 year full time course.
348,"Arihant College of Arts Commerce and Science, Pune",Pune,Maharashtra,BBA,3 years,Full time,,UG,,,10+2 with 45% marks,"It is 3 year full time course with affiliation of Savitribai Phule Pune University,Pune and approved by UGC."
349,"International School of Management, Patna",Patna,Bihar,PGDM,2 years,Full time,120,PG,2.9 lakhs,(AICTE) All India Council of Technical Education,"At least 50% marks or equivalent CGPA in graduation [45% in case of SC/ST and Person With Disability (PWD)], from any AIU approved University with valid CAT, CMAT, MAT or XAT scores. Students appearing in their final year exams or awaiting their results can also apply Result of such students should be submitted before 30th November.","ISM Patna offers a two-year full time Postgraduate Diploma in Management (PGDM), equivalent to MBA, approved by All India Council for Technical Education (AICTE), Ministry of HRD, Govt. of India. It is a well researched programme designed specifically to cater to the needs of Industry. The entire PGDM/MBA program has been divided into 6 trimesters. In the first year o...See More"
350,"Indian Institute of Business Management, Patna",Patna,Bihar,Advance Diploma in Hospital Management,2 years,Full time,,Diploma,0.24 lakhs,,The candidate should have passed in Matric and above in any subject.,"This is a full-time two-year course affiliated to Babasaheb Bhimrao Ambedkar Bihar University, Muzaffarpur."
351,"Indian Institute of Business Management, Patna",Patna,Bihar,Advanced Diploma in E-Governance,2 years,Full time,,Diploma,0.24 lakhs,,The candidate should have passed in Matric and above in any subject.,"This is a full-time two-year course affiliated to Babasaheb Bhimrao Ambedkar Bihar University, Muzaffarpur."
352,"Indian Institute of Business Management, Patna",Patna,Bihar,Advanced Diploma in Retail Management,2 years,Full time,,Diploma,0.24 lakhs,,The candidate should have passed in Matric and above in any subject.,"This is a full-time two-year course affiliated to Babasaheb Bhimrao Ambedkar Bihar University, Muzaffarpur."
353,"Indian Institute of Business Management, Patna",Patna,Bihar,BBA,3 years,Full time,,UG,0.82 lakhs,UGC,The candidate should have passed in 10+2 with the relevant subject.,"Bachelor Of Business Administration (BBA) is a 3- Years divided into 6- Semesters course Recognized by UGC, Ministry of HRD, Govt. of India, BBA Degree awarded by BRA Bihar University, Muzaffarpur"
354,"Indian Institute of Business Management, Patna",Patna,Bihar,Diploma in E-Governance,2 years,Full time,,Diploma,0.24 lakhs,,The candidate should have passed in Matric and above in any subject.,"This is a full-time two-year course affiliated to Babasaheb Bhimrao Ambedkar Bihar University, Muzaffarpur."
355,"Indian Institute of Business Management, Patna",Patna,Bihar,Diploma in Hospital Management,1 year,Full time,,Diploma,0.12 lakhs,,The candidate should have passed in Matric and above in any subject.,"This is a full-time one-year course affiliated to Babasaheb Bhimrao Ambedkar Bihar University, Muzaffarpur."
356,"Indian Institute of Business Management, Patna",Patna,Bihar,Diploma in Retail Management,1 year,Full time,,Diploma,0.12 lakhs,,The candidate should have passed in Matric and above in any subject.,"This is a full-time one-year course affiliated to Babasaheb Bhimrao Ambedkar Bihar University, Muzaffarpur."
357,"Indian Institute of Business Management, Patna",Patna,Bihar,MBA,2 years,Full time,,PG,0.85 lakhs,UGC,Graduates in any discipline.,"Master of Business Administration (MBA) is a two-year full-time course Recognized by UGC, Ministry of HRD, Govt. of India, MBA Degree awarded by BRA Bihar University, Muzaffarpur"
358,"Indian Institute of Business Management, Patna",Patna,Bihar,PGDM,2 years,Full time,90,PG,2.75 lakhs,(AICTE) All India Council of Technical Education,Graduates in any discipline with C-MAT/XAT/MAT/CAT score. The previous year score may be accepted. Working persons may get admission with prior permission from their respective organization.,"PG Diploma in Management (PGDM) is 2-years divided into 4 semesters full-time course Recognized by AICTE, Ministry of HRD, Govt. Of India, Equivalent to MBA Degree of Indian Universities."
359,"Indian School of Business Management and Administration, Chennai",Chennai,Tamil Nadu,MBA,2 years,Full time,,PG,0.29 lakhs,,The candidate should have passed in the relevant graduate degree.,This is a full-time two-year course certified by ISO 9001: 2008
360,"Indian School of Business Management and Administration, Chennai",Chennai,Tamil Nadu,MBA Dual Specialization,2 years,Full time,,PG,0.49 lakhs,,The candidate should have passed in the relevant graduate degree.,This is a full-time two year course certified by ISO 9001: 2008
361,"Indian School of Business Management and Administration, Chennai",Chennai,Tamil Nadu,MBA Executive,2 years,Full time,,PG,0.35 lakhs,,The candidate should have passed in the relevant graduate degree.,This is a full-time two year course certified by ISO 9001: 2008
362,"Indian School of Business Management and Administration, Chennai",Chennai,Tamil Nadu,MIB,2 years,Full time,,PG,0.39 lakhs,,The candidate should have passed in the relevant graduate degree.,This is a full-time two year course certified by ISO 9001: 2008
363,"Indian School of Business Management and Administration, Chennai",Chennai,Tamil Nadu,MMS,2 years,Full time,,PG,0.39 lakhs,,The candidate should have passed in the relevant graduate degree.,This is a full-time two year course certified by ISO 9001: 2008
364,"Indian School of Business Management and Administration, Chennai",Chennai,Tamil Nadu,PGDBM,2 years,Full time,,PG,0.23 lakhs,,The candidate should have passed in the relevant graduate degree.,This is a full-time two year course certified by ISO 9001: 2008
365,"Indian School of Business Management and Administration, Chennai",Chennai,Tamil Nadu,PGPM,2 years,Full time,,PG,0.49 lakhs,UGC,Graduate / Diploma Holder with work experienced.,"This course is for them who want to pursue a professional career in corporate world. This course offers specialization for two subjects i.e. in two fields of management. And a project study will test your skills of management.
Duration: Fast Track:12 Months and Regular:2 Years"
366,"TKWs Institute of Banking and Finance, New Delhi",New Delhi,Delhi,Advanced Diploma in Banking and Finance + B.Com,3 years,Full time,,UG,,,"A candidate must satisfy following eligibility criteria,
1. 10+2 or HSC in Science / Commerce / Humanities from a recognised board
2. Minimum 50% marks in best 4 subjects including English
3. Valid score in TKWs BAT / UGAT / SAT","Advanced Diploma in Banking and Finance + B.Com (Delhi University) Vocational Education is a trend across the globe and many Students are opting for professional courses over formal Degrees. This Diploma gives them a perfect bridge to prepare for a Professional Career in banking and financial services.
With a major part of Delhi University’s B.Com embedded in our...See More"
367,"TKWs Institute of Banking and Finance, New Delhi",New Delhi,Delhi,B.Com Banking and Finance,3 years,Full time,,UG,,,"10+2 from Science / Commerce / Humanities.
Students who are awaiting their result may also apply.",B.Com Degree provides a strong foundation to pursue different career paths in commerce. Added specialization in banking and finance makes the students highly sought after candidates in the industry. With integrated curriculum it becomes easy for the students of this B.Com Degree to simultaneously pursue company secretary examinations conducted by ICSI (Institute of Co...See More
368,"TKWs Institute of Banking and Finance, New Delhi",New Delhi,Delhi,MBA Banking and Finance,2 years,Full time,,PG,,,"1. Recognized Bachelor’s Degree of minimum 3 years in any discipline
2. Obtained at least 50% marks in graduation
Or 45% marks in graduation for candidates of reserved category
3. Students who are awaiting their result may also apply","MBA in Banking and Finance - Unlike a general MBA Degree program, Institute of Banking & Finance offers a specialized MBA course, which starts with the most important areas of banking operations. Through the 4 semesters of MBA the students develop their knowledge of banking through subjects like retail banking, treasury operations, trade services, in...See More"
369,"TKWs Institute of Banking and Finance, New Delhi",New Delhi,Delhi,PGD in Banking and Finance,1 year,Full time,,PG,,,"A candidate must satisfy following eligibility criteria,
1.Graduate in any stream from a recognised board
2. Minimum 50% marks in 10+2 and Graduation
3. Valid score in TKWs BAT / CAT / MAT","A Post Graduate Diploma in Banking & Finance will be the Most appropriate career decision for candidates having good interpersonal skills, patience and flair for numbers. This program starts by providing fundamental clarity and then advances to expose the participants to all essentials of banking & finance. The course while preparing the candidate for PO exams also ma...See More"
370,"Suryadatta Group of Institutes, Pune",Pune,Maharashtra,BBA,3 years,Full time,,UG,,UGC,"12th Std. Examination (H.S.C. 10+2) pass from any stream with English as passing subject and has secured 45% marks OR Two years Diploma in Pharmacy after H.S.C., Board of Technical Education conducted by Government of Maharashtra or its equivalent. OR Three Year Diploma Course (after H.S.C., i.e. 12th Standard) of Board of Technical Education conducted by Government of Maharashtra or its equivalent. OR MCVC. It is one of the Best Carrer Opportunity after 12th in Managment.","Bachelor of Business Administration is a three-year full-time UG course offered by Savitribai Phule Pune University, Pune and Approved by UGC"
371,"Suryadatta Group of Institutes, Pune",Pune,Maharashtra,MBA,2 years,Full time,180,PG,,(AICTE) All India Council of Technical Education,Graduates from recognized University with 50% Marks (45% for reserved category) and valid entrance test score in any one of the National Level Entrance Tests such as CMAT/ XAT / CAT / MAT / ATMA are eligible.students who have not taken any National Level Entrance Test but are planning for the same in near future are also eligible.,"Master of Business Administration is two years full-time course offered by Savitribai Phule Pune University, Pune and approved by AICET
Specializations Available:
Marketing Management
Finance Management
Information Technology Management
Human Resources Management
Technology Management
Supply Chain Management
Rural & Agribusiness Management
Family Business Man...See More"
372,"Suryadatta Group of Institutes, Pune",Pune,Maharashtra,PGDM Finance Marketing Dual Degree,2 years,Full time,60,PG,,(AICTE) All India Council of Technical Education,Graduates from recognized University with 50% Marks (45% for reserved category) and valid entrance test score in any one of the National Level Entrance Tests such as CMAT/ XAT / CAT / MAT / ATMA are eligible.students who have not taken any National Level Entrance Test but are planning for the same in near future are also eligible.,"Post Graduate Diploma Management Finance and Marketing is dual degree course offers are two years full-time course offered by Savitribai Phule Pune University, Pune and approved by AICET"
373,"Suryadatta Group of Institutes, Pune",Pune,Maharashtra,PGDM Human Resource International Business Dual Degree,2 years,Full time,60,PG,,(BCI) Bar Council of India,Graduates from recognized University with 50% Marks (45% for reserved category) and valid entrance test score in any one of the National Level Entrance Tests such as CMAT/ XAT / CAT / MAT / ATMA are eligible.students who have not taken any National Level Entrance Test but are planning for the same in near future are also eligible.,"Post Graduate Diploma Human Resource and International Business is dual degree course offers are two years full-time course offered by Savitribai Phule Pune University, Pune and approved by AICET"
