,College,City,State,Course,Duration,Study mode,Approved intake,Course level,Course Fee,Approval,Eligiblity,Course_Detail
0,"MCM DAV College for Women, Chandigarh",Chandigarh,Chandigarh,BBA,3 years,Full time,40,UG,0.8 lakhs,UGC,The candidate should have passed in 10+2 any stream.,Bachelor of Business Administration is a three-year full-time course approved by UGC.
1,"IIMT School of Management, Gurgaon",Garhi Bazidpur,Haryana,PGDM,2 years,Full time,120,PG,4.85 lakhs,(AICTE) All India Council of Technical Education,"50% in graduation in any stream or appearing in final examination from an Indian university (45% in case of candidate belonging to reserved category)
A valid score of one the following: CAT/MAT/XAT/GMAT/CMAT
Personal interview
Candidates with work experience would be preferred","This full-time diploma awarding programme provides rigorous training in Marketing, Finance, Human Resource, and International Business, Supply Chain and Entrepreneurship & Innovation. Since the programme is offered with an exposure to international business practices, the curriculum offers a perspective on global issues and showcases a practical way to address them....See More"
2,"Sri Sharada Institute of Indian Management Research, New Delhi",New Delhi,Delhi,PGDM Executive,1 year,Full time,30,PG,,(AICTE) All India Council of Technical Education,"Graduation Degree from any recognized University of India with minimum 50% marks.
Minimum 5 years of full time post-qualification experience.
Proficiency in written and spoken English",Sri SIIM offers AICTE-approved Executive Post Graduate Diploma in Management (EPGDM) for working executives aspiring to assume top management responsibilities as well as take up leadership roles in the industry. The program would provide an opportunity for personal as well as professional growth through a specially designed curriculum and rigorous interactive learning...See More
3,"Sri Sharada Institute of Indian Management Research, New Delhi",New Delhi,Delhi,PGCM Retail Management,1 year,Full time,30,PG,,(AICTE) All India Council of Technical Education,"Graduation Degree from any recognized University of India with minimum 50% marks.
Should have appeared CAT/Mat Exam.
Proficiency in written and spoken English","SriSIIM offers AICTE-approved PG Certificate in Management – Retail Management (PGCM-RM). This is a Full time certificate program in Retail Management.
The PG Certificate Program in Retail Management is a full time program spread over 12 months. This program is approved by AICTE."
4,"Sri Sharada Institute of Indian Management Research, New Delhi",New Delhi,Delhi,PGDM,2 years,Full time,120,PG,,(AICTE) All India Council of Technical Education,Graduation Degree from any recognized University with minimum 50% marks. Students appearing for the final examination in 2016 can also apply.,"Sri Sharada Institute of Indian Management–Research (SriSIIM), New Delhi, approved by the “All India Council for Technical Education” (AICTE), Ministry of HRD, Government of India, offers 2 years full time “Post Graduate Diploma in Management” (PGDM). SriSIIM is accredited by “American University Accreditation Council” (AUAC), Washington DC, USA and by ...See More"
5,"FISAT Business School, Kochi",Angamaly,Kerala,MBA,2 years,Full time,120,PG,2.95 lakhs,(AICTE) All India Council of Technical Education,"A pass in degree examination with 50% marks (60% marks desirable) in aggregate for Arts /Commerce /Science/ Engineering and for post graduates. Final year students are also eligible to apply
Good score in any Management Aptitude Test- C-MAT / MAT/CAT/XAT/KMAT",The MBA (Full Time) programme of Mahatma Gandhi Uni versity shall be spread in two years duration with 4 Semesters. Each semester shall comprise of a minimum of 16 instructional weeks of 5 days each of 5 hours a day (total contact hours 400). Continuous Internal Evaluation during the course period and University examination at the end of each semester shall be conduct...See More
6,"Chanakya Law College, Rudrapur",Rudrapur,Uttarakhand,BBA,3 years,Full time,,UG,0.28 lakhs,,10+2 in any stream,"Bachelor of Business Administration is full time three year course degree offered by Kumaun University, Nainital and approved by Bar Council of India."
7,"Amrita School of Business, Amritapuri",Vallikavu,Kerala,MBA,2 years,Full time,60,PG,4.79 lakhs,(AICTE) All India Council of Technical Education,"Bachelor’s Degree recognized by the Association of Indian Universities (AIU), (10+2+3 years of education), with 50% each in 10th, 12th, and the degree programme.","The Master of Business Administration is a Master's degree in Business Administration. The M. B. A. by Amrita School of Business is a two year full residential program. The core courses in the program introduce the various areas of business such as accounting, finance, marketing, human resources and operations management and many programs include elective courses. M. ...See More"
8,"PB Siddhartha College of Arts and Science, Vijayawada",Vijayawada,Andhra Pradesh,BBM,3 years,Full time,60,UG,,UGC,"A pass in Intermediate examination of the Board of Intermediate Education, Andhra Pradesh or equivalent examination. Preference will be given to candidates who studied Commerce as one of the optional subjects.","Bachelor of Business Management is an undergraduate programme aimed at imparting the theoretical background of those academic disciplines relating to the field of management and helping the participants to develop their interpersonal skills and personality to become junior level managers and entrepreneurs. The course curriculum includes, among other subjects, Principl...See More"
9,"PB Siddhartha College of Arts and Science, Vijayawada",Vijayawada,Andhra Pradesh,MBA,2 years,Full time,60,PG,0.7 lakhs,(AICTE) All India Council of Technical Education,Bachelor's Degree or equivalent in any discipline from a recognised university.,PB Siddhartha College of Arts and Science offers two-year full-time Master of Business Administration(MBA) approved by AICTE.
10,"Centre for Development of Advanced Computing, Noida",Noida,Uttar Pradesh,MBA Information Technology,2 years,Full time,60,PG,,(AICTE) All India Council of Technical Education,"B.E./ B.Tech with minimum of 60% marks.
M.Sc(CS), M.Sc(IT), M.Sc(Electronics) with minimum of 60% marks.
MCA with minimum of 60% marks.","It is Two Year Full Time MBA Information Technology Programme approved by AICTE and affiliated to Guru Gobind Singh Indraprastha University (GGSIPU), Delhi."
11,"Davangere University, Davangere",Davangere,Karnataka,BBM,3 years,Full time,,UG,,UGC,Minimum qualification for admission in program: 10+2 or its equivalent.,The duration of the BBM course shall be spread over 3 Years with approval of UGC.
12,"Davangere University, Davangere",Davangere,Karnataka,MBA,2 years,Full time,120,PG,,UGC,Should be a pass in Bachelor‘s or Post Graduate Degree in any discipline from a recognized university.,"This is two year M.B.A. Programme with specializations in Financial Management, Marketing Management & Human Resource Management."
13,"Gondwana University, Gadchiroli",Gadchiroli,Maharashtra,BBA,3 years,Full time,,UG,,UGC,,
14,"Gondwana University, Gadchiroli",Gadchiroli,Maharashtra,MBA,2 years,Full time,120,PG,,(AICTE) All India Council of Technical Education,,
15,"Gondwana University, Gadchiroli",Gadchiroli,Maharashtra,MIRPM,2 years,Full time,,PG,,UGC,,
16,"Solapur University, Solapur",Kegaon,Maharashtra,BBA,3 years,Full time,,UG,,UGC,"A candidate for being eligible for admission to the Degree course in Bachelor of Business Administration shall have passed 12th Std. Examination (H.S.C. 10+2) from any stream
(ii) Two years Diploma in Pharmacy after H.S.C., Board of Technical Education conducted by Government of Maharashtra or its equivalent.
(iii) Three Year Diploma Course (after H.S.C., i.e. 10th Standard) of Board of Technical Education conducted by Government of Maharashtra or its equivalent.
(iv) MCVC(v) Every eligible candidate has to pass a Common Entrance Test to be conducted by university or college","Bachelor of Business Administration is three years full-time under graduate management programme offered by Solapur University, Solapur and approved by UGC"
17,"Solapur University, Solapur",Kegaon,Maharashtra,M.A Rural Development,2 years,Full time,20,PG,,UGC,Graduate in any discipline,
18,"Solapur University, Solapur",Kegaon,Maharashtra,MBA,2 years,Full time,,PG,,UGC,Candidate passed with minimum of 50% marks in aggregate (45% in case of candidates of backward class categories belonging to Maharashtra State only) in any full-time bachelor’s degree of minimum 3 years duration in any discipline recognized by the Association of Indian Universities.,"Master of Business Administration is two years full-time Post graduate management programme offered by Solapur University, Solapur and approved by UGC"
19,"EIILM University, Sikkim",Jorethang,Sikkim,Post Graduate Program in Planning and Entrepreneurship,2 years,Full time,,PG,,UGC,Graduation,
20,"EIILM University, Sikkim",Jorethang,Sikkim,Post Graduate Program in Research in Management,2 years,Full time,,PG,,UGC,Graduation,
21,"EIILM University, Sikkim",Jorethang,Sikkim,Under Graduate Program in Planning and Entrepreneurship,3 years,Full time,,UG,,,10+2,
22,"Hindusthan College of Arts and Science, Coimbatore",Coimbatore,Tamil Nadu,BBA,3 years,Full time,,UG,,UGC,10+2 / Intermediate (any discipline) with 50% marks in aggregate.,"Bachelor of Business Administration is a three-year full-time course approved by UGC.
The Department of Business Administration was established in the year 2000 and was affiliated to Bharathiar University. Department of Business administration has a strong, active and growing interface with Business and Industries, with experts from a range of leading companies deliv...See More"
23,"Hindusthan College of Arts and Science, Coimbatore",Coimbatore,Tamil Nadu,BBA Computer Application,3 years,Full time,,UG,,UGC,10+2 / Intermediate (any discipline) with 50% marks in aggregate.,"BBA with Computer Application is a full time three year course.
The Department of Business Administration with Computer Applications was established in the year 2006. It serves as a centre for excellence by providing supreme student friendly environment. It consists of eminent faculty members with good industry & research exposure. The student intake for the program ...See More"
24,"Hindusthan College of Arts and Science, Coimbatore",Coimbatore,Tamil Nadu,M.Phil Management,2 years,Full time,,PG,,UGC,Postgraduate from any recognised university with relevant subjects.,M.Phil in Management is a two-year full-time course approved by UGC.
25,"Hindusthan College of Arts and Science, Coimbatore",Coimbatore,Tamil Nadu,MBA,2 years,Full time,180,PG,0.5 lakhs,(AICTE) All India Council of Technical Education,Bachelor's Degree or equivalent in any discipline from a recognised university.,"MBA is a two-year full-time course.
PG Department of Management Studies has Started its functioning From the Academic Year 2005-06. It is been approved by AICTE and affiliated to Bharathiar University with 180 seats every Academic year for MBA and the college is providing Specialisations of Marketing, Finance, Human Recourse, Media Management, Logistics Management, ...See More"
26,"Vivekananda Institute of Management Studies, Coimbatore",Coimbatore,Tamil Nadu,MBA,2 years,Full time,120,PG,,(AICTE) All India Council of Technical Education,Candidates with minimum 50% in Graduation (under 10+2+3 scheme) from a recognised University are exempted from the entrance test for admission.,"VIMS conducts a Full-time MBA Programme that spans for the duration of two years. The Programme is affiliated to the Anna University, Chennai. The choice of electives by each student in the programme should complement the career objectives of the student concerned . After completing the first year, customization of MBA curriculum is possible by choosing electives that...See More"
27,"Maharshi Dayanand Saraswati University, Ajmer",Ajmer,Rajasthan,M.Phil Business Administration,1 year,Full time,15,PG,,UGC,A candidate for admission to the courses of study for the degree of M.Phil. must have obtained a Masters degree in the concerned subject with at least 55% marks at the postgraduate examination or second division at the post graduate examination with at least second division at the examination of the MDS University or of any other University/Institution.,M.Phil Business Administration is full time one year course
28,"Maharshi Dayanand Saraswati University, Ajmer",Ajmer,Rajasthan,M.Phil Economic Administration and Financial Management,1 year,Full time,15,PG,,UGC,A candidate for admission to the courses of study for the degree of M.Phil. must have obtained a Masters degree in the concerned subject with at least 55% marks at the postgraduate examination or second division at the post graduate examination with at least second division at the examination of the MDS University or of any other University/Institution.,M.Phil Economic Administration and Financial Management is full time one year course
29,"Maharshi Dayanand Saraswati University, Ajmer",Ajmer,Rajasthan,MBA,2 years,Full time,60,PG,,UGC,"Candidate must have passed bachelor degree in any stream from recognized university, also must have valid score in CMAT",Master of Business Administration is full time two year post graduate degree course
30,"Maharshi Dayanand Saraswati University, Ajmer",Ajmer,Rajasthan,PGD Disaster Management,1 year,Full time,20,PG,,UGC,"Candidate must have passed Graduate degree with minimum 50% marks in any discipline of Science, Engineering & Technology from recognized University",Post Graduate Diploma in Disaster Management is full time one year course
31,"Maharshi Dayanand Saraswati University, Ajmer",Ajmer,Rajasthan,PGD Industrial Safety Health and Environment,1 year,Full time,20,PG,,UGC,"Candidate must have passed Graduate degree in any discipline of Science, Engineering & Technology from recognized University",Post Graduate Diploma in Industrial Safety Health and Environment is full time one year course
32,"College of IT and Management Education, Bhubaneswar",Bhubaneswar,Odisha,MBA,2 years,Full time,120,PG,,(AICTE) All India Council of Technical Education,The candidate should have passed graduation in any discipline.,Master of Business Administrative is the 2 years Post Graduate course which prepare the future managers who may take the rapid environmental changes positively and find the opportunities to prove their managerial capabilities in different areas.
33,"College of IT and Management Education, Bhubaneswar",Bhubaneswar,Odisha,MBA Part Time,3 years,Part Time,60,PG,,(AICTE) All India Council of Technical Education,The candidate should have passed graduation in any discipline.,CIME has been offering 3 years part time MBA (Master in Business Administration) with the approval of AICTE and Government of Orissa.
34,"Vidya Bharati Mahavidyalaya, Amravati",Amravati,Maharashtra,MIRPM,2 years,Full time,30,PG,0.097 lakhs,(AICTE) All India Council of Technical Education,Any degree,"Master of Industrial Relations & Personnel Management is a two years PG course, affiliated to Sant Gadge Baba Amravati University.(SGBAU). Approved by AICTE."
35,"Vidya Bharati Mahavidyalaya, Amravati",Amravati,Maharashtra,DFM,1 year,Full time,60,PG,0.062 lakhs,UGC,Any Graduate,"Post Graduate Diploma in Financial Management is a one years PG course, affiliated to Sant Gadge Baba Amravati University.(SGBAU). Approved by AICTE."
36,"Vidya Bharati Mahavidyalaya, Amravati",Amravati,Maharashtra,MBA,2 years,Full time,60,PG,1.65 lakhs,(AICTE) All India Council of Technical Education,Candidate must have passed bachelor degree from recognized university,"Master of Business Administration is full time two year post gradate degree course, recognized by AICTE"
37,"GLS JP Shah Institute of Business Administration, Ahmedabad",Ahmedabad,Gujarat,BBA,3 years,Full time,679,UG,0.93 lakhs,UGC,Eligibility for admission in first year BBA is passing of Higher Secondary Examination in Science or General Stream (Gujarat Board/CBSE/ICSE/Any other equivalent board approved by the Gujarat University). The student needs to have English and Accountancy/Statistics/Mathematics/Physics to be eligible. The programme is offered only in English medium.,"The BBA course was designed with a vision to contribute to the societal enrichment through quality curriculum, innovation and value augmentation. The USP of this course is, the concrete platform that it provides to the students, for developing their competitive periphery to survive in industry, which any other commercial course fails to provide. The motive of this cou...See More"
38,"Techno Institute of Management Sciences, Lucknow",Lucknow,Uttar Pradesh,PGDM,2 years,Full time,180,PG,4.26 lakhs,(AICTE) All India Council of Technical Education,"TECHNO offers a two year full time program to all aspirants who have completed at least a three year Bachelor’s degree (10+ 2+ 3)(GEN. – 45%, OBC – 45%, SC/ST – 40%) in any discipline or its equivalent from a scheduled university. Candidates appearing in the final examination of a bachelor’s degree can also apply.","TECHNO offers a two-year full time dual specialization programme on the completion which, candidates are conferred with Postgraduate diploma in Management (PGDM). The curriculum lays the foundation for a conceptual and analytical understanding of Indian and international business. TECHNO’s programme is designed to closely integrate current management theory and prac...See More"
39,"Vidyalankar School of Information Technology, Mumbai",Mumbai,Maharashtra,Bachelors Of management studies,3 years,Full time,,UG,,,"Passed H.S.C. Examination of the Maharashtra Board of Higher Secondary Education or its equivalent examination or Diploma in any Engineering branches with two years or three years duration after S.S.C. conducted by the Board of Technical Education, Maharashtra State or its equivalent examination by securing minimum 45% marks for general category (in one attempt) or minimum 40% marks for the reserved category (in one attempt) at the respective Examination.",Bachelors Of Management studies Is three years full time Course offered by mumbai university
40,"Vidyalankar School of Information Technology, Mumbai",Mumbai,Maharashtra,Master in Marketing Management,,Part Time,60,PG,,,"A candidate for being eligible for admission to the degree must have passed:
A Bachelor’s degree of this University in any faculty or of a recognized University with five years executive (non-clerical ) experience in any of the related areas of Financial Accounting, Economics, Project and Corporate Planning.
OR A degree of this University in any faculty or of a recognized University and possess a recognized qualification such as ACA, AICWA, AMIE, CAIIB, etc. and have minimum two Years work experience (non-clerical) after graduation.
OR A degree of this University in any faculty or of a recognized University in first or second class and have minimum two years work experience (non-clerical) after graduation.
OR
A post graduate degree or diploma awarded by a recognized institutions and have a maximum two years work experience (non-clerical)
Every candidate must have (1) passed a Bachelor’s Degree Examination in any faculty of this University or an examination recognized by this University as equivalent thereto and
(2) acquired a minimum two years work experience (supervisor, executive) the experience being counted from the day subsequent to the last day of the qualifying examination passed by the candidate.
Candidate who has passed the D.M.S. examination of this University and is desirous of joining 3 years (Part-time) M.H.R.D.M., M.F.M. & M.M.M. degree course of this University be exempted from keeping terms and appearing at the first year of the respective course i.e. M.F.M., M.H.R.D.M. and M.M.M. courses as the case may be subject to the candidate having 3 years executive experience and fulfill the criteria laid down for admission to the concerned degree course.","Three year,Part-Time post-Graduate Programmes affiliated to Mumbai University.Empowers young and promising executives to grow Professionally and Personally.Course Practically applicable with reference to the Indian Business environment.
The program covers all the related areas of marketing including public sector marketing.
It seeks to develop an integrated top ma...See More"
41,"Vidyalankar School of Information Technology, Mumbai",Mumbai,Maharashtra,Master of Financial Management,2 years,Part Time,60,PG,,,"A candidate for being eligible for admission to the degree must have passed:
A Bachelor’s degree of this University in any faculty or of a recognized University with five years executive (non-clerical ) experience in any of the related areas of Financial Accounting, Economics, Project and Corporate Planning.
OR A degree of this University in any faculty or of a recognized University and possess a recognized qualification such as ACA, AICWA, AMIE, CAIIB, etc. and have minimum two Years work experience (non-clerical) after graduation.
OR A degree of this University in any faculty or of a recognized University in first or second class and have minimum two years work experience (non-clerical) after graduation.
OR
A post graduate degree or diploma awarded by a recognized institutions and have a maximum two years work experience (non-clerical)
Every candidate must have (1) passed a Bachelor’s Degree Examination in any faculty of this University or an examination recognized by this University as equivalent thereto and
(2) acquired a minimum two years work experience (supervisor, executive) the experience being counted from the day subsequent to the last day of the qualifying examination passed by the candidate.
Candidate who has passed the D.M.S. examination of this University and is desirous of joining 3 years (Part-time) M.H.R.D.M., M.F.M. & M.M.M. degree course of this University be exempted from keeping terms and appearing at the first year of the respective course i.e. M.F.M., M.H.R.D.M. and M.M.M. courses as the case may be subject to the candidate having 3 years executive experience and fulfill the criteria laid down for admission to the concerned degree course.","Three year,Part-Time post-Graduate Programmes affiliated to Mumbai University.Empowers young and promising executives to grow Professionally and Personally.Course Practically applicable with reference to the Indian Business environment.
The program covers all related areas of Finance and Accounting with emphasis on managerial applications.
Candidates having experi...See More"
42,"Vidyalankar School of Information Technology, Mumbai",Mumbai,Maharashtra,Masters in Human Resource Development Management,2 years,Part Time,60,PG,,,"A candidate for being eligible for admission to the degree must have passed:
A Bachelor’s degree of this University in any faculty or of a recognized University with five years executive (non-clerical ) experience in any of the related areas of Financial Accounting, Economics, Project and Corporate Planning.
OR A degree of this University in any faculty or of a recognized University and possess a recognized qualification such as ACA, AICWA, AMIE, CAIIB, etc. and have minimum two Years work experience (non-clerical) after graduation.
OR A degree of this University in any faculty or of a recognized University in first or second class and have minimum two years work experience (non-clerical) after graduation.
OR
A post graduate degree or diploma awarded by a recognized institutions and have a maximum two years work experience (non-clerical)
Every candidate must have (1) passed a Bachelor’s Degree Examination in any faculty of this University or an examination recognized by this University as equivalent thereto and
(2) acquired a minimum two years work experience (supervisor, executive) the experience being counted from the day subsequent to the last day of the qualifying examination passed by the candidate.
Candidate who has passed the D.M.S. examination of this University and is desirous of joining 3 years (Part-time) M.H.R.D.M., M.F.M. & M.M.M. degree course of this University be exempted from keeping terms and appearing at the first year of the respective course i.e. M.F.M., M.H.R.D.M. and M.M.M. courses as the case may be subject to the candidate having 3 years executive experience and fulfill the criteria laid down for admission to the concerned degree course.","Three year,Part-Time post Graduate Programmes affiliated to Mumbai University.Empowers young and promising executives to grow Professionally and Personally.Course Practically applicable with reference to the Indian Business environment.
This programs is to prepare executives for top level administrative positions in public or private sector organizations.
It lays ...See More"
43,"Himalayan University, Itanagar",Itanagar,Arunachal Pradesh,MBA Executive,1 year,Full time,,PG,,UGC,The candidate must have passed Graduation With 3 Years Experience.,"Master of Business Administration Executive is full-time one-year duration post graduate degree course and affiliated to Himalayan University, Itanagar."
44,"Himalayan University, Itanagar",Itanagar,Arunachal Pradesh,MBA Integrated,5 years,Full time,,PG,,UGC,The candidate should have passed in 10+2 or its equivalent from any recognized Board / University,"Master of Business Administration Integrated is full-time Five-year duration post graduate degree course and affiliated to Himalayan University, Itanagar."
45,"Himalayan University, Itanagar",Itanagar,Arunachal Pradesh,MBM,2 years,Full time,,PG,,UGC,The candidate should have passed BBM / BTP / M.Sc,"Master of Business Management is full-time two-year duration post graduate degree course and affiliated to Himalayan University, Itanagar."
