,College,City,State,Course,Duration,Study mode,Approved intake,Course level,Course Fee,Approval,Eligiblity,Course_Detail
98,"University Institute of Applied Management Sciences, Chandigarh",Chandigarh,Chandigarh,MBA Infrastructural Management,2 years,Full time,25,PG,,UGC,"Bachelor’s degree in Engineering/Technology, i.e. B.E./B. Tech. (in any Branch) of Panjab University or of any other University recognized by Panjab University as equivalent there to with at least 50%* marks in the aggregate. Or
Bachelor’s degree in any Science subject with Physics and/or Mathematics of Panjab University or of any other University recognized by Panjab University as equivalent there to with at least 50%* marks in the aggregate. Or
Bachelor’s in Computer Applications (BCA) of Panjab University or any of the other University recognized by the Panjab University as equivalent thereto with atleast 50%* marks in the aggregate. Or
AMIE examination with 50% marks or more after having passed the diploma examination with 60% marks or above and have at least 5 years research/teaching or professional experience","This is a two year full time course offered by Punjab University, Chandigarh.
UIAMS offers a complete learning experience and an in-depth immersion in management theory and practice. During the programme, UIAMS helps in developing a broad base of knowledge that equips our participants to make complex, analytical decisions. Students at UIAMS challenge themselves to le...See More"
99,"University Institute of Applied Management Sciences, Chandigarh",Chandigarh,Chandigarh,MBA Pharmaceutical Management,2 years,Full time,25,PG,,UGC,"Bachelor’s degree in Pharmacy of Panjab University or of any other university recognized by Panjab University as equivalent there to with at least 50% marks in aggregate. Or
M.B.B.S of Panjab University or of any other university recognized by Panjab University as equivalent there to with at least 50%* marks in aggregate. Or
Bachelor’s Degree in any Science subject of Panjab University or of any other University recognized by Panjab University as equivalent there to with at least 50%* marks in the aggregate AND Diploma in Pharmacy of Panjab University or of any other University recognized by Panjab University as equivalent there to with at least 50%* marks in aggregate.","This is a two year full time course offered by Punjab University, Chandigarh.
UIAMS offers a complete learning experience and an in-depth immersion in management theory and practice. During the programme, UIAMS helps in developing a broad base of knowledge that equips our participants to make complex, analytical decisions. Students at UIAMS challenge themselves to le...See More"
100,"University Institute of Applied Management Sciences, Chandigarh",Chandigarh,Chandigarh,MBA Retail Management,2 years,Full time,50,PG,,UGC,"A Bachelor’s or Master Degree in any discipline of Panjab University or of any other university which has been recognized by the syndicate as equivalent thereto with not less than 50%* marks in the aggregate. Provided that in case of candidates having Bachelor’s degree of the University through Modern Indian Languages [Hindi/Urdu/Punjabi (Gurumukhi Script)] and/or in a classical language (Sanskrit/ Persian/Arabic) or degree of any other university obtained in the same manner recognized by the Syndicate, 50% marks in the aggregate shall be calculated by taking into account full percentage of marks in all the papers in Language excluding the additional optional paper, English and the elective subject taken together. Or
Pass in the final examination conducted by either (a) Institute of Chartered Accountants of India or England, or (b) Institute of Cost and Works Accountants of India or England or (c) Institute of Company Secretaries of India Or
AMIE examination with 50% marks or more after having passed the diploma examination with 60% marks or above and have at least 5 years research/teaching or professional experience.","This is a two year full time course offered by Punjab University, Chandigarh.
UIAMS offers a complete learning experience and an in-depth immersion in management theory and practice. During the programme, UIAMS helps in developing a broad base of knowledge that equips our participants to make complex, analytical decisions. Students at UIAMS challenge themselves to le...See More"
101,"Renaissance College of Commerce and Management, Indore",Indore,Madhya Pradesh,BBA,3 years,Full time,,UG,,,"Any XII pass-out from any board (M.P. or C.B.S.E.) is eligible for admission, provided that he/she must get 60% marks aggregate in the final examination.","It is 3 year full time course with affiliation of Devi Ahilya Vishwavidyalaya, Indore and accreditation by NAAC."
102,"International Institute of Management, Media and IT, Delhi",New Delhi,Delhi,BBA + ADIB,3 years,Full time,,UG,1.8 lakhs,,"10+2 or equivalent examination from board of school education, CBSE or any other recognised board or 3 years Diploma from Board of Technical Education, or its equivalent.","It is 3 year full time course with affiliation of Guru Jambheshwar University of Science & Technology, Hisar and NAAC Accredited with Grade ""A""."
103,"International Institute of Management, Media and IT, Delhi",New Delhi,Delhi,BBA + ADIB Afternoon,3 years,Full time,,UG,,,"10+2 or equivalent examination from board of school education, CBSE or any other recognised board or 3 years Diploma from Board of Technical Education, or its equivalent.","It is 3 year full time course with affiliation of Guru Jambheshwar University of Science & Technology, Hisar and NAAC Accredited with Grade ""A""."
104,"International Institute of Management, Media and IT, Delhi",New Delhi,Delhi,MBA Weekend Program,2 years,Part Time,,PG,,,"Bachelor’s degree in any discipline from UGC Recognized University.
Candidates appearing in the final year exams can also apply.","2 year Master of Business Administration (MBA) is weekend course with affiliation of Guru Jambheshwar University of Science & Technology, Hisar and NAAC Accredited with Grade ""A""."
105,"International Institute of Management, Media and IT, Delhi",New Delhi,Delhi,PG Diploma in Business Administration Weekend Program,1 year,Part Time,,PG,,,"Bachelor’s degree in any discipline from UGC Recognized University.
Candidates appearing in the final year exams can also apply.","1 year PG Diploma in Business Administration is weekend course with affiliation of Guru Jambheshwar University of Science & Technology, Hisar and NAAC Accredited with Grade ""A""."
106,"GNA Business School, Phagwara",Dhak Khati,Punjab,BBA,3 years,Full time,,UG,,UGC,"The student should have passed 10 + 2 standard with 50%
marks in aggregate.(45% for SC / ST","The BBA program in faculty of Business studies provids a strong foundation in core business disciplines,helping participants to acquire the key competencies needed by all business management students at an undergradute lavel student can chose specialiazation in the third year and can have extensive learning exprience in the chosen area"
107,"GNA Business School, Phagwara",Dhak Khati,Punjab,MBA,,Full time,,PG,,UGC,The student should have Bachelor degree any stream with 50% marks for general category and 45% for SC/ST,"The two year MBA program is intensive, rigorous, and life transforming. The intenses learning during the two years at GBS will halp you question the conventions while assuming more accountability and ownership for business performance and results. Experenced faculty and mentores will instil in you the spirit of enterpreneurial tninking and innovation through contempor...See More"
108,"RIMT University, Gobindgarh",Gobindgarh,Punjab,MBA Pharma Management,2 years,Full time,,PG,2.8 lakhs,UGC,The candidate should have passed in the relevant graduate degree in any recognized university.,"Master of Business Administration in Pharma Management is full time two year course degree offered by RIMT University, Gobindgarh and approved by UGC."
109,"RIMT University, Gobindgarh",Gobindgarh,Punjab,MBA Retail Management,2 years,Full time,60,PG,1.86 lakhs,UGC,All those candidates who have passed Bachelors Degree of minimum three year duration in any discipline from a University recognized by the University Grants Commission (UGC).,"Master of Business Administration in Retail Management is full time two year course degree offered by RIMT University, Gobindgarh and approved by UGC."
110,"RIMT University, Gobindgarh",Gobindgarh,Punjab,PG Diploma Hospital Management,1 year,Full time,,Diploma,1.4 lakhs,UGC,The candidate should have passed in Bachelor of Pharmacy of any recognized university.,"Post Graduate Diploma in Hospital Management is full time one year course degree offered by RIMT University, Gobindgarh and approved by UGC."
111,"RIMT University, Gobindgarh",Gobindgarh,Punjab,PG Diploma Pharma Management,1 year,Full time,,Diploma,1.4 lakhs,UGC,The candidate should have passed in Bachelor of Pharmacy of any recognized university.,"Post Graduate Diploma in Pharma Management is full time one year course degree offered by RIMT University, Gobindgarh and approved by UGC."
112,"RIMT University, Gobindgarh",Gobindgarh,Punjab,PG Diploma Pharma Sales and Marketing,1 year,Full time,,Diploma,1.4 lakhs,UGC,The candidate should have passed in Bachelor of Pharmacy of any recognized university.,"Post Graduate Diploma in Pharma Sales and Marketing is full time one year course degree offered by RIMT University, Gobindgarh and approved by UGC."
113,"GD Goenka School of Management, Gurgaon",Sohna,Haryana,PGD in Human Resource management,1 year,Full time,,PG,0.85 lakhs,UGC,"An undergraduate degree in an appropriate discipline from UGC approved University. In addition, applicants will also have to successfully complete a Goenka Aptitude Test for Admission (GATA) and appear for a personal interview.","Human resource management is the backbone of all the organizations. It matches the manpower requirements both for the present and futuristic needs. The programme comprises of learning by practical work, case studies, industry interface, research findings, and dissertation covering different areas of human resource management. Students will get an in-depth understandin...See More"
114,"GD Goenka School of Management, Gurgaon",Sohna,Haryana,PGD in Operations Management,1 year,Full time,,PG,0.85 lakhs,UGC,"An undergraduate degree in an appropriate discipline from UGC approved University. In addition, applicants will also have to successfully complete a Goenka Aptitudes Test for Admission (GATA) and appear for a personal interview.","The program begins by laying the groundwork for a comprehensive understanding of what operations management is and how it can be effectively used to increase an organization’s efficiency and profitability. The program further, facilitate discussion and investigation into different operations strategies and process selection for both manufacturing and service industr...See More"
115,"Arch Academy of Design, Jaipur",Jaipur,Rajasthan,BBA Design,3 years,Full time,,UG,,UGC,The candidate should have passed in 12TH Pass (48%min),"The BBA in Design from ARCH College of Design & Business educates students in the entrepreneurial and strategic aspects of Design and in Design aspects of Business. Project-based studio and seminar courses integrate Business, Design, and Liberal Arts Education, promoting interdisciplinary learning through wide-ranging research and collabor"
116,"Sai Tirumala NVR Engineering College, Guntur",Narasaraopet,Andhra Pradesh,MBA,2 years,Full time,120,PG,0.54 lakhs,(AICTE) All India Council of Technical Education,The candidate should have passed in any graduate degree,"MBA is a two year full time course approved by AICTE and affiliated by Jawaharlal Nehru Technological University, Kakinada"
117,"Hanuman Vyayam Prasarak Mandal's College of Engineering and Technology, Amravati",Amravati,Maharashtra,MBA,2 years,Full time,60,PG,1.38 lakhs,(AICTE) All India Council of Technical Education,The candidate should have Bachelors degree in related branch from recognized university.,"Master in Business Administration is 2 year duration full time course with affiliation of Sant Gadge Baba Amravati University, Amravati and approved by AICTE, DTE and Maharashtra Government."
118,"VSA School of Engineering and School of Management, Salem",Salem,Tamil Nadu,MBA,2 years,Full time,60,PG,0.6 lakhs,(AICTE) All India Council of Technical Education,"A Pass in a recognized Bachelor’s degree of minimum 3 years duration and obtained atleast 50% (45% in case of candidates belonging to reserved category) at the qualifying examination in 10+2+3 years pattern.
Or
10+3 years Diploma +3 years pattern (or) B.E./B.Tech./B.Arch./B.Pharm.(or) AMIE with 2 years regular fill time Teaching experience / Industrial experience in the relevant field after passing all the subjects.","Department of Management Studies was started in the academic year 2009-2010. It is 2 year full time course with affiliation of Anna University, Chennai and approved by AICTE. The primary focus of our MBA programme is to impart, to the young minds, a well balanced mix of theories and concepts that relate well to the practicalities of the industrial worlds. In the era o...See More"
119,"Dhanalakshmi Srinivasan Institute of Technology, Tiruchirappalli",Manickapuram,Tamil Nadu,MBA,2 years,Full time,60,PG,0.6 lakhs,(AICTE) All India Council of Technical Education,A pass in a recognized Bachelor's degree of minimum 3 years duration and obtained at least 50% (45% in case of candidates belonging to reserved category) at the qualifying examination in 10+2+3 years pattern (or) 10+3 years Diploma + 3 years pattern (or) B.E./B.Tech./B.Arch./B.Pharm. (or)AMIE with 2 years regular full-time Teaching experience / Industrial experience in the relevant field after passing all the subjects. Should Clear TANCET 2017 Exam.,"This is a two-year full-time programme leading to a Master of Business Administration from the Anna University, Chennai
Core Specializations - Dual Specialization Model
-Marketing
-Finance
-HRM
Systems"
120,"NOVA College of Engineering and Technology, Jangareddygudem",Vegavaram,Andhra Pradesh,MBA,2 years,Full time,180,PG,0.55 lakhs,(AICTE) All India Council of Technical Education,The candidate should have passed in the relevant graduate degree from any recognized university.,"Master of Business Administration is full time two year course affiliated to and Jawaharlal Nehru Technological University, Kakinada approved by AICTE."
121,"Christ College of Engineering and Technology, Puducherry",Puducherry,Puducherry,MBA,2 years,Full time,180,PG,0.66 lakhs,(AICTE) All India Council of Technical Education,Candidates who have passed any degree and secured 50% of marks( 45% in case of candidate belonging to reserved category) in UG Degree.,"Master of Business Administration is two-year duration full-time course affiliated to Pondicherry University, Puducherry and approved by All India Council for Technical Education (AICTE)."
122,"Sri Sai College of Engineering and Technology, Pathankot",Bungal,Punjab,MBA,2 years,Full time,60,PG,1.57 lakhs,(AICTE) All India Council of Technical Education,The candidate Should have passed with minimum 50% marks in graduation or equivalent degree obtained from recognised University.,"MBA is a full-time 2 years duration course Affiliated to IK Gujral Punjab Technical University, Jalandhar Approved by AICTE."
123,"MJRP College of Engineering and Technology, Jaipur",Jaipur,Rajasthan,MBA,2 years,Full time,60,PG,,(AICTE) All India Council of Technical Education,,
124,"Priyadarshani College of Computer Sciences, Greater Noida",Greater Noida,Uttar Pradesh,MBA,2 years,Full time,60,PG,1.26 lakhs,(AICTE) All India Council of Technical Education,The candidate should have passed in the relevant graduate degree.,"Master of Business Management is full time two year course affiliated to Dr APJ Abdul Kalam Technical University, Lucknow and approved by AICTE."
125,"Kunwar Satya Vira College of Engineering and Management, Bijnor",Bijnor,Uttar Pradesh,MBA,2 years,Full time,120,PG,1.23 lakhs,(AICTE) All India Council of Technical Education,Any graduation with minimum 50% (for General/OBC) and 45% (for SC/ST) aggregate marks from any recognized University.,"It is two years full time course Approved By AICTE, New Delhi, and Affiliated to Dr. A.P.J. Abdul Kalam Technical University, Lucknow"
126,"Swami Vivekanand Institute of Engineering and Technology, Patiala",Jansla,Punjab,MBA,2 years,Full time,60,PG,,(AICTE) All India Council of Technical Education,All those candidate who have any recognized Bachelor’s Degree of minimum 3 years duration in any discipline,"This is a two year full time course Approved By AICTE and Approved By Punjab Technical University, Jalandhar"
127,"PBR Visvodaya Engineering College, Nellore",Kavali,Andhra Pradesh,MBA,2 years,Full time,120,PG,,(AICTE) All India Council of Technical Education,,
128,"NC College of Engineering, Israna",Jondhan Khurd,Haryana,MBA,2 years,Full time,60,PG,1.8 lakhs,(AICTE) All India Council of Technical Education,Candidate must have passed bachelor degree in related discipline from recognized university,"Master of Business Administration is full-time two-year post graduate degree course, recognized by AICTE"
129,"KCE Society's College of Engineering and Information Technology, Jalgaon",Jalgaon,Maharashtra,MBA,2 years,Full time,60,PG,1 lakh,(AICTE) All India Council of Technical Education,"(As per DTE, Mumbai, (M.S.) Norms) Passed with minimum 50% marks in aggregate (45% in case of candidates of backward class categories belonging to Maharashtra State Only) in any Bachelor's degree of minimum three years duration in any discipline recognized by the Association of Indian Universities.","This is a two year full time course approved by AICTE, New Delhi, Accredited by NAAC and affiliated to North Maharashtra University, Jalgaon
Areas of Specilisation
Marketing, Finance, Human Resource, Systems, International Business Management, Operations & Materials Management, Rural Development Management"
130,"BBS College of Engineering and Technology, Allahabad",Phaphamau,Uttar Pradesh,MBA,2 years,Full time,60,PG,1.62 lakhs,(AICTE) All India Council of Technical Education,Candidate must have passed bachelor degree from recognized university,"Master of Business Administration is full-time two-year post graduate degree course, recognized by AICTE"
131,"Vivekananda College of Technology and Management, Aligarh",Aligarh,Uttar Pradesh,MBA,2 years,Full time,60,PG,1.41 lakhs,(AICTE) All India Council of Technical Education,The candidate should have passed any graduate degree from any recognized college or university,"Master of Business Administration is 2 years full time course and offered by Dr APJ Abdul Kalam Technical University, Lucknow and approved by AICTE
specializations in:
Marketing
Finance
Human Resource Development
Information Technology
International Business"
132,"Veerappa Nisty Engineering College, Shorapur",LAKSHAMPUR,Karnataka,MBA,2 years,Full time,60,PG,1 lakh,(AICTE) All India Council of Technical Education,The candidate should have passed any graduation degree from any recognized institution or university.,"MBA program affiliated to Visvesvaraya Technological University and approved by AICTE. The program became a notable success within a short span of time. Today, VNEC's MBA program stands out amidst other MBA programs in quality of faculty, learning environment, academic life and infrastructure and placement results. What clearly distinguishes VNEC's program from others...See More"
133,"The Kavery Engineering College, Salem",M.Kalipatti,Tamil Nadu,MBA,2 years,Full time,60,PG,0.5 lakhs,(AICTE) All India Council of Technical Education,"Minimum average marks in the Pre-Final and Final semesters put together or Final year
General Category	50%
Backward Class including
Backward Class Muslim	45%
MBC & DNC	45%
SC / SCA / ST	45%","Master of Business Administration is two years full-time Post graduate management programme offered by Anna University, Chennai and approved by AICTE"
134,"Technology Education and Research Institute, Kurukshetra",Barna,Haryana,BBA,3 years,Full time,60,UG,1.22 lakhs,,The candidate should have passed 12th with 40% marks.,"Bachelor of Business Administration is three years full time course and affiliated to Kurukshetra University, Kurukshetra."
135,"Technology Education and Research Institute, Kurukshetra",Barna,Haryana,MBA Finance,2 years,Full time,20,PG,1.34 lakhs,(AICTE) All India Council of Technical Education,Recognized Bachelor Degree of minimum 3 years duration.,"Master of Business Administration in Finance is two years full time course. Approved by AICTE and affiliated to Kurukshetra University, Kurukshetra."
136,"Technology Education and Research Institute, Kurukshetra",Barna,Haryana,MBA Human Resource,2 years,Full time,20,PG,1.34 lakhs,(AICTE) All India Council of Technical Education,Recognized Bachelor Degree of minimum 3 years duration.,"Master of Business Administration in Human Resource is two years full time course. Approved by AICTE and affiliated to Kurukshetra University, Kurukshetra."
137,"Technology Education and Research Institute, Kurukshetra",Barna,Haryana,MBA Marketing,2 years,Full time,20,PG,1.34 lakhs,(AICTE) All India Council of Technical Education,Recognized Bachelor Degree of minimum 3 years duration.,"Master of Business Administration in Marketing is two years full time course. Approved by AICTE and affiliated to Kurukshetra University, Kurukshetra."
138,"Tagore Institute of Engineering and Technology, Salem",Deviyakurichi,Tamil Nadu,MBA,2 years,Full time,60,PG,0.6 lakhs,(AICTE) All India Council of Technical Education,The candidate should have min. General Category 50.00% and Reserved Category 45.00% marks in Bachelors Degree.,"Master of Business Administration is two years full time course. Approved by AICTE and affiliated to Anna University, Chennai.
Management Studies provides basic inputs for management and business strategy. It provides a strong foundation for future learning. The focus is on providing integrated approach to different functional areas of management. The department pl...See More"
139,"Swami Vivekanand College of Science and Technology, Bhopal",Bhopal,Madhya Pradesh,MBA,2 years,Full time,120,PG,0.91 lakhs,(AICTE) All India Council of Technical Education,The candidate should have passed graduation in any discipline.,"Master of Business Administration is two years full time course. Approved by AICTE and affiliated to Rajiv Gandhi Proudyogiki Vishwavidyalaya, Bhopal.
The world is changing quickly and so are the challenges that face tommorrow's leaders. The SVCST-MBA Program helps you develop a leadership mindset and strong foundation of management skills to succeed in your first...See More"
140,"Surya School of Planning and Engineering Management, Lucknow",Puraheya,Uttar Pradesh,MBA,2 years,Full time,60,PG,1.11 lakhs,(AICTE) All India Council of Technical Education,The candidate should have passed graduation in any discipline.,"Master of Business Administration is two years full time course. Approved by AICTE and affiliated to Dr APJ Abdul Kalam Technical University, Lucknow.
An MBA programs strives to equip its students with all the necessary knowledge, tool and techniques for better decision making and handling administrative matters."
141,"Suraj College of Engineering and Technology, Mahendragarh",Salimabad,Haryana,BBA,3 years,Full time,60,UG,,"Directorate of Technical Education, Haryana","Candidate must have passed 10+2 level or equivalent examination from any recognised board or university, securing minimum 45% (40% for SC/ST) marks in aggregate.","Bachelor of Business Administration is three years full time course and affiliated to Maharshi Dayanand University, Rohtak."
142,"Suraj College of Engineering and Technology, Mahendragarh",Salimabad,Haryana,MBA,2 years,Full time,60,PG,0.99 lakhs,(AICTE) All India Council of Technical Education,Candidate must have passed three year degree course from a recognised university securing minimum 50% (45% for SC/ST) marks in aggregate.,"Master of Business Administration is two years full time course. Approved by AICTE and affiliated to Maharshi Dayanand University, Rohtak."
143,"Subharti College of Engineering and Technology, Meerut",Panchli Khurd,Uttar Pradesh,MBA,2 years,Full time,60,PG,,(AICTE) All India Council of Technical Education,,
144,"St Soldier Institute of Engineering and Technology, Jalandhar",Gopalpur Alias Bidh,Punjab,MBA,2 years,Full time,60,PG,1.4 lakhs,(AICTE) All India Council of Technical Education,All those candidates who have passed Bachelors Degree of minimum three years duration in any discipline from a University recognized by the University Grants Commission (UGC) and with valid rank in CMAT shall be eligible to apply for MBA course,"MBA is a two year full time course approved by AICTE and affiliated by IK Gujral Punjab Technical University, Jalandhar"
