,College,City,State,Course,Duration,Study mode,Approved intake,Course level,Course Fee,Approval,Eligiblity,Course_Detail
302,"Guru Nanak Dev University Regional Campus, Sultanpur Lodhi",Nathupur,Punjab,BBA,3 years,Full time,60,UG,,,"10+2 or any other examination recognized equivalent thereto by GND University, Amritsar in any stream with at least 40% marks (35% for SC/ST) in aggregate.","Bachelor of Business Administration is a full-time 3 years duration course Affiliated to Guru Nanak Dev University, Amritsar."
303,"Rajarshi Rananjay Singh Institute of Management and Technology, Amethi",Saray Khema,Uttar Pradesh,MBA,2 years,Full time,60,PG,1.21 lakhs,(AICTE) All India Council of Technical Education,"For admission to the first year of MBA course, Candidate must have passed bachelor's degree course of minimum three years duration from any recognized university of india. The candidate must have clearly passed without grace marks with an aggregate minimum 50% Marks for General & OBC and 45% for SC/ ST candidates.","The MBA program aims at providing inputs to the students relevant to the business, industry and trade so that they can function in different organizations and face the challenges arising there from. The program not only aims at providing knowledge and skills in different areas of management, but also provides inputs necessary for the overall development of the persona...See More"
304,"Siddhivinayak College of Science and Higher Education, Alwar",Alwar,Rajasthan,MBA,2 years,Full time,30,PG,1.1 lakhs,(AICTE) All India Council of Technical Education,Any student who has passed graduation (10+2+3) course in any stream with 50% marks without any approximation (45% for SC/ST/OBC Candidates) are eligible for admission,"The 2 yrs MBA programme of Siddhi Vinayak College of Science & Hr. Education, Affiliated to Rajasthan Technical University Kota, offers specialization in HR, Finance, Marketing and IT areas."
305,"Nimra Women’s College of Engineering, Vijayawada",Jupudi,Andhra Pradesh,MBA,2 years,Full time,60,PG,,(AICTE) All India Council of Technical Education,Candidate must have passed bachelor degree from recognized university,"Master of Business Administration is full time two year post graduate degree course, specialisations offered - Banking, Finance, Human Resource, Retail, Marketing, Retail Operations, Information Systems etc."
306,"PSN Engineering College, Tirunelveli",Pannankulam,Tamil Nadu,MBA,2 years,Full time,60,PG,1 lakh,(AICTE) All India Council of Technical Education,A pass in a recognized bachelor's degree of minimum 3 years duration and obtained at least 50% (45% in the case of candidates belonging to reserved category) in the qualifying degree examination. 10+2 years HSC + 3 years bachelor's patternn Or 10+3 years diploma + 3 years bachelor's pattern Or B.E / B. Tech / B. Arch / B. Pharm Or A.M.I.E with 2 years industrial experience,"Completion of a rigorous MBA degree testifies to your ability to map out a course of action and see it through. It equips you with valuable life-long skills in critical thinking, leadership, understanding behavior and analysis that are useful beyond the workplace."
307,"Maharana Pratap College of Engineering, Kanpur",Mandhana,Uttar Pradesh,MBA,2 years,Full time,60,PG,1.91 lakhs,(AICTE) All India Council of Technical Education,The candidate should have passed any Graduation degree from any recognized college or University.,"Master of Business Administration is two years full-time Postgraduate management program Affiliated by Dr APJ Abdul Kalam Technical University, Lucknow and approved by AICTE"
308,"Chaitanya Engineering College, Bhimavaram",Bhimavaram,Andhra Pradesh,MBA,2 years,Full time,120,PG,,(AICTE) All India Council of Technical Education,,
309,"Nimra Institute of Engineering and Technology, Ongole",Yedugundlapadu,Andhra Pradesh,MBA,2 years,Full time,60,PG,0.7 lakhs,(AICTE) All India Council of Technical Education,Candidate must have passed related bachelor degree from recognized unversity,Master of Business Administration is full time two year post graduate degree course
310,"Sri Parashuram Institute of Technology and Research, Khandwa",Arud,Madhya Pradesh,MBA,2 years,Full time,60,PG,0.8 lakhs,(AICTE) All India Council of Technical Education,The candidate should have passed any graduation degree from any recognized college or University.,"Master of Business Administration is two years full-time Post graduate management programme offered by Devi Ahilya University, Indore and approved by AICTE
Courses
Human Resource Management
Electronics and Telecommunication Engineering
Information Technology Management
Operation Management
Marketing Managament
Finance Management"
311,"Bansal MBA College, Bhopal",Bhopal,Madhya Pradesh,MBA,24 years,Full time,120,PG,,,,<p><strong>Specialization offered</strong>:</p><ul><li>Marketing</li><li>Finance</li><li>Human Resource</li><li>I.T.</li></ul>
312,"Amrapali Institute, Haldwani",Haldwani,Uttarakhand,BBA,3 years,Full time,,UG,,,10 + 2 with 40% marks,Duration of the course shall be spread over 3 Years.
313,"Amrapali Institute, Haldwani",Haldwani,Uttarakhand,MBA,2 years,Full time,90,PG,1.64 lakhs,(AICTE) All India Council of Technical Education,,"<p>About: - MBA-Stands for Master of Business Administration. MBA is a two years full time programme approved by AICTE and affiliated to Uttarakhand Technical University. The course content is aimed to bring a student near to business realities and make him/ her aware of global cultural, socio-economic and technological contexts.</p><p>Eligibility: -...See More"
314,"Vidyasagar Institute of Management, Bhopal",Bhopal,Madhya Pradesh,BBA,3 years,Full time,30,UG,,UGC,The candidate should have passed in 10+2 or its equivalent from any recognized Board.,"Bachelor of Business Administration is a full time 3 year professional, job oriented, degree program from Barkatullah University comprising of 6 semesters and having a contemporary and innovative curriculum. BBA focuses on grooming and promoting managerial abilities. By providing extensive knowledge on the science of management and developing and promoting skills and ...See More"
315,"Vidyasagar Institute of Management, Bhopal",Bhopal,Madhya Pradesh,MBA,2 years,Full time,60,PG,1.36 lakhs,(AICTE) All India Council of Technical Education,"The candidate seeking admission to the program must be any graduate with a minimum aggregate of 50% (40% in case OBC & SC/ ST candidates). Candidates are required to appear in Management Entrance Test (MET) conducted by M.P. Professional Exam Board popularly known as VYAPAM, Bhopal followed by group discussion and personal interview.","The programme prepares candidates for management careers in industry and services. It is a two years full time programme, affiliated to Barkatullah University, Bhopal, approved by AICTE, New Delhi and recognised by Government of Madhya Pradesh. The students meeting the programme requirements are awarded the Master’s Degree in Business Management (MBA) from Barkatull...See More"
316,"Mahatma Gandhi College, Guntur",Guntur,Andhra Pradesh,MBA,2 years,Full time,60,PG,,(AICTE) All India Council of Technical Education,Graduate in any discipline with 50% marks from any university,Master of Business Administration is a two-years Postgraduate course Approved by AICTE and Affiliated to Acharya Nagarjuna University.
317,"Jain College, Gwalior",Gwalior,Madhya Pradesh,BBA,3 years,Full time,120,UG,0.74 lakhs,"Directorate of Technical Education, Madhya Pradesh","Successful completion of 10+2 or equivalent examination in any subject except agriculture with minimum 50% marks for general and 45% marks OBC/SC/ST category.
Age Limit : General- 23 yrs, SC/ST/OBC- 26yrs, Female- No Age bar","Bachelor of Business Administration (BBA) Duration : Six Semester (3 Years)
Approval and Affiliation : Approved by MP Higher Education and Affiliated to Jiwaji University, Gwalior.
This programme is suitable for students who have just passed 10+2 and looking forward to a career in the modern business world. Syllabus has been designed to give exposure to basics of di...See More"
318,"Jain College, Gwalior",Gwalior,Madhya Pradesh,MBA,2 years,Full time,180,PG,0.84 lakhs,(AICTE) All India Council of Technical Education,Successful completion of 10+2+3 (Graduation) or equivalent examination in any subject with minimum 50% marks for General and 45% marks for OBC/SC/ST category.,"Master of Business Administration (MBA) Duration : Four Semester (2 Years) Approval and Affiliation : Approval AICTE, Recognized by DTE and Affiliated to Jiwaji University, Gwalior.
Marketing, Finance, Information Technology and Human Resource are the four major areas in management, with each having several sub-branches. Marketing Management includes Sales, Purchase,...See More"
319,"AV College of Arts Science and Commerce, Hyderabad",Hyderabad,Telangana,MBA,2 years,Full time,60,PG,0.64 lakhs,(AICTE) All India Council of Technical Education,The candidate should have passed any graduation degree from any recognized college or University.,"<p><strong>About the Course:</strong> The institute offers a full time two year course in Masters of Business Administration Affiliated to Osmania University</p><p><strong>Specialisation:</strong> Marketing, Finance, HR and Systems Management</p>"
320,"Vikrant Institute of Management, Gwalior",Gwalior,Madhya Pradesh,MBA,2 years,Full time,180,PG,,(AICTE) All India Council of Technical Education,"Graduation from any branch with minimum 50% marks for general category and 45% for students of OBC,SC, and ST category. (as per DAVV norms).","MBA Degree (Master of Business Administration) Course. The details of AICTE Approved MBA are as follows:
Specialization - Human Resource, Finance, Marketing, Operation, Information System.
The MBA course is affiliated to Jiwaji University, Gwalior, The course is approved by DTE (Directorate of Technical Education) Govt. of Madhya Pradesh & Approved by AICTE (All I...See More"
321,"Vikrant Institute of Management, Gwalior",Gwalior,Madhya Pradesh,MBA Dual Degree,5 years,Full time,60,PG,,(AICTE) All India Council of Technical Education,The candidate should have passed in 10+2 or its equivalent from any recognized Board.,"Master of Business Administration (5Year Dual Degree UG+PG) is a five-year full-time dual degree program.
The MBA Dual Degree course is affiliated to Jiwaji University, Gwalior, The course is approved by DTE (Directorate of Technical Education) Govt. of Madhya Pradesh & Approved by AICTE (All India Council for Technical Education) Ministry of HRD Govt. of India new D...See More"
322,"Jawaharlal Nehru Institute of Business Management, Ujjain",Ujjain,Madhya Pradesh,MBA,2 years,Full time,60,PG,,(AICTE) All India Council of Technical Education,,
323,"Pendekanti Institute of Management, Hyderabad",Hyderabad,Telangana,MBA,2 years,Full time,120,PG,1.4 lakhs,(AICTE) All India Council of Technical Education,"1. Bachelor degree holder of Osmania University or a degree recognized by the university as equivalent thereto and /(or) as per the rules laid down by the University;
2. The candidate seeking admission must qualify in the Entrance Examination, conducted by the appropriate authority in the year of admission as per the norms prescribed by the University.
3. The admission of Non-resident Indians and candidates admitted in lieu of them will be as per the University Rules in force on the date of the admission.
4. Foreign candidates' admission is based on the Screening Process of the University currently in vogue.","MBA Programme Designed to train students to become excellent general managers and high-level-decision-makers with broad strategic vision, this full-time two-year MBA program views management as an integrated process and helps students develop a global view and respond effectively to changes in the economic, technological, cultural and political environments. The MBA p...See More"
324,"Sarojini Naidu Vanitha Maha Vidhyalaya, Hyderabad",Hyderabad,Telangana,MBA,2 years,Full time,120,PG,,(AICTE) All India Council of Technical Education,The minimum academic qualification required for doing MBA course is any bachelor degree or equivalent from recognized university.,"Business Management (MBA) is a two-year full-time postgraduate program, consisting of four semesters. This course is approved by AICTE and is affiliated to Osmania University.
We offer two specializations namely, Human Resources Management and Financial Management. Minor specializations include Systems, Marketing, Human Resource and Finance."
325,"Ambedkar Institute of Management Studies, Visakhapatnam",Visakhapatnam,Andhra Pradesh,PGDM,2 years,Full time,120,PG,1.5 lakhs,(AICTE) All India Council of Technical Education,"* AIMS looks for more promising and motivated students from different states of India.
* Admissions into the Two Year Full Time PGDBM Programme are made on All India Basis.
* Any Graduate with 50% marks from any recognized university Candidates seeking admission into PGDBM Programme are required to secure good score in MAT/ATMA/ICET or any Admission Test of University/Govt.
* Qualified candidates need to apply to the Institute in the prescribed Application Form that can be obtained from the Institute by paying Rs.800/- by DD/Cash.
* Application can be downloaded from the Institute’s website.
* Filled-in-application with the pass port size photograph and copies of certificates, DD for Rs.800/- need to be submitted on time.","The Post Graduate Programme in Business Management is approved by the All India Council for Technical Education (AICTE), New Delhi. It is a full time course offered through Four Semesters. The programme’s focus is to impart quality management education conforming to global standards."
326,"Noble Institute of Science and Technology, Visakhapatnam",Nanginarapadu,Andhra Pradesh,MBA,2 years,Full time,180,PG,,(AICTE) All India Council of Technical Education,"A pass for all three years of study in the Bachelor’s Degree (other than B.F.A. & B.A., (OL) of Andhra University or any other University recognized by the Academic Senate as Equivalent thereto.","This is a two-year full-time programme leading to a Master of Business Administration from the Andhra University, Visakhapatnam"
327,"Noble Institute of Science and Technology, Visakhapatnam",Nanginarapadu,Andhra Pradesh,MBA Part Time,3 years,Part Time,,PG,,,"A pass for all three years of study in the Bachelor’s Degree (other than B.F.A. & B.A., (OL) of Andhra University or any other University recognized by the Academic Senate as Equivalent thereto and at least two years full-time work experience in a position not below the rank of a Junior Executive in the organization which have been approved by the University for the purpose. The applicant should be working in the organization located at Visakhapatnam by the date of submission of his/her application. If the applicant gets admission, he/she has to stay at Visakhapatnam for the entire period of study, i.e. three years.","This is a three-year part-time programme leading to a Master of Business Administration from the Andhra University, Visakhapatnam"
328,"Alluri Institute of Management Sciences, Warangal",Hanamkonda,Telangana,MBA,2 years,Full time,240,PG,,(AICTE) All India Council of Technical Education,,
329,"Institute of Professional Studies and Research, Cuttack",Cuttack,Odisha,BBA,3 years,Full time,,UG,,"Department of Higher Education, Government of Odisha",The candidate should have passed in 10+2 or its equivalent from any recognized Board.,"BBA a 3 year Bachelor Degree programme is approved by the Department of Higher education, Government of Odisha and affiliated to the Utkal University.
BBA of late has been a sought after professional education course to meet the growing demand for young professionals in the field of management. Pursuing MBA after BBA is now preferred by a large section of the student...See More"
330,"Institute of Professional Studies and Research, Cuttack",Cuttack,Odisha,MBA,2 years,Full time,120,PG,3.6 lakhs,(AICTE) All India Council of Technical Education,The minimum academic qualification required for doing MBA course is any bachelor degree or equivalent from recognized university.,Master in Business Administration program is the most sought after qualification as it aims at nurturing young graduates for the chaning landscape of business. Challenges in the business both in the domestic and global market have redefined business process requiring thereby qualified and trained business executives. Emerging business areas in with more thrust in Tech...See More
331,"Global Entrepreneurship and Management Academy, Delhi",New Delhi,Delhi,BBA,3 years,Full time,,UG,,,,"<p><strong>About programme:</strong> Global Entrepreneurship and Management Academy offers three year BBA programme, affiliated to Punjab Technical University.</p><p><strong>Specialization:</strong> Finance, HRM, Information Technology &amp; Marketing.</p><p><strong>Eligibility:</strong> Candidate s...See More"
332,"Global Entrepreneurship and Management Academy, Delhi",New Delhi,Delhi,MBA,2 years,Full time,,PG,,,,"<p><strong>About programme:</strong> Global Entrepreneurship and Management Academy offers two year MBA programme, affiliated to Punjab Technical University.</p><p><strong>Specialization:</strong> Dual Specialization in Finance, Marketing, Human Resource &amp; Information Technology</p><p><strong>Eligibil...See More"
333,"Global Entrepreneurship and Management Academy, Delhi",New Delhi,Delhi,PGDM,2 years,Full time,30,PG,,(AICTE) All India Council of Technical Education,,"<p><strong>About programme:</strong> This two year PGDM programme is offered by All India Management Association (AIMA) which is fully approved and recognized by AICTE, Ministry of HRD, Govt of India.</p><p><strong>Specialization:</strong>&nbsp;Finance, Human Resource Management,&nbsp;International Business, Operations...See More"
334,"International Business School, Delhi",Delhi,Delhi,PGDM,2 years,Full time,,PG,6.2 lakhs,(AICTE) All India Council of Technical Education,,"<p><strong>About Programme:</strong> Institute offers two year full time Post Graduate Diploma in Management, apporoved by AICTE.</p><p><strong>Specialization:</strong> Institute offers dual specialization in:</p><ul><li>Marketing</li><li>Human Resource</li><li>Finance</li><li...See More"
335,"Tilak Raj Chadha Institute of Management and Technology, Yamunanagar",Yamuna Nagar,Haryana,BBA,3 years,Full time,,UG,0.65 lakhs,"MHRD, Government of India","A candidate who has passed 10+2 examination of the Board of School Education, Haryana OR any examination recognized as equivalent thereto, with English as one of the subjects obtaining at least 40% marks in the aggregate shall be eligible for the course.","Bachelor of Business Administration is three years full time course and affiliated to Kurukshetra University, Kurukshetra."
336,"Tilak Raj Chadha Institute of Management and Technology, Yamunanagar",Yamuna Nagar,Haryana,MBA,2 years,Full time,120,PG,1.47 lakhs,(AICTE) All India Council of Technical Education,"Should be a pass in Bachelor‘s or Post Graduate Degree in any discipline from a recognized university or an examination recognized as equivalent thereto by KU, Kurukshetra, Maharshi Dayanand University, Rohtak, Guru Jambheshwar University of Sc. & Technology Hissar, CCS HAU, Hissar, DCR University of Sc. & Technology, Murthal and Ch. Devi Lal University, Sirsa, as the case may be.
OR
Pass in Final Examination conducted by Institute of Chartered Accountant of India/Institute of Costs and Works Accountants of India/Institute of Company Secretaries of India.Obtained at least 50% (47.50% of candidate belonging to SC category) in the qualifying Examination.","This is a prestigious two year full time regular program that is recognized by AICTE, New Delhi and Kurukshetra University, Kurukshetra. The program emphasizes on subjects like Marketing, Personnel & Industrial Relations, Finance & Accounting, Production Management, Quantitative Techniques, and various other subject papers. In the second year, students have to underta...See More"
337,"Tolani Institute of Management Studies, Kachchh",Gandhidham,Gujarat,PGDM,2 years,Full time,120,PG,,(AICTE) All India Council of Technical Education,The candidate should have passed graduation.,Post Graduate Diploma in Management is two years full time course and approved by AICTE.
338,"Ajay Kumar Garg Institute of Management, Ghaziabad",Ghaziabad,Uttar Pradesh,MBA,2 years,Full time,120,PG,2.27 lakhs,(AICTE) All India Council of Technical Education,"Must have passed degree course from any recognised university and 60% and above marks in 10th, 12th and Graduation.","Master of Business Administration is two years full time course. Approved by AICTE and affiliated to Dr APJ Abdul Kalam Technical University, Lucknow."
339,"BLS Institute of Management, Ghaziabad",Ghaziabad,Uttar Pradesh,PGDM,2 years,Full time,240,PG,4.8 lakhs,(AICTE) All India Council of Technical Education,"A Recognized Bachelor’s degree in any discipline with a minimum of 50% marks in aggregate.
OR
Bachelor’s degree in Engineering if Technology or any other subject with a minimum of 50% marks in aggregate or any qualification recognized as equivalent there to with a minimum of 50% marks in aggregate
OR
Passed the final examination of the Institute of Chartered Accountants of India or England, the Institute of Cost and Works Accountants of India / England Or the Institute of Company Secretaries of India.",Post Graduate Diploma in Management is two years full time course and approved by AICTE.
340,"BLS Institute of Management, Ghaziabad",Ghaziabad,Uttar Pradesh,PGDM Human Resources,2 years,Full time,60,PG,2.57 lakhs,(AICTE) All India Council of Technical Education,"A Recognized Bachelor’s degree in any discipline with a minimum of 50% marks in aggregate.
OR
Bachelor’s degree in Engineering if Technology or any other subject with a minimum of 50% marks in aggregate or any qualification recognized as equivalent there to with a minimum of 50% marks in aggregate
OR
Passed the final examination of the Institute of Chartered Accountants of India or England, the Institute of Cost and Works Accountants of India / England Or the Institute of Company Secretaries of India.",Post Graduate Diploma in Management in Human Resources is two years full time second shift course and approved by AICTE.
341,"BLS Institute of Management, Ghaziabad",Ghaziabad,Uttar Pradesh,PGDM II Shift,2 years,Full time,120,PG,2.57 lakhs,(AICTE) All India Council of Technical Education,"A Recognized Bachelor’s degree in any discipline with a minimum of 50% marks in aggregate.
OR
Bachelor’s degree in Engineering if Technology or any other subject with a minimum of 50% marks in aggregate or any qualification recognized as equivalent there to with a minimum of 50% marks in aggregate
OR
Passed the final examination of the Institute of Chartered Accountants of India or England, the Institute of Cost and Works Accountants of India / England Or the Institute of Company Secretaries of India.",Post Graduate Diploma in Management is two years full time second shift course and approved by AICTE.
342,"BLS Institute of Management, Ghaziabad",Ghaziabad,Uttar Pradesh,PGDM Marketing,2 years,Full time,60,PG,2.57 lakhs,(AICTE) All India Council of Technical Education,"A Recognized Bachelor’s degree in any discipline with a minimum of 50% marks in aggregate.
OR
Bachelor’s degree in Engineering if Technology or any other subject with a minimum of 50% marks in aggregate or any qualification recognized as equivalent there to with a minimum of 50% marks in aggregate
OR
Passed the final examination of the Institute of Chartered Accountants of India or England, the Institute of Cost and Works Accountants of India / England Or the Institute of Company Secretaries of India.",Post Graduate Diploma in Management in Marketing is two years full time second shift course and approved by AICTE.
343,"NIMT Institute of Technology and Management, Ghaziabad",Ghaziabad,Uttar Pradesh,PGDM,2 years,Full time,120,PG,,(AICTE) All India Council of Technical Education,,
344,"Shiva Institute of Management Studies, Ghaziabad",Ghaziabad,Uttar Pradesh,BBA,3 years,Full time,,UG,0.9 lakhs,,Candidate must have passed 10+2 in any stream from recognized board,"BBA is a three-year full time Bachelor Level Management Program affiliated to Chaudhary Charan Singh University, Meerut. The program is designed to give a foundation level knowledge to the budding Managers."
345,"Shiva Institute of Management Studies, Ghaziabad",Ghaziabad,Uttar Pradesh,MBA,2 years,Full time,60,PG,2.55 lakhs,(AICTE) All India Council of Technical Education,Candidate must have passed Graduate degree in any discipline with minimum 50% aggregate marks from a recognized university also must have valid score in AKTU Entrance exam / TMA/MAT/XAT,"Master of Business Administration is full-time two-year post graduate degree course, recognized by AICTE"
346,"Shiva Institute of Management Studies, Ghaziabad",Ghaziabad,Uttar Pradesh,PGDM,2 years,Full time,120,PG,1.85 lakhs,(AICTE) All India Council of Technical Education,Candidate must have passed Graduate in any discipline and must have valid score in ATMA/MAT/XAT,Post Graduate Diploma in Management is full-time two-year course
347,"Shiva Institute of Management Studies, Ghaziabad",Ghaziabad,Uttar Pradesh,PGDM Part Time,3 years,Part Time,60,PG,1.5 lakhs,(AICTE) All India Council of Technical Education,A Graduate in any discipline and having at least two years work experience is eligible for admission to this programme,PGDM is a 3-years part time Post GraduageLevel Management Program approved from AICTE. The program is designed to give a Advanced level knowledge to the budding Managers.
