,College,City,State,Course,Duration,Study mode,Approved intake,Course level,Course Fee,Approval,Eligiblity,Course_Detail
286,"Nagindas Khandwala College, Mumbai",Mumbai,Maharashtra,Bachelor of Management studies,3 years,Full time,120,UG,,UGC,"A candidate for being eligible for admission to the degree course of BMS, shall have passed HSC examination of the Maharashtra State Board of Secondary and Higher Secondary Education or its equivalent examination or Diploma in any Engineering branches with two years or three years or four years duration after passing the Secondary School Certificate (S.S.C.), conducted by the Board of Technical Education, Maharashtra State or its equivalent examination.","Bachelor of Management studies is a full-time three-year course affiliated to University of Mumbai, Mumbai and approved by University Grants Commission."
287,"Nagindas Khandwala College, Mumbai",Mumbai,Maharashtra,Diploma in Business Studies,1 year,Full time,,Diploma,,,The candidate should have passed in 10 / 10+2 related stream,Diploma in Business Studies is a one year full time course
288,"Nagindas Khandwala College, Mumbai",Mumbai,Maharashtra,Diploma in Financial Service,1 year,Full time,,Diploma,,,The candidate should have passed in 10 /10+2 related stream,Diploma in Financial Service is a one year full time course
289,"Mewar Institute of Management, Ghaziabad",Ghaziabad,Uttar Pradesh,BBA,3 years,Full time,240,UG,1.2 lakhs,UGC,The candidate should have 45% in 10+2.,"Bachelor of Business Administration is three years full-time under graduate management programme offered by Chaudhary Charan Singh University, Meerut and approved by UGC"
290,"Mewar Institute of Management, Ghaziabad",Ghaziabad,Uttar Pradesh,MBE,2 years,Full time,30,PG,0.7 lakhs,UGC,The candidate should have passed Graduation with 45% marks.,"Master of Business Economics is two years full-time post graduate management programme offered by Chaudhary Charan Singh University, Meerut and approved by UGC"
291,"Viva College, Virar",Virar,Maharashtra,B.Com Banking and Insurance,3 years,Full time,,UG,,,Minimum 45% for GENERAL Category & Minimum 40% for RESERVED Category in H.S.C. (Commerce) in aggregate AT ONE & THE SAME SITTING at first attempt.,It is a three year full time course.
292,"Viva College, Virar",Virar,Maharashtra,B.Com Financial Market,3 years,Full time,,UG,,,A candidate for being eligible for admission to the Bachelor of Commerce (Financial Markets) Degree Course shall have passed XII Std. Examination of the Maharashtra State Board of Secondary & Higher Secondary Education or its equivalent and secured not less than 45% marks in aggregate at (40% in case of reserved category) one & the same sitting.,It is a three year full time course.
293,"Viva College, Virar",Virar,Maharashtra,BMS,3 years,Full time,258,UG,,UGC,"1. Passed H.S.C. Examination at first attempt (Arts / Commerce / Science) of Maharashtra State Board of Higher Secondary Education or any examination recognized as equivalent thereto/or Diploma in any Engineering branch.
2. Percentage required Open Category 45%, Reserved category 40%.","Bachelor of Management Studies is three years full-time undergraduate management program offered by University of Mumbai, Mumbai and approved by UGC"
294,"Viva College, Virar",Virar,Maharashtra,M.Com Banking,2 years,Full time,,PG,,,"1. A candidate for being eligilble for admission to the Master of commerce course, shall have passed the examination for the degree of Bachelor of Commerce of this University [three years integrated course) of the degree of B.Com (Old Course) of this University, or Bachelor of Commerce [Accounting and Finance).
OR
2. B.Com Banking and Insurance) OR B.M.S degree examination or an examination of any other University recognized as equivalent thereto.
OR
3. B.M.M degree examination [only for Management Specialization subjects) at the M.Com. degree levels.",The duration of M.Com or Master of Commerce courses is normally two years full time course.
295,"Canara College, Mangaluru",Mangaluru,Karnataka,BBA,3 years,Full time,,UG,,,Must have passed Pre-University/Higher Secondary/10+2 Examination or equivalent of any recognized Board Council in any discipline.,"Bachelor of Business Administration three years graduate program consisting of six semesters course offered by Mangalore University, Mangalore. Subjects of Study Group I: Languages Language – I : English Language – II : Kannada / Hindi / Sanskrit Group II: Optional Subjects (All subjects are Compulsory) Principles of Management, Economics, Financial Accounting, Executive Communication, Commercial Law, Marketing Management, Business Mathematics, Financial Management, Business Statistics, Banking, Taxation, Cost and Management Accounting, Auditing, Investment Management, Insurance and Risk Management, Project M"
296,"Ramakrishna Mission Vivekananda College, Chennai",Chennai,Tamil Nadu,BBA II Shift Self Finance,3 years,Full time,70,UG,,UGC,The candidate should have passed in 10+2 with the relevant subject.,"This is a full time three year course affiliated to University of Madras, Chennai and approved by UGC."
297,"City Premier College, Nagpur",Nagpur,Maharashtra,BBA,3 years,Full time,,UG,,UGC,A candidate should have passed XII examination of M.S. Board of Secondary and Higher Secondary Education with English and modern Indian languages at higher or lower level or its equivalent examination of the State OR- XII in Vocational Stream with one language OR- Any other examination equivalent thereto in such subjects with such standards of attainment as may be prescribed,Bachelor of Business Administration is full-time three year Degree Programme
298,"City Premier College, Nagpur",Nagpur,Maharashtra,MBA,2 years,Distance,,PG,,,Candidate Desirous of seeking admission in MBA programme should be a graduate in any discipline from a recognized university,"It is Post Graduate Degree Course,
The minimum duration of the course is two academic years plus project work. The medium of instruction and examination is English,
A Student has to appear for Entrance Examination and those who pass the Entrance Examination are eligible for admission. Date of the Entrance Examination is notified by the University,
Admission is ope...See More"
299,"City Premier College, Nagpur",Nagpur,Maharashtra,MCM,2 years,Full time,60,PG,,UGC,Any Graduate B Com / B Sc (Biology/Math)/BA/BE/B Tech/BBA/ BCCA /BCA,Master of Computer Management is full time two Year Post-Graduate Programme
300,"Nirmala College of Information Technology, Chalakudy",Chalakudy,Kerala,BBA,3 years,Full time,,UG,,,A Pass in Higher Secondary (Plus Two).,"BBA intends to develop the managerial, administrative and marketing skills by continuously improving the talents and capabilities of the students through seminars, group discussions, project presentations, industrial visits."
301,"Nirmala College of Information Technology, Chalakudy",Chalakudy,Kerala,MBA,2 years,Full time,,PG,,,The candidate should have graduation in any stream from a recognised university.,The programme is spread over four semesters spanning two academic years. In the first year students are given an orientation of the academic facet of management sciences and aims at establishing a strong conceptual foundation.
302,"Ispat Autonomous College, Rourkela",Rourkela,Odisha,BBA,3 years,Full time,,UG,,UGC,+2 pass (any stream),"It is three years full-time management course offered by Sambalpur University, Sambalpur , And approved by UGC India"
303,"DAV College, Amritsar",Amritsar,Punjab,BBA,3 years,Full time,,UG,,UGC,"The admission to BBA-I shall be open to any person who has passed +2 examination of PSEB / CBSE in any group or any other examination recognized as equivalent there to by the GNDU with minimum 40% marks in aggregate. The selection of the candidates is based on their performance in the qualifying examination , group discussion and personal interview. The weightage to the above shall be as indicated: +2 marks 60% Group discussion 20% Personal Interview 20% Entry Requirement for Admission to BBA II / III For addmission to BBA II and III, the candidates should have passed BBA part I / II, or any other equivalent examination recognized by GNDU.","The BBA Programme prepares students for their first managerial role by putting before them a board range of career paths both in the traditional spheres as well as in the newly emerging corporate world. A fair balance is maintained between the IT empowered practical skills and the academic learning. The BBA passouts are best groomed out for joining MBA, MCA, MIT etc."
304,"Siva Sivani Degree College, Secunderabad",Hyderabad,Telangana,BBA,3 years,Full time,,UG,,UGC,The candidate should have passed in 10+2.,It is 3-year duration full-time course.
305,"Khalsa College for Women, Amritsar",Amritsar,Punjab,B. Voc Retail Management Information Technology,3 years,Full time,30,UG,0.6 lakhs,UGC,The candidate should have 10+2 with 40% marks in aggregate or equivalent exam,"Bachelor of Vocational in Information Technology & Retail Management is Three Years Full Time Course and Approved By UGC and Affiliated By Guru Nanak Dev University, Amritsar"
306,"Khalsa College for Women, Amritsar",Amritsar,Punjab,BBA,3 years,Full time,50,UG,1.08 lakhs,UGC,10+2 with 40% marks in aggregate or equivalent exam,"Bachelor Of Business Administration is Three Years Full-Time Course and Approved By UGC and Affiliated By Guru Nanak Dev University, Amritsar."
307,"Malini Kishor Sanghvi College of Commerce and Economics, Mumbai",Mumbai,Maharashtra,BMS,3 years,Full time,60,UG,,,"XII or equivalent examination, in Arts, Science or Commerce stream securing a minimum of 45% aggregate (in case of an applicant from open category) and 40% in case of a candidate from Reserved Category. Or, has passed Diploma in any Engineering branch of two or three years after SSC, conducted by the Maharashtra State Board of Technical Education.
The candidate should have passed in one and same sitting.",It is 3-year duration full-time course.
308,"Tolani College of Commerce, Mumbai",Mumbai,Maharashtra,B. Com Banking and Insurance,3 years,Full time,60,UG,0.52255 lakhs,UGC,"A candidate for being eligible for an admission to the Bachelor of Commerce (Banking and Insurance ) Degree Course shall have passed Std XII Examination of the Maharashtra State Board of Secondary & Higher Secondary Education or its equivalent and secured not less than 50% marks in aggregate at first attempt (45% in case of reserved category). Every candidate admitted to the Degree Course in the Constituent / affiliated College / recognised institution, conducting the course, shall have to register himself with the University.",It is 3 year full time course.
309,"Tolani College of Commerce, Mumbai",Mumbai,Maharashtra,B. Com Financial Markets,3 years,Full time,60,UG,0.51155 lakhs,UGC,"A candidate for being eligible for admission to the Bachelor of Commerce (Financial Markets) Degree Course shall have passed Std XII Examination of the Maharashtra State Board of Secondary & Higher Secondary Education or its equivalent and secured not less than 45% marks in aggregate at first attempt (40% in case of reserved category).
Every candidate admitted to the Degree Course in the Constituent/ affiliated College/ recognised institution, conducting the course, shall have to register himself with the University.",It is 3 year full time course.
310,"Tolani College of Commerce, Mumbai",Mumbai,Maharashtra,BMS,3 years,Full time,60,UG,0.50455 lakhs,UGC,A student who has passed Standard XII from any recognised Board can seek admission to F.Y.B.M.S. subject to eligibility rules.,It is 3 year full time course.
311,"Mangalvedhekar Institute of Management, Solapur",Solapur,Maharashtra,MBA,2 years,Full time,120,PG,,(AICTE) All India Council of Technical Education,The candidate should have passed graduation in any discipline.,"Master of Business Administration is two years full time course. Affiliated to Solapur University, Solapur and approved by AICTE."
312,"Mangalvedhekar Institute of Management, Solapur",Solapur,Maharashtra,PGDM,2 years,Full time,120,PG,,(AICTE) All India Council of Technical Education,"Graduate in Any Discipline with 50% Marks from any recognised University. Candidates Appearing for the Final Year of Graduation can also Apply.
Candidate should have Appeared for CAT and / or MH – CET AND / OR XAT / AND / OR ATMA.
All Applicants are invited for Group Discussion and Personal Interview.
Applicants Must Purchase Application Kit and submit all the information from Application form.
Group Discussion and Personal Interview will be held at Following Destinations. Delhi , Mumbai, Pune, Hyderabad, Bangalore, Indore, Aurangabad, Nagpur, Ahmadabad & Chennai.","Post Graduate Diploma in Management – Approved by AICTE is a unique and flagship Program at MM. Objectives of the Program – The students at MIM are expected to understand the program objectives which are,
To,
Understand the Complex and continuously Changing Business Environment
Develop Problem Solving Approach
Be a Proactive Leader with Values at helm ...See More"
313,"V G Vaze College of Arts Science and Commerce, Mumbai",Mumbai,Maharashtra,B.Com Banking and Insurance Self Financing,3 years,Full time,,UG,,UGC,The candidate is passed 10+2 standard or equivalent examination from recognised board with relevant subjects.,"B.Com Banking and Insurance Self Financing is a full-time three years duration course Affiliated to University of Mumbai, Mumbai Approved by UGC."
314,"AS Patil College of Commerce, Vijayapur",Vijayapura,Karnataka,BBA,3 years,Full time,,UG,,,The candidate should have passed in 10+2 any stream.,This is a 3 year full time course.
315,"AS Patil College of Commerce, Vijayapur",Vijayapura,Karnataka,MBA,2 years,Full time,120,PG,2.2 lakhs,(AICTE) All India Council of Technical Education,"All the applicants should appear for the CMAT(through KEA PGCET Counseling process)/ KMAT exams and have at least a three-year Bachelor's degree or its equivalent in any discipline from any college recognised by the All India Council for Technical Education (AICTE), with minimum 50 per cent marks in aggregate or equivalent CGPA.
Admission to foreign students: Admission of Foreign Nationals to the above course shall be governed by the rules framed by State/Central government /University Equivalence Committee / Association of Indian Universities guidelines, from time to time.
Students may also be considered for admission on the basis of a valid CAT/MAT/XAT scores.","The duration of the Master of Business Administration (semester scheme) shall be of two academic years consisting of four semesters, and each semester shall be of 16 weeks duration.
The candidate shall complete the degree within 3 years from the date of admission, failing which the candidate will be declared as “NOT FIT FOR MANAGEMENT COURSE”.
The course introdu...See More"
316,"Prahladrai Dalmia Lions College of Commerce and Economics, Mumbai",Mumbai,Maharashtra,Bachelor of Management Studies,3 years,Full time,,UG,,UGC,The candidate should have passed in 10+2 related stream.,Bachelor of Management Studies is a 3 year full time course.
317,"Prahladrai Dalmia Lions College of Commerce and Economics, Mumbai",Mumbai,Maharashtra,Bachelors in Banking and Insurance,3 years,Full time,,UG,,UGC,The candidate should have passed in 10+2 related stream.,Bachelors in Banking and Insurance is a 3 year full time course.
318,"Prahladrai Dalmia Lions College of Commerce and Economics, Mumbai",Mumbai,Maharashtra,Bachelors of Finance Management,3 years,Full time,,UG,,UGC,The candidate should have passed in 10+2 related stream.,Bachelors of Finance Management is a 3 year full time course.
319,"Islamia College of Science and Commerce, Srinagar",Srinagar,Jammu and Kashmir,BBA,3 years,Full time,,UG,0.197 lakhs,UGC,The candidate should have passed in 10+2.,It is 3-year duration full-time course.
320,"SSG Pareek PG College, Jaipur",Jaipur,Rajasthan,BBA,3 years,Full time,80,UG,,UGC,The candidate should have passed in 10+2 any stream,This is a 3 year full time course.
321,"SSG Pareek PG College, Jaipur",Jaipur,Rajasthan,M.Com Economic Administration and Financial Management,2 years,Full time,40,PG,,UGC,The candidate should have passed in B. Com,This is a 2 year full time course.
322,"Anugrah Memorial College, Gaya",Gaya,Bihar,BBM,3 years,Full time,,UG,,,The candidate should have passed in 10+2 any stream.,Bachelor of Business Management is a 3 year full time course.
323,"SSR College of Arts Commerce and Science, Silvassa",Silvassa,Dadra and Nagar Haveli,BBA,3 years,Full time,80,UG,,Maharashtra Government,An applicant who has passed H.S.C Examination of an equivalent examination of any Statutory Board or University with 45% marks in aggregate with English as one of the passing subjects is eligible for admission to 1st year B.B..A degree course Every eligible candidate has to pass Common Entrance Test to be conducted by the respective Institute / College.,It is 3-year duration full-time course.
324,"The Heritage Academy, Kolkata",Kolkata,West Bengal,BBA,3 years,Full time,,UG,2.88 lakhs,,The candidate should have English as one of the subjects at the 10+2 level.,"This is a full-time day course of three-year duration and affiliated to Maulana Abul Kalam Azad University of Technology, Kolkata."
325,"The Heritage Academy, Kolkata",Kolkata,West Bengal,BMS,3 years,Full time,,UG,3.12 lakhs,,The candidate should be passed and have English as one of the subjects at the 10+2 level.,"Bachelor's in Media Science is a three years duration course consists of six semesters and affiliated to Maulana Abul Kalam Azad University of Technology, Kolkata."
326,"The Heritage Academy, Kolkata",Kolkata,West Bengal,Masters in Media Science,2 years,Full time,,PG,3.19 lakhs,,The candidate should have 50% in aggregate in Graduation.,"Master of Media Science is a two years duration course consists of four semesters and affiliated to Maulana Abul Kalam Azad University of Technology, Kolkata."
327,"Oriental College of Commerce and Management, Mumbai",Mumbai,Maharashtra,BMS,3 years,Full time,,UG,,,"1. “A candidate for being eligible for admission to the BMS Degree Course shall have passed HSC Examination of the Maharashtra State Board of Higher Secondary Education or its equivalent examination or Diploma course in any Engineering Branches with two years or three years after SSC conducted by the Board of Technical Examination or its equivalent examination by securing minimum 45% for general category (in one attempt) at the respective Examination and 40% marks for the reserved category (in one attempt).”
2. No college shall conduct any entrance test in any form and the admissions are purely based on merit duly following the reservation policy as per the norms of Government of Maharashtra.
3. The applications are to be accepted and processed by the colleges streamwise separately and the merit list is to be displayed streamwise taking into account the reservation policy prescribed by the Government of Maharashtra.",It is 2-year duration full-time course.
328,"Dhanwate National College, Nagpur",Nagpur,Maharashtra,BBA,3 years,Full time,220,UG,,UGC,The candidate should have passed in 10+2 any stream,BBAis three year duration full-time course.
329,"Dhanwate National College, Nagpur",Nagpur,Maharashtra,Diploma in Business Management,1 year,Full time,60,Diploma,,,The candidate should have passed in 10+2 any stream,Diploma in Business Management is one year duration full-time course.
330,"Dhanwate National College, Nagpur",Nagpur,Maharashtra,MBA,2 years,Full time,120,PG,,UGC,The candidate should have passed Graduation in the concerned subject.,MBA is two year duration full-time course.
331,"Dhanwate National College, Nagpur",Nagpur,Maharashtra,Master of Applied Management,2 years,Full time,,PG,,UGC,The candidate should have passed Graduation in the concerned subject.,Master of Applied Management is two year duration full-time course.
332,"Dhanwate National College, Nagpur",Nagpur,Maharashtra,Master of Computer Management,2 years,Full time,120,PG,,UGC,The candidate should have passed Graduation in the concerned subject.,Master of Computer Managements two year duration full-time course.
333,"Dhanwate National College, Nagpur",Nagpur,Maharashtra,Master of Industrial Relation and Personnel Management,2 years,Full time,60,PG,,,The candidate should have passed in related degree,Master of Industrial Relation and Personnel Management is two to three year duration full-time course.
334,"Andhra Loyola College, Vijayawada",Vijayawada,Andhra Pradesh,BBA,3 years,Full time,,UG,,UGC,The candidate should have passed 10+2.,It is 3-year duration full-time course.
335,"Andhra Loyola College, Vijayawada",Vijayawada,Andhra Pradesh,MBA,2 years,Full time,,PG,,UGC,The candidate should have passed Graduation in the concerned subject.,"It is a two year duration full-time course. Affiliated to Krishna University, Machilipatnam"
336,"Satish Chandra Dhawan Government College, Ludhiana",Ludhiana,Punjab,BBA,3 years,Full time,40,UG,0.714 lakhs,UGC,The candidate should have passed 10+2.,It is 3-year duration full-time course. Seats are available for boys only.
337,"Metas Adventist College, Surat",Surat,Gujarat,BBA Hons,3 years,Full time,,UG,,,Students who have passed 10+2 from the recognised board in India which is considered as equivalent by the university shall be eligible for admission into the first semester of the honours degree course. Those who secure 55%aggregate marks in the 10+2 through English medium school only are eligible to apply for the programme. the selection for BBA course is done through personal inter view.,BBA Hons is a three year full time course
338,"Metas Adventist College, Surat",Surat,Gujarat,MBA,2 years,Full time,60,PG,,(AICTE) All India Council of Technical Education,Candidate Desirous of seeking admission in MBA programme should be a graduate in any discipline from a recognized university,MBA is a two year full time course Approved by AICTE
339,"Jaypee University, Anoopshahr",Anupshahar,Uttar Pradesh,BBA,3 years,Full time,30,UG,,,The candidate should have passed 10+2 from recognized board.,Bachelor of Business Administration is three-years duration full-time course.
340,"Al Falah University, Faridabad",Dhouj,Haryana,BBA,3 years,Full time,,UG,,,10+2 with 45% Marks in aggregate from recognized Board or University.,"Bachelor of Business Administration is three-years duration full-time course and offered by Al Falah University, Faridabad."
341,"Al Falah University, Faridabad",Dhouj,Haryana,MBA,2 years,Full time,,PG,,,Graduate in any stream with 50% Marks in aggregate from recognized University.,"Master of Business Administration is two-years duration full-time course and offered by Al Falah University, Faridabad."
342,"Al Falah University, Faridabad",Dhouj,Haryana,MFC,2 years,Full time,,PG,,,B.Com or B.A (Economics) with 50% Marks in aggregate from a recognized University,"This is two-years duration full-time course and offered by Al Falah University, Faridabad."
343,"Spicer Adventist University, Pune",Pune,Maharashtra,BBA,3 years,Full time,,UG,1.21 lakhs,,The candidate should have passed Higher Secondary School Certificate or its equivalent with 45% marks.,Bachelor of Business Administration is three-years duration full-time course.
344,"Spicer Adventist University, Pune",Pune,Maharashtra,BBA Office Administration,3 years,Full time,,UG,1.357 lakhs,,The candidate should have passed Higher Secondary School Certificate or its equivalent with 45% marks.,Bachelor of Business Administration in Office Administration is three-years duration full-time course.
345,"Spicer Adventist University, Pune",Pune,Maharashtra,MBA,2 years,Full time,,PG,1.174 lakhs,,The candidate should have passed Bachelor degree from any faculty with entrance.,Master of Business Administration is two-years duration full-time course.
346,"Bharata Mata College, Kochi",Kochi,Kerala,BBA,3 years,Full time,30,UG,,UGC,The candidate should have passed in 10+2 or its equivalent from any recognized Board / University,"It is a three year full time course. Affiliated to Mahatma Gandhi University, Kottayam"
347,"Bharata Mata College, Kochi",Kochi,Kerala,M. Sc Financial,2 years,Full time,15,PG,,UGC,Bachelors degree in related branch.,"It is 2 year full time course. offered by Mahatma Gandhi University, Kottayam"
348,"Bharata Mata College, Kochi",Kochi,Kerala,MBA,2 years,Full time,60,PG,1.2 lakhs,(AICTE) All India Council of Technical Education,"Any graduates from Mahatma Gandhi University or any other Universities recognized by Mahatma Gandhi University with an aggregate of 50% for Part I, II & III put together.","The two year full time programme is approved by AICTE. The areas of specialisation are:
1. Marketing Management
2. Finance Management
3. Information Systems
4. Human Resource Management"
349,"SKN Sinhgad School of Business Management, Pune",Pune,Maharashtra,MBA,2 years,Full time,300,PG,,(AICTE) All India Council of Technical Education,"Graduation with 50% marks (45% for reserve category, Maharashtra State).","This is a two year full time Programme leading to a Master Degree in Management. Approved by AICTE, Affiliated to Savitribai Phule Pune University, Pune"
