,College,City,State,Course,Duration,Study mode,Approved intake,Course level,Course Fee,Approval,Eligiblity,Course_Detail
425,"PSV College of Engineering and Technology, Krishnagiri ",Elathagiri,Tamil Nadu,MBA,2 years,Full time,60,PG,0.5 lakhs,(AICTE) All India Council of Technical Education,"A pass in a recognized Bachelor’s degree of minimum 3 years duration and obtained at least 50 % (45 % in the case of candidates belonging to reserved category) in the qualifying degree examination.
10+2+3 years pattern (or)
10+3 years Diploma +3 years pattern (or)
B.E./B.Tech./B.Arch./B.Pharm. (or)
(i) 10+2+AMIE* (or)
(ii) 10+3 years diploma (awarded by the State Board of Technical Education) + AMIE.*","The Department of Management studies was established in the year 2009. The MBA program is tailored meticulously keeping in mind the industry dynamics and the ever changing economic scenario. PSVCET MBA is a two year, semester based (4 semesters) program with industry internships resulting in a structured project at the end of each year. Elective courses are chosen fr...See More"
426,"Nova Institute of Technology, Eluru",Eluru,Andhra Pradesh,MBA,2 years,Full time,,PG,,,The candidate should have passed in the relevant graduate degree from any recognized university.,"Master of Business Administration is full time two year course affiliated to Jawaharlal Nehru Technological University, Kakinada."
427,"Newton's Institute of Engineering, Guntur",Macherla,Andhra Pradesh,MBA,2 years,Full time,120,PG,0.54 lakhs,(AICTE) All India Council of Technical Education,Bachelor's Degree or equivalent in any discipline from a recognized university,"Newton's Institute of Engineering offers two-year full-time Master of Business Administration(MBA) approved by AICTE, Ministry of HRD, Govt of India.
Master of Business Administration with Specialization in Finance, HRM, Marketing."
428,"Naraina College of Engineering and Technology, Kanpur",Kanpur,Uttar Pradesh,MBA,2 years,Full time,120,PG,1.81 lakhs,(AICTE) All India Council of Technical Education,Bachelor's Degree or equivalent in any discipline from a recognized university.,"The NGI offers an AICTE and Uttar Pradesh Technical University, Lucknow approved two-years full-time M.B.A. Programme. It promotes research and consultancy in manufacturing corporate sectors, Infrastructural, Institutional, Social and environmental services, entrepreneurship, and University-industry partnership. Faculty of NGI organizes on-campus seminars and actively...See More"
429,"Misrimal Navajee Munoth Jain Engineering College, Chennai",Chennai,Tamil Nadu,MBA,2 years,Full time,60,PG,0.72 lakhs,(AICTE) All India Council of Technical Education,The eligibility criterion for admission to the course is graduation in any discipline.,"The course offered is Master of Business Administration, which is affiliated to Anna University. The duration of the course is two years, consisting of four Academic Semesters.
Every student gets opportunities to specialise in major streams, such as Finance, Marketing, Human Resource and Systems Management. Along with the functional areas of specialisation, the stude...See More"
430,"Millia Institute of Technology, Purnea",Purnea,Bihar,MBA,2 years,Full time,60,PG,1.24 lakhs,(AICTE) All India Council of Technical Education,Graduation in any discipline.,"The MBA is a two year full time course. It provides a broad spectrum exposure as well as an opportunity to concentrate on specific functional area. The programme focuses on constructional, development, technical and analytical skills necessary for a full fledged manager coupled with pragmatic approach to situational analysis.
This being the first year...See More"
431,"Matsyodari Shikshan Sanstha's College of Engineering and Technology, Jalna",Jalna,Maharashtra,MBA II Shift,2 years,Full time,60,PG,0.87 lakhs,(AICTE) All India Council of Technical Education,Bachelor's Degree or equivalent in any discipline from a recognised university.,"Master of Business Administration (MBA) 2 year full-time course affiliated to Dr. Babasaheb Ambedker Marathwada University, Aurangabad.
Specialisations -
Marketing
Human Resource
Finance
Production and Operation Management
Information Technology"
432,"Malineni Perumallu Educational Society's Group of Institutions, Guntur",Pulladigunta,Andhra Pradesh,MBA,2 years,Full time,60,PG,1 lakh,(AICTE) All India Council of Technical Education,The candidate should have passed graduation in any discipline.,"Master of Business Administration is two years full time course. Approved by AICTE and affiliated to Jawaharlal Nehru Technological University, Kakinada."
433,"Malineni Lakshmaiah Women’s Engineering College, Guntur",Pulladigunta,Andhra Pradesh,MBA,2 years,Full time,60,PG,1 lakh,(AICTE) All India Council of Technical Education,The candidate should have passed graduation in any discipline.,"Master of Business Administration is two years full time course. Approved by AICTE and affiliated to Jawaharlal Nehru Technological University, Kakinada."
434,"Maheshwara Institute of Technology, Patancheru",Hyderabad,Telangana,MBA,2 years,Full time,60,PG,,(AICTE) All India Council of Technical Education,,
435,"MAM College of Engineering and Technology, Tiruchirappalli",Siruganur,Tamil Nadu,MBA,2 years,Full time,60,PG,0.6 lakhs,(AICTE) All India Council of Technical Education,Candidate Desirous of seeking admission in MBA programme should be a graduate in any discipline from a recognized university,"This is a two year full time course Approved by AICTE, Afiiliated to Anna University, Chennai"
436,"KLM College of Engineering for Women, Kadapa",Kopparthi,Andhra Pradesh,MBA,2 years,Full time,60,PG,0.59 lakhs,(AICTE) All India Council of Technical Education,Graduation from any recognized university with relevant subjects.,"This is a full time two year course affiliated to Jawaharlal Nehru Technological University, Anantpur and approved by AICTE."
437,"Kalam Institute of Technology, Berhampur",Jaganathapur,Odisha,MBA,2 years,Full time,120,PG,1.06 lakhs,(AICTE) All India Council of Technical Education,The candidate should have passed in 10+2 with the relevant subject.,"Master of Business Administration is a full-time two year course affiliated to Biju Patnaik University of Technology, Rourkela and approved by AICTE."
438,"Jerusalem College of Engineering, Chennai",Chennai,Tamil Nadu,MBA,2 years,Full time,120,PG,0.8 lakhs,(AICTE) All India Council of Technical Education,The candidate should have passed in the graduate degree.,"Master of Business Administration is a full-time two year course affiliated to Anna University, Chennai and approved by AICTE."
439,"Jayalakshmi Institute of Technology, Dharmapuri",Thoppur,Tamil Nadu,MBA,2 years,Full time,60,PG,0.6 lakhs,(AICTE) All India Council of Technical Education,The candidate should have passed in the relevant graduate degree from any recognized university.,"Master of Business Administration is full time two year course affiliated to Anna University, Chennai and approved by AICTE."
440,"Jahangirabad Institute of Technology, Barabanki",Jahangeerabad,Uttar Pradesh,MBA,2 years,Full time,60,PG,1.4 lakhs,(AICTE) All India Council of Technical Education,The candidate should have passed in bachelor degree.,Master of Business Administration (MBA) is an internationally recognized degree that provides students with practical and theoretical knowledge of how people and processes work within the business world and in the wider community. They develop an understanding of business culture. in the era of globalization this course help the students to develop the necessary acade...See More
441,"Institute of Technology and Sciences, Bhiwani",Bhiwani,Haryana,BBA,3 years,Full time,60,UG,0.8 lakhs,,The candidate should have passed in 10+2 with any stream.,"This is a full time three year course affiliated to Maharshi Dayanand University, Rohtak."
442,"Institute of Technology and Sciences, Bhiwani",Bhiwani,Haryana,MBA,2 years,Full time,60,PG,1.02 lakhs,(AICTE) All India Council of Technical Education,"A candidate must be graduate in any discipline i e. BA, B.Com, B.Sc, BE or graduate in any other profession from a recognized University.","This is a two year full time programme leading to a Master Degree in Management from the Maharshi Dayanand University, Rohtak."
443,"Info Institute of Engineering, Coimbatore",Kovilpalayam,Tamil Nadu,MBA,2 years,Full time,60,PG,0.6 lakhs,(AICTE) All India Council of Technical Education,"Recognized Bachelor’s Degree of minimum 3 Years duration
Obtained at least 50% (45% in case of candidate belonging to reserved category) at the qualifying Examination","It is 2 year full time course with affiliation of Anna University, Chennai and approved by AICTE."
444,"Indira Institute of Engineering and Technology, Thiruvallur",Tiruvallur,Tamil Nadu,MBA,2 years,Full time,120,PG,1 lakh,(AICTE) All India Council of Technical Education,A pass in any undergraduate degree of a recognized university.,"It is 2 year full time course with affiliation of Anna University, Chennai and approved by AICTE."
445,"Indira Institute of Engineering and Technology, Thiruvallur",Tiruvallur,Tamil Nadu,ME Construction Engineering and Management,2 years,Full time,18,PG,1 lakh,(AICTE) All India Council of Technical Education,Candidate must have passed BE/B.Tech degree in related stream from recognized university,"ME Construction Engineering and Management is full time two year post graduate degree course, recognized by AICTE"
446,"Hi Tech Institute of Engineering and Technology, Ghaziabad",Ghaziabad,Uttar Pradesh,BBA,3 years,Full time,60,UG,,,Candidate must have passed 10+2 from recognized board,"Bachelor of Business Administration is full-time three-year undergraduate degree course offered by Hi-Tech Institute of Engineering and Technology, Ghaziabad."
447,"Hi Tech Institute of Engineering and Technology, Ghaziabad",Ghaziabad,Uttar Pradesh,MBA,2 years,Full time,60,PG,1.39 lakhs,(AICTE) All India Council of Technical Education,Candidates must have passed three years Bachelor degree course without any grace marks from any recognized university.,"MBA is 2-year full-time course with an affiliation of Dr. A.P.J. Abdul Kalam Technical University, Lucknow and approved by AICTE."
448,"Haryana College of Technology and Management, Kaithal",Kaithal,Haryana,BBA,3 years,Full time,60,UG,0.79 lakhs,(AICTE) All India Council of Technical Education,Minimum qualification for admission in program: 10+2 with English as one of subject and 40% marks.,"It is 3 year full time course with affiliation of Kurukshetra University, Kurukshetra and approved by AICTE."
449,"Haryana College of Technology and Management, Kaithal",Kaithal,Haryana,MBA,2 years,Full time,60,PG,1.3 lakhs,(AICTE) All India Council of Technical Education,Candidate must have passed bachelor degree with minimum 50% marks from recognized university,"It is 2 year full time course with affiliation of Kurukshetra University, Kurukshetra and approved by AICTE."
450,"Global College of Engineering and Technology, Kadapa",Chinnamachupalle,Andhra Pradesh,MBA,2 years,Full time,120,PG,0.55 lakhs,(AICTE) All India Council of Technical Education,Students seeking admissions in MBA should be graduates with minimum 50% of marks in their Graduation. Selection will be based on marks obtained in ICET test (Integrated Common Entrance Test).,"Department of Management Studies was started with the intake of 60 in the year 2009 and from 2013 its intake has been enhanced to 120. The department has a mixture of experienced faculty with the fresh minds, academically experienced and striving for industrial experience. The department has been inculcating the industrial knowledge and various skills to improve the s...See More"
451,"Gayatri Institute of Engineering and Technology, West Godavari",Ramacharlagudem,Andhra Pradesh,MBA,,Full time,,PG,,,Candidates must be a graduate in any discipline from a recognised university.,MBA is a full time two years course.
452,"EGS Pillay Engineering College, Nagapattinam",Uttamacholapuram,Tamil Nadu,MBA,2 years,Full time,120,PG,0.6 lakhs,(AICTE) All India Council of Technical Education,Candidates for the admission to the first semester of the Master's Degree Programme shall be required to have passed an appropriate Degree Examination of Anna University or any other examination of any University or authority accepted by the Syndicate of Anna University as equivalent thereto,The department has well qualified faculty members. Separate Department Library is preserved with huge volumes of Textbooks and reference books prescribed in the university syllabus and the International and National Journals are available for ready reference of students. MBA Department has Modernized Computer Lab facilities. Our Department invites leading personalities form the corporate world to share their views about how the future managerial world will be. It is steadily organizing Guest Lecture and Workshops for enhancement of the students. Our Department is facilitated with smart class room teaching for students and the students are availed with Aptitude and Attitude Development Trainin
453,"Devprayag Institute of Technical Studies, Allahabad",Rudapur,Uttar Pradesh,MBA,2 years,Full time,120,PG,0.93 lakhs,(AICTE) All India Council of Technical Education,Candidate must have passed bachelor degree from recognized university with minimum 60% marks,"Master of Business Administration is full time two year post graduate degree course, recognized by AICTE"
454,"Chilkur Balaji Institute of Technology, Hyderabad",Hyderabad,Telangana,MBA,2 years,Full time,30,PG,0.63 lakhs,(AICTE) All India Council of Technical Education,The candidate should have passed in graduate degree.,"Master of Business Administration is a full-time two year course affiliated to Jawaharlal Nehru Technological University, Hyderabad and approved by AICTE."
455,"Chilkur Balaji Institute of Technology, Hyderabad",Hyderabad,Telangana,MBA Part Time,2 years,Part Time,60,PG,,,The candidate should have passed in graduate degree.,"Master of Business Administration in part time is a part-time two-year course affiliated to Jawaharlal Nehru Technological University, Hyderabad."
456,"Believers Church Caarmel Engineering College, Ranni",Koonamkara,Kerala,MBA,2 years,Full time,60,PG,1.8 lakhs,(AICTE) All India Council of Technical Education,The candidate should have passed in the relevant graduate degree.,"Master of Business Administration is a full-time two year course affiliated to Mahatma Gandhi University, Kottayam and approved by UGC."
457,"C Abdul Hakeem College of Engineering and Technology, Melvisharam",Melvisharam,Tamil Nadu,MBA,2 years,Full time,120,PG,1 lakh,(AICTE) All India Council of Technical Education,The candidate should have passed in graduate degree.,"Master of Business Administration is a full-time two year course affiliated to Anna University, Chennai and approved by AICTE.
Dual Specialization: Finance and Human Resource, Finance and Marketing, Human Resource and Marketing."
458,"Brahmaiah College of Engineering, Nellore",North Rajupalem,Andhra Pradesh,MBA,2 years,Full time,180,PG,1.4 lakhs,(AICTE) All India Council of Technical Education,Candidates must have passed a Bachelor’s degree or equivalent in the relevant field of Engineering/Technology from any recognized university.,"Master of Business Administration is a full-time two year course affiliated to Jawaharlal Nehru Technological University, Anantapur and approved by AICTE."
459,"Bomma Institute of Technology and Science, Khammam",Basvapuram,Telangana,MBA,2 years,Full time,120,PG,0.54 lakhs,(AICTE) All India Council of Technical Education,Graduation from any Recognized university with relevant subjects.,"This is a two year full time course Approve by AICTE, Affiliated to Jawaharlal Nehru Technological University, Hyderabad"
460,"Bhabha Institute of Technology, Kanpur Dehat",Birtiyana Shiwali,Uttar Pradesh,MBA,2 years,Full time,60,PG,0.76 lakhs,(AICTE) All India Council of Technical Education,Graduation from any Recognized university with relevant subjects.,"Master of business Administration is a two year integrated course is offered by the BGI .The curriculum is designed to help the students to develop a global view and respond effectively to change in the economic, technological and cultural environments.
The unique feature of the programme is thrust on Management related subjects with conceptual inputs and application...See More"
461,"Arunai College of Engineering, Tiruvannamalai",Thenmathur,Tamil Nadu,MBA,2 years,Full time,60,PG,0.6 lakhs,(AICTE) All India Council of Technical Education,Candidates for admission to MBA Degree course shall be required to posses any of the following: a pass in any Degree with 10 + 2 + 3/4 year’s pattern or a pass in any Degree with 10 + 3 (Diploma) + 3 years pattern,"Master of Business Administration is Two Years Full Time Course and Approved By AICTE and Affiliated By Anna University, Chennai"
462,"Al Ameer College of Engineering and Information Technology, Visakhapatnam",Gudilova,Andhra Pradesh,MBA,2 years,Full time,60,PG,0.55 lakhs,(AICTE) All India Council of Technical Education,The candidate should have Graduation degree in relevant discipline from any recognized University.,"Master of Business Administration (MBA) is two-year duration full-time course affiliated to Jawaharlal Nehru Technological University, Kakinada and approved by All India Council for Technical Education (AICTE)."
463,"AVR and SVR College of Engineering and Technology, Kurnool",Nandyal,Andhra Pradesh,MBA,2 years,Full time,120,PG,0.54 lakhs,(AICTE) All India Council of Technical Education,Should be a pass in Bachelor‘s or Post Graduate Degree in any discipline from a recognized university.,"Master of Business Administration is 2 year full time course with affiliation of Jawaharlal Nehru Technological University, Anantpur and approved by AICTE."
464,"Rattan Institute of Technology and Management, Faridabad",Seoli,Haryana,BBA,3 years,Full time,60,UG,1.05 lakhs,DTE,The Candidate should have passed 10+2 in relevant subject or equivalent from recognized board.,"Bachelor of Business Administration (B.B.A) is 3 year full time degree course with affiliation of Maharishi Dayanand University, Rohtak."
465,"Rattan Institute of Technology and Management, Faridabad",Seoli,Haryana,MBA,2 years,Full time,120,PG,1.3 lakhs,(AICTE) All India Council of Technical Education,The candidate should have passed Bachelor's degree in relevant subject from recognized university.,"Master of Business Administration (M.B.A) is 2 year full time course with affiliation of Maharshi Dayanand University, Rohtak and approved by All India Council for Technical Education (AICTE)."
466,"ITM Institute of Technology and Management, Gwalior",Gwalior,Madhya Pradesh,MBA,2 years,Full time,60,PG,1.24 lakhs,(AICTE) All India Council of Technical Education,Aspirants should have completed their graduation (in any discipline) with minimum three years’ duration from any recognise university.,"MBA is a full-time 2 years duration course Affiliated to Rajiv Gandhi Proudyogiki Vishwavidyalaya, Bhopal Approved by AICTE."
467,"Rajeev Gandhi Prodyogiki Mahavidyalaya-2, Bhopal",Bhopal,Madhya Pradesh,MBA,2 years,Full time,60,PG,0.91 lakhs,(AICTE) All India Council of Technical Education,A candidate must have pass in a Bachelor’s degree of minimum three years duration from recognised university.,"MBA is a full-time two years duration course Affiliated to Barkatullaah University, Bhopal Approved by AICTE."
468,"Rajagiri School of Management, Cochin",Kakkanad,Kerala,PGDM,2 years,Full time,,PG,,,"50% marks in any approved degree examination or
Pass in any masters degree examination
Final year students awaiting results may also apply",Post Graduate Diploma in Management is 2 year full time course.
469,"Jansons School of Business, Coimbatore",Karumathampatti,Tamil Nadu,M.Phil Management,1 year,Full time,,PG,,UGC,The candidate should have passed postgraduate degree with the related subject from any recognized College or University.,"Master of Philosophy in Management is one-year's (2 Semesters) full-time course affiliated with Bharathiar University, Coimbatore."
470,"Jansons School of Business, Coimbatore",Karumathampatti,Tamil Nadu,MBA,2 years,Full time,120,PG,5.2 lakhs,(AICTE) All India Council of Technical Education,Admission to this programme is open to degree holders in any discipline from any recognized College / University.,"M.B.A (Master of Business Administration) is two years (4 Semesters) Full Time – Fully Residential Postgraduate management program affiliated to Bharathiar University, Coimbatore and approved by AICTE (All India Council for Technical Education) also Accredited by NBA(National) and ACBSP(Inte"
471,"SR Luthra Institute of Management, Surat",Surat,Gujarat,MBA,2 years,Full time,120,PG,1.8 lakhs,(AICTE) All India Council of Technical Education,The candidate should have passed graduation with relevant combination.,"Master of Business Administration is two years full time course. Approved by AICTE and affiliated to Gujarat Technological University, Ahmedabad."
472,"SR Luthra Institute of Management, Surat",Surat,Gujarat,MBA ll Shift,2 years,Full time,120,PG,1.42 lakhs,(AICTE) All India Council of Technical Education,The candidate should have passed graduation with relevant combination.,"Master of Business Administration is two years full time second shift course. Approved by AICTE and affiliated to Gujarat Technological University, Ahmedabad."
473,"Mahatma Gandhi Mission Institute of Management, Aurangabad",Aurangabad,Maharashtra,MBA,2 years,Full time,120,PG,1.86 lakhs,(AICTE) All India Council of Technical Education,"Bachelors Degree in any faculty of any statutory University with at least 50% or more marks (minimum 45% in case of SC, ST, DT, NT, OBC, SBC domiciled in Maharashtra state only). OR A masters degree in any statutory University with 50% Or more marks minimum 45% in case of SC, ST, DT, NT, OBC, SBC domiciled in Maharashtra state only.
Must have completed the selection procedure as prescribed by the competent authority(DTE) from time to time.","Master of Business Administration is two years full time course. Approved by AICTE and affiliated to Dr. Babasaheb Ambedkar Marathwada University, Aurangabad."
474,"Mahatma Gandhi Mission Institute of Management, Aurangabad",Aurangabad,Maharashtra,MBA II Shift,2 years,Full time,60,PG,1.86 lakhs,(AICTE) All India Council of Technical Education,"Bachelors Degree in any faculty of any statutory University with at least 50% or more marks (minimum 45% in case of SC, ST, DT, NT, OBC, SBC domiciled in Maharashtra state only). OR A masters degree in any statutory University with 50% Or more marks minimum 45% in case of SC, ST, DT, NT, OBC, SBC domiciled in Maharashtra state only.
Must have completed the selection procedure as prescribed by the competent authority(DTE) from time to time.","Master of Business Administration is two years full time second shift course. Approved by AICTE and affiliated to Dr. Babasaheb Ambedkar Marathwada University, Aurangabad."
475,"Institute of Management and Research, Ghaziabad",Ghaziabad,Uttar Pradesh,MBA,2 years,Full time,120,PG,0.92 lakhs,(AICTE) All India Council of Technical Education,,"<p><strong>About programme:</strong> The M.B.A. course aims at providing inputs to the students relevant to the business, industry and trade so that they can function in different organizations and face the challenges arising there from.</p><p><strong>Scholarship: </strong><!--[if gte mso 9]><xml> <w:WordDocum...See More"
476,"Institute of Management and Research, Ghaziabad",Ghaziabad,Uttar Pradesh,PGDM,2 years,Full time,30,PG,4.5 lakhs,(AICTE) All India Council of Technical Education,,"<p><strong>About programme:</strong> During the first year,all the students pursue the same course of study and students build a firm, broad foundation of general management concepts and skills across all the key disciplines. In the second year, all students are offered a dual specialization in any two of the offered disciplines.</p><p>&l;...See More"
477,"Mahatma Gandhi Mission Institute of Management Studies and Research, Navi Mumbai",Navi Mumbai,Maharashtra,MMS,2 years,Full time,60,PG,,(AICTE) All India Council of Technical Education,"Passed with minimum of 50% marks in aggregate or equivalent CGPA in Graduation and must have valid score in CET, MAT/XAT/ATMA",Master of Management Studies Two years Full-Time program affiliated to University of Mumbai and approved by AICTE and DTE Govt. of Maharashtra.
478,"JK Padampat Singhania Institute of Management and Technology, Gurgaon",Maruti Kunj,Haryana,PGDM,2 years,Full time,120,PG,5.85 lakhs,(AICTE) All India Council of Technical Education,,<p>About: - PGDM- Stands for Post Graduate Diploma in Management. It is a two years full time program and approved by AICTE. The flagship PGDM program is fashioned to prepare a participant to be an outstanding business leader. Learning theory is only a microscopic part of the entire rigor at JKPS. Most of the energies are spent trying to apply the tools and tech...See More
479,"JK Padampat Singhania Institute of Management and Technology, Gurgaon",Maruti Kunj,Haryana,PGDM Banking and Insurance Service,2 years,Full time,60,PG,5.85 lakhs,(AICTE) All India Council of Technical Education,,"<p>About: - PGDM Banking and Insurance Service is a two years full time program. This programme aims to develop an understanding of the theories and practices in corporate finance, financial decision-making, financial analysis and financial markets and institutions followed in the corporate world. The programme is designed to develop analytical abilities in the ...See More"
