,College,City,State,Course,Duration,Study mode,Approved intake,Course level,Course Fee,Approval,Eligiblity,Course_Detail
570,"Vathsalya Institute of Science and Technology, Nalgonda",Anantharam,Telangana,M.Tech Construction Management,2 years,Full time,30,PG,1.14 lakhs,(AICTE) All India Council of Technical Education,Candidate must have passed BE/B.Tech degree in related stream from recognized university,"M.Tech Construction Management is full time two year post graduate degree course, recognized by AICTE"
571,"Vathsalya Institute of Science and Technology, Nalgonda",Anantharam,Telangana,MBA,2 years,Full time,300,PG,1.36 lakhs,(AICTE) All India Council of Technical Education,Candidate must have passed graduation degree in any stream from recognized university,"Master of Business Administration is full time two year post graduate degree course, recognized by AICTE"
572,"Thiruvalluvar College of Engineering and Technology, Vandavasi",Ponnur Malai,Tamil Nadu,MBA,2 years,Full time,45,PG,0.6 lakhs,(AICTE) All India Council of Technical Education,Any degree passed with 50% of marks.,"The Master of Business Administration (MBA) The course structure is designed to impart knowledge of the core management concepts and techniques in the first year which are, thereafter, upgraded to advanced knowledge and practicing skills in the areas of specialization opted for by the students in the final year. A graduate with a broader picture of business is often t...See More"
573,"Sunrise Group of Institutions, Udaipur",Udaipur,Rajasthan,MBA,2 years,Full time,120,PG,1.1 lakhs,(AICTE) All India Council of Technical Education,The candidate should have passed graduation in any discipline.,"Master of Business Administration is two years full time course. Approved by AICTE and affiliated to Rajasthan Technical University, Kota.
Specializations- Marketing Management, Finance Management, Human Resource Management, Information Technology, Production and Operation Management."
574,"Stanley Stephen College of Engineering and Technology, Kurnool",Panchalingala,Andhra Pradesh,MBA,2 years,Full time,60,PG,,(AICTE) All India Council of Technical Education,Any degree,This is a 2 year full time course.
575,"St Michael College of Engineering and Technology, Kalayarkoil",Somanathamangalam,Tamil Nadu,MBA,2 years,Full time,60,PG,1.3 lakhs,(AICTE) All India Council of Technical Education,The candidate should have passed graduation in any discipline.,"Master of Business Administration is two years full time course. Approved by AICTE and affiliated to Anna University, Chennai."
576,"St Mark Educational Institution Society Group of Institution, Anantapur",Anantapur,Andhra Pradesh,MBA,2 years,Full time,240,PG,,(AICTE) All India Council of Technical Education,A candidate must have pass in a recognised Bachelor’s degree of minimum three years duration with minimum 50 per cent of marks (45 per cent for reserved category) at graduation.,"MBA is a full-time two years duration course Affiliated to Jawaharlal Nehru Technological University, Anantapur Approved by AICTE."
577,"St Mary’s Group of Institutions, Guntur",Narakoduru,Andhra Pradesh,MBA,2 years,Full time,60,PG,,(AICTE) All India Council of Technical Education,,
578,"Sri KS Raju Institute of Technology and Sciences, Ranga Reddy",Kanakamamidi,Telangana,MBA,2 years,Full time,120,PG,,(AICTE) All India Council of Technical Education,Any degree,This is a 2 year full time course.
579,"Sri Sukhmani Institute of Engineering and Technology, Dera Bassi",Dera Bassi,Punjab,MBA,2 years,Full time,60,PG,,(AICTE) All India Council of Technical Education,The candidate should have passed in the relevant graduate degree.,"Master of Business Administration is a full-time two year course affiliated to Punjab Technical University, Jalandhar and approved by AICTE."
580,"Sri Satya Narayana College of Engineering and Technology, Ongole",Ongole,Andhra Pradesh,MBA,2 years,Full time,120,PG,,(AICTE) All India Council of Technical Education,any degree,This is a 2 year full time course.
581,"Sri Krishna Engineering College, Chennai",Chennai,Tamil Nadu,MBA,2 years,Full time,60,PG,,(AICTE) All India Council of Technical Education,The candidate should have passed in graduate degree.,"Master of Business Administration is a full-time two year course affiliated to Anna University, Chennai and approved by AICTE."
582,"Sri Balaji Chockalingam Engineering College, Tiruvannamalai",Arani,Tamil Nadu,MBA,2 years,Full time,60,PG,0.6 lakhs,(AICTE) All India Council of Technical Education,A pass in any Bachelor’s Degree (3 Years) from a recognized university.,"It is 2 year full time course with affiliation of Anna University, Chennai and approved by AICTE."
583,"SP Memorial Institute Technology, Allahabad",Bhitidaih Mafi,Uttar Pradesh,BBA,3 years,Full time,60,UG,,"Ministry of HRD, Govt. of India",The Candidate should have passed 10+2 in relevant subject or equivalent from recognized board.,"Bachelor of Business Administration is three-year duration under graduate degree program affiliated to Dr APJ Abdul Kalam Technical University, Lucknow."
584,"SP Memorial Institute Technology, Allahabad",Bhitidaih Mafi,Uttar Pradesh,MBA,2 years,Full time,60,PG,1.49 lakhs,(AICTE) All India Council of Technical Education,The candidate should have Graduation degree in relevant subject from any recognized University.,"Master of Business Administration is two-year duration Post Graduate degree Programme in following specialization Marketing, Finance, Human Resource, International Business, Information Technology affiliated to Dr APJ Abdul Kalam Technical University, Lucknow and approved by AICTE."
585,"Shri Shivaji Institute of Engineering and Management Studies, Parbhani",Parbhani,Maharashtra,MBA,2 years,Full time,60,PG,,(AICTE) All India Council of Technical Education,The minimum academic qualification for admission is any bachelor degree subject from any recognized college or university,"Master of Business Administration is two-year full time postgraduate course offered by Swami Ramanand Teerth Marathwada University, Nanded and Approved by All India Council for Technical Education."
586,"Shree Siddhivinayak Group of Institutions, Bilaspur",Shahpur,Haryana,BBA,3 years,Full time,60,UG,,,The students should have passed class XII from recognized Board.,"BBA is a professional bachelor’s degree in Commerce and Business Administration. It is affiliated to Kurukshetra University, Kurukshetra."
587,"Shree Siddhivinayak Group of Institutions, Bilaspur",Shahpur,Haryana,MBA,2 years,Full time,60,PG,0.6 lakhs,(AICTE) All India Council of Technical Education,Pass in Bachelor’s or post-graduate degree in any discipline with 50% marks.,"The MBA Program at the Institute a professional 2 years program with specialization in Marketing, Finance and Human Resource Management. It is affiliated to Kurukshetra University, Kurukshetra and approved by All India Council for Technical Education (AICTE)."
588,"Shree Institute of Science and Technology, Bhopal",Bhopal,Madhya Pradesh,MBA,2 years,Full time,60,PG,0.95 lakhs,,The candidate should have passed Bachelor's Degree or its equivalent in any discipline.,"Master of Business Administration is a full-time twp-year course degree affiliated to Rajiv Gandhi Proudyogiki Vishwavidyalaya, Bhopal."
589,"SECT Group of Institutes, Patiala",Rajpura,Punjab,MBA,2 years,Full time,180,PG,1.69 lakhs,(AICTE) All India Council of Technical Education,A candidate must have pass in a recognised Bachelor’s degree of minimum three years duration with minimum 50 per cent of marks (45 per cent for reserved category) at graduation.,"MBA is a full-time two years duration course Affiliated to Maharaja Ranjit Singh Punjab Technical University, Bathinda Approved by AICTE."
590,"SECT Group of Institutes, Patiala",Rajpura,Punjab,PGDM,2 years,Full time,120,PG,1.69 lakhs,(AICTE) All India Council of Technical Education,A candidate must have pass in a recognised Bachelor’s degree of minimum three years duration with minimum 50 per cent of marks (45 per cent for reserved category) at graduation.,"PGDM is a full-time four years duration course offered by SECT Group of Institutes, Patiala Approved by AICTE."
591,"Saraswathi Velu College of Engineering, Vellore",Vellore,Tamil Nadu,MBA,2 years,Full time,60,PG,0.3 lakhs,(AICTE) All India Council of Technical Education,Candidate Desirous of seeking admission in MBA programme should be a graduate in any discipline from a recognized university,"This is a two year full time programme leading to a Master Degree in Management from the Anna University, Chennai"
592,"Sarada Institute of Technology and Science, Raghunadhapalem",Regula Chalka,Telangana,MBA,2 years,Full time,120,PG,0.54 lakhs,(AICTE) All India Council of Technical Education,A candidate must have pass in a recognised Bachelor’s degree of minimum three years duration with minimum 50 per cent of marks (45 per cent for reserved category) at graduation.,"MBA is a full-time two years duration course Affiliated to Jawaharlal Nehru Technological University, Hyderabad Approved by AICTE."
593,"Sanjay Institute of Engineering and Management, Mathura",Atas Bangar,Uttar Pradesh,MBA,2 years,Full time,60,PG,,(AICTE) All India Council of Technical Education,A candidate must have passed three years degree course with a minimum of 50% marks (45% for SC/ST) from any recognized university as per UPTU norms.,"This is a two year full time course Approved by AICTE, Affiliated to Dr. A.P.J. Abdul Kalam Technical University, Lucknow"
594,"S Veerasamy Chettiar College of Engineering and Technology, Tirunelveli",Ayyapuram,Tamil Nadu,MBA,2 years,Full time,60,PG,0.5 lakhs,(AICTE) All India Council of Technical Education,Degree with 55% marks in case of engineering & science and 50% marks for arts and science. Final year students can also apply,The two year full time MBA programme is spread over 4 semesters. During the first two semesters the students are exposed to the basics of general management underlying different operational functions of corporate management through core subjects. In the third semester the students are permitted to choose electives suitable to their personal interest leading to special...See More
595,"S Sukhjinder Singh Engineering and Technology College, Gurdaspur",Gurdaspur,Punjab,MBA,2 years,Full time,60,PG,1.48 lakhs,(AICTE) All India Council of Technical Education,The Basic eligibility for this course is to have a bachelor degree from a recognized university with minimum 50% marks in aggregate.Yes there is a good scope of this course in India.If you have a MBA degree then surely your Salary Potential as well as your post will increase as compare to normal degree.,"This is a two year full time course Approved by AICTE, Affiliated to IK Gujral Punjab Technical University, Jalandhar
MBA Course contains many specializations.Each specialization of this course is having a good and great scope in its own field.Choosing any one specialization is depend upon ones own interest as well as personal liking towards that particular specializ...See More"
596,"SGBM Institute of Technology and Science, Jabalpur",Sukha,Madhya Pradesh,MBA,2 years,Full time,60,PG,0.9 lakhs,(AICTE) All India Council of Technical Education,Candidate should have graduate degree with the relevant subject,"This is a two year full time course Approved by AICTE, Affiliated to Rani Durgawati Vishwavidyalaya, Jabalpur"
597,"Rishi Chadha Vishvas Girls Institute of Technology, Ghaziabad",Ghaziabad,Uttar Pradesh,MBA,2 years,Full time,60,PG,1.02 lakhs,(AICTE) All India Council of Technical Education,Graduation from any Recognized university with relevant subjects.,"This is a two year full time course Approved by AICTE, Affiliated to Dr. A.P.J. Abdul Kalam Technical University, Lucknow. with specialization in Finance, Human Resource, Marketing, Information Technology ."
598,"Rewa Institute of Technology, Rewa",Rewa,Madhya Pradesh,MBA,2 years,Full time,60,PG,0.87 lakhs,(AICTE) All India Council of Technical Education,A candidate must have pass in a recognised Bachelor’s degree of minimum three years duration with minimum 50 per cent of marks (45 per cent for reserved category) at graduation.,"MBA is a full-time two years duration course Affiliated to Awadhesh Pratap Singh University, Rewa Approved by AICTE."
599,"Quest Group of Institutions, Mohali",Jhanjheri,Punjab,BBA,3 years,Full time,,UG,,,The student must have passed higher secondary (10+2) examination in any stream Â from a recognized Board.,"Bachelor's of Business Administration is a three year degree program. It is designed to prepare students for practical work in the Business Administration Environment by providing fundamental education in business and management principles. Emphasis is on development of communications, quantitative reasoning, and business analysis skills. BBA programs offer practical ...See More"
600,"Quest Group of Institutions, Mohali",Jhanjheri,Punjab,MBA,2 years,Full time,60,PG,1.2 lakhs,(AICTE) All India Council of Technical Education,Graduation in any Stream from a recognized University with minimum 50% marks.,"Faculty of Management in Chandigarh offers two-year regular program in Business Management leading to the award of MBA degree. The degree is approved by the AICTE New Delhi and Punjab Technical University, Jalandhar.
MBA programs helps students to build their management skills, knowledge, leadership and expertise on various business topics. This knowledge and experti...See More"
601,"Pulipati Prasad Institute of Technology and Science, Khammam",Thanikella,Telangana,MBA,2 years,Full time,120,PG,0.54 lakhs,(AICTE) All India Council of Technical Education,A candidate must have pass in a recognised Bachelor’s degree of minimum three years duration with minimum 50 per cent of marks (45 per cent for reserved category) at graduation.,"MBA is a full-time two years duration course Affiliated to Jawaharlal Nehru Technological University, Hyderabad Approved by AICTE."
602,"Progressive Engineering College, Nalgonda",Venkatapuram,Telangana,MBA,2 years,Full time,60,PG,0.54 lakhs,,A candidate must have pass in a recognised Bachelor’s degree of minimum three years duration with minimum 50 per cent of marks (45 per cent for reserved category) at graduation.,"MBA is a full-time two years duration course Affiliated to Jawaharlal Nehru Technological University, Hyderabad Approved by AICTE."
603,"Professional Educational Trust’s Group of Institutions- Faculty of Engineering, Tirupur",Palladam,Tamil Nadu,MBA,2 years,Full time,60,PG,0.6 lakhs,(AICTE) All India Council of Technical Education,Graduation from any recognized university with relevant subjects.,"This is a full time two year course affiliated to Anna University, Chennai and approved by AICTE."
604,"Priyadarshini Engineering College, Vellore",Kalendira,Tamil Nadu,MBA,2 years,Full time,120,PG,0.6 lakhs,(AICTE) All India Council of Technical Education,The candidate should have passed any graduation degree from any recognized college or University.,"The Department of Management Studies is well equipped with furnished class rooms, separate computer lab with 40 computers with internet facility, seperate seminar hall. We offer the following specialization to our students. Human Resource, Finance, Marketing Systems.
Here students are taught to realize their potential by acquiring Knowledge skill and talent needed ...See More"
605,"Prajna Institute of Technology and Management, Pasala",Ranganadhapuram,Andhra Pradesh,MBA,2 years,Full time,60,PG,0.54 lakhs,(AICTE) All India Council of Technical Education,The candidate should have passed any graduation degree from any recognized college or University.,"Master of Business Administration got it's permissions from JNTU, kakinada from cat academic session 2009. The sanctioned strength is 60. The department has fitted with placement cell and itâ€™s first and farmost motto is 100% results with 100% placements. So it has include spoken English classes with yoga and modification in its timetable with a aim to fulfill i...See More"
606,"Prabhat Engineering College, Kanpur",Binaur,Uttar Pradesh,MBA,2 years,Full time,60,PG,1.47 lakhs,(AICTE) All India Council of Technical Education,The candidate should have passed any graduation degree from any recognized college or University.,"Master of Business Administration it is a two year course affiliated to Gautam Buddh Technical University, Lucknow. approved by All India Council for Technical Education,New Delhi"
607,"PGP College of Engineering and Technology, Namakkal",Sundakkampalayam,Tamil Nadu,MBA,2 years,Full time,60,PG,0.8 lakhs,(AICTE) All India Council of Technical Education,The candidate should have passed any graduation degree from any recognized college or University.,"The M.B.A programme has been started in the year 2008 with an intake of 60 students under Anna University, Chennai. The programme has gone through various dimensions with changes as per the requirements. MBA is a two years full time programme with specializations in Finance, Marketing, Human Resources, and Systems. The department is committed to provide state of the a...See More"
608,"Paavaai Group of Institutions- School of Engineering, Pachal",Pachal,Tamil Nadu,MBA,2 years,Full time,120,PG,,(AICTE) All India Council of Technical Education,,"he department of Management Studies is a diverse community knit together by its physical environment as well as by its commitment to the highest standards of excellence, integrity, free expression, and inquiry. It provides management education to both fresh graduates seeking world-class management education and also to those who are already employed and want to enhanc...See More"
609,"PK Institute of Technology and Management, Mathura",Birhana,Uttar Pradesh,BBA,3 years,Full time,,UG,0.95 lakhs,,Candidate must have passed 10+2 from recognized board,Bachelor of Business Administration is full time three year undergraduate degree course
610,"PK Institute of Technology and Management, Mathura",Birhana,Uttar Pradesh,MBA,2 years,Full time,60,PG,1.45 lakhs,(AICTE) All India Council of Technical Education,Candidate must have passed related bachelor degree from recognized university,"Master of Business Administration is full time two year post graduate degree course, recognized by AICTE. Specialization are - Human Resources, Finance and Marketing Management)"
611,"OAS Institute of Technology and Management, Tiruchirappalli",Pulivalam,Tamil Nadu,MBA,2 years,Full time,120,PG,0.63 lakhs,(AICTE) All India Council of Technical Education,Bachelor's Degree or equivalent in any discipline from a recognized university.,"Master of Business Administration is a two-year full-time course approved by AICTE.
OAS Institute of Technology and Management offers MBA course with unique teaching strategies by combining traditional and modern approach that is well appreciated by the students and peers across domains. The college has a global vision and created an atmosphere that is unique to OA...See More"
612,"NRI Institute of Technology and Management, Gwalior",Gwalior,Madhya Pradesh,MBA,2 years,Full time,60,PG,,(AICTE) All India Council of Technical Education,,
613,"North India Institute of Technology, Bijnor",Nekpur,Uttar Pradesh,MBA,2 years,Full time,120,PG,1.3 lakhs,(AICTE) All India Council of Technical Education,Bachelor's Degree or equivalent in any discipline from a recognized university,The MBA (Master of Business Administration) is a postgraduate degree that is awarded to students who have mastered the study of business. The MBA degree is thought to be one of the most prestigious and sought after degrees in the world. Students of MBA programs study the theory and application of business and management principles. This type of study equips students w...See More
614,"Neelkanth Institute of Technology, Meerut",Pavli Khas,Uttar Pradesh,MBA,2 years,Full time,60,PG,1.68 lakhs,(AICTE) All India Council of Technical Education,The eligibility criteria for admission to the MBA program is 50% aggregate marks in Graduation.,"MBA is a two-year full-time degree program of learning and training is recognized by All India Council for Technical Education (AICTE) and Affiliated to Dr. APJ Abdul Kalam Technical University, Lucknow, UP. (Formerly Uttar Pradesh Technical University)
Specializations
•	Marketing
•	Finance
•	Human Resource
•	Information Technology
•	International ...See More"
615,"Modern Institute of Technology and Management, Kantabada",Ghangapatna,Odisha,MBA,2 years,Full time,60,PG,0.8 lakhs,(AICTE) All India Council of Technical Education,Bachelor's Degree or equivalent in any discipline from a recognised university.,"Business Administration is essentially a generalist qualification designed to widen the student's horizon in order to take account of all the major functions of a business as well as their interactions in practice. Because its focus is general rather than specialist, the MBA is targeted at those who can make a contribution to strategy.MBA qualification provides suffic...See More"
616,"Meerut International Institute of Technology, Meerut",Meerut,Uttar Pradesh,MBA,2 years,Full time,60,PG,1.31 lakhs,(AICTE) All India Council of Technical Education,"For admission to first year of MBA in any institution affiliated to GBTU, Lucknow & MTU, Noida a candidate must have passed Bachelors degree course of three years minimum duration from any recognised Indian University; or its equivalent, recognised by A.I.U securing minimum 50% (45% for SC/ST) marks in aggregate.","MIIT-M shall offer a two year (4 semesters) full time University affiliated MBA program. The program aims at providing young thinking minds the power to shape their thoughts and develop appropriate skills for management decision making.
We believe that MIIT-M MBA would be special in several ways:
The MBA program goes beyond theory by giving you the opportunity to p...See More"
617,"Medha College of Engineering, Hyderabad",Secunderabad,Telangana,MBA,2 years,Full time,120,PG,,(AICTE) All India Council of Technical Education,,
618,"Maharishi Arvind International Institute of Technology, Kota",Ranpur,Rajasthan,MBA,2 years,Full time,60,PG,1.09 lakhs,(AICTE) All India Council of Technical Education,Candidate Desirous of seeking admission in MBA programme should be a graduate in any discipline from a recognized university,"The Two-Year Postgraduate program (MBA) is a Four Semester Course affiliated to Rajasthan Technical University, Kota and approved by AICTE, New Delhi."
619,"Maharaja Prithvi Engineering College, Coimbatore",Ayikavundanpalayam,Tamil Nadu,MBA,2 years,Full time,60,PG,0.6 lakhs,(AICTE) All India Council of Technical Education,"Qualification- Recognized Bachelor's Degree of minimum 3 Years duration
Marks- Obtained at least 50% (45% in case of candidate belonging to reserved category) at the qualifying Examination","Two year full time MBA Programme, affiliated to Anna University, Chennai and approved by AICTE with the intake capacity of 60 students per year. The programme has been framed with emphasis on developing analytical thinking, creativity, imagination & team work among the students. It seeks to provide a platform to nurture the talent, to hone the skills & to mould an ind...See More"
620,"Mahakavi Bharathiyar College of Engineering and Technology, Tirunelveli",Vasudevanallur,Tamil Nadu,MBA,2 years,Full time,60,PG,0.6 lakhs,(AICTE) All India Council of Technical Education,Candidates for the admission to the first semester of the Master's Degree Programme shall be required to have passed an appropriate Degree Examination of Anna University or any other examination of any University or authority accepted by the Syndicate of Anna University as equivalent thereto.,"This is a two year full time course Approved by AICTE, Affiliated to Anna University, Chennai"
621,"Madhukarrao Pandav College of Engineering, Bhandara ",Bhilewada,Maharashtra,MBA,2 years,Full time,54,PG,3 lakhs,(AICTE) All India Council of Technical Education,A candidate must have pass in a recognised Bachelor’s degree of minimum three years duration with minimum 50 per cent of marks (45 per cent for reserved category) at graduation.,"MBA is a full-time two years duration course Affiliated to Rashtrasant Tukadoji Maharaj Nagpur University, Nagpur Approved by AICTE."
622,"Lord Venkateshwaraa Engineering College, Kancheepuram",Palayaseevaram,Tamil Nadu,MBA,2 years,Full time,60,PG,0.5 lakhs,(AICTE) All India Council of Technical Education,Candidate Desirous of seeking admission in MBA programme should be a graduate in any discipline from a recognized university,"This is a two year full time course Approved by AICTE, Affiliated to Anna University, Chennai"
623,"LDC Institute of Technical Studies, Allahabad",Soraon,Uttar Pradesh,MBA,2 years,Full time,60,PG,1.13 lakhs,(AICTE) All India Council of Technical Education,"Bachelor's degree holders in any discipline with minimum 50% marks
Admission as per UP Government / AKTU directives.
85% seats through UPSEE - 2017 counseling.
15% seats for direct admission on merit for management quota and vacant seats for Bachelor's
degree holders in any discipline with minimum 50% marks","Master of Business Administration is full time two year course affiliated to Dr. A.P.J. Abdul Kalam Technical University, Lucknow and approved by AICTE."
624,"Lala Lajpat Rai Institute of Engineering and Technology, Moga",Moga,Punjab,BBA,3 years,Full time,,UG,,,The candidate should have passed 10+2 in any stream from recognized board.,"Bachelor of Business Administration (BBA) is three-year duration full-time course affiliated to Maharaja Ranjit Singh Punjab Technical University, Bathinda."
