,College,City,State,Course,Duration,Study mode,Approved intake,Course level,Course Fee,Approval,Eligiblity,Course_Detail
292,"Mantra School of Business Management, Hyderabad",Hyderabad,Telangana,MBA,2 years,Full time,120,PG,,(AICTE) All India Council of Technical Education,Graduates in any discipline from a recognized University with not less than 50% Aggregate Marks.,"Mantra School of Business Management offers two-year full-time Master of Business Administration(MBA) approved by AICTE, Ministry of HRD, Govt of India."
293,"St Anns Engineering College, Chirala",Nayani Palli Rural,Andhra Pradesh,MBA,2 years,Full time,120,PG,0.6 lakhs,(AICTE) All India Council of Technical Education,The candidate should have passed any graduation degree from any recognized college or University.,"Master of Business Administration is two years full-time Post graduate management programme offered by Jawaharlal Nehru Technological University, Kakinada and approved by AICTE"
294,"Sai Krishna College, Wanaparthy",Wanaparthy,Telangana,MBA,2 years,Full time,120,PG,0.54 lakhs,(AICTE) All India Council of Technical Education,The candidate should have passed graduate degree from any recognized university or college and any stream.,"It is two years full time post graduate management program, offered by Palamuru University, Mahabubnagar and approved by AICTE"
295,"St Augustine PG College, Hyderabad",Ghatkesar,Telangana,MBA,2 years,Full time,180,PG,0.54 lakhs,(AICTE) All India Council of Technical Education,Graduation from any Recognized university with relevant subjects.,"This is a full time two year course affiliated to Osmania University, Hyderabad and approved by AICTE."
296,"Saradamba Dasa Govindaiah Setty College, Hindupur",Hindupur,Andhra Pradesh,BBM,3 years,Full time,120,UG,0.065 lakhs,,,
297,"Saradamba Dasa Govindaiah Setty College, Hindupur",Hindupur,Andhra Pradesh,MBA,2 years,Full time,120,PG,,,,
298,"Siddhartha Educational Academy Group of Institutions, Tirupati",Tirupati,Andhra Pradesh,MBA,2 years,Full time,180,PG,0.602 lakhs,(AICTE) All India Council of Technical Education,The minimum qualification for admission to first year of the MBA is a pass in undergraduate course (10 + 2 + 3).,"Master Of Business Administration it is a 2-year full-time course of management, it course offered by Jawaharlal Nehru Technological University, Anantpur with the approval of AICTE."
299,"Shantiniketan Institute of Technology, Tirupati",Tirupati,Andhra Pradesh,MBA,2 years,Full time,120,PG,,(AICTE) All India Council of Technical Education,The candidate should have passed any graduation degree from any recognized college or University.,"Master of Business Administration, it is three years full time course offered by Shri Venkateshwara University and approved by AICTE"
300,"SD Signodia College of Arts and Commerce and PG Centre, Hyderabad",Hyderabad,Telangana,MBA,2 years,Full time,60,PG,1.56 lakhs,(AICTE) All India Council of Technical Education,The candidate should have passed any graduation degree from any recognized college or University.,Master of Business Administration is two years full-time Post graduate management programme offered by Osmania University Hyderabad and approved by AICTE
301,"Sumourya Institute of Management, Kurnool",B. Thandrapadu,Andhra Pradesh,MBA Business Management,2 years,Full time,180,PG,0.54 lakhs,(AICTE) All India Council of Technical Education,Bachelor's Degree or equivalent in any discipline from a recognized university.,"MBA in Business Management - Master’s in Business Management is a two years full time course offered by Jawaharlal Nehru Technological University, Anantapur and and Approved to AICTE."
302,"St Johns PG College, Ghatkesar",Secunderabad,Telangana,MBA,2 years,Full time,60,PG,0.54 lakhs,(AICTE) All India Council of Technical Education,A Candidate for admission to the three-year post graduate course in Master of Business Administration must have passed the qualifying examination (10+2+3).,"This is a full time two year course affiliated to Osmania University, Hyderabad and approved by AICTE."
303,"Sarada Institute of Technology and Management, Vijayawada",Vijayawada,Andhra Pradesh,MBA,2 years,Full time,60,PG,0.54 lakhs,(AICTE) All India Council of Technical Education,The candidate should have passed graduate degree from any recognized college/ University.,"Masters of Business Administration is a two-years full-time postgraduate management course offered by Jawaharlal Nehru Technological University, Kakinada and approved by AICTE"
304,"Samata College, Visakhapatnam",Visakhapatnam,Andhra Pradesh,BBA,3 years,Full time,,UG,,,Students who have completed 10+2 /Intermediate or any other Board Certificate which is recognized by Government of India shall be eligible for getting Admission into above Degrees.,"Bachelor of Business Administration is three years full-time undergraduate management programme offered by Andhra University, Visakhapatnam and approved by AICTE"
305,"Samata College, Visakhapatnam",Visakhapatnam,Andhra Pradesh,MBA,2 years,Full time,180,PG,0.8 lakhs,(AICTE) All India Council of Technical Education,For admission into M.B.A Course the eligibility is as prescribed by the Andhra University.,"Master of Business Administration is two years full-time Post graduate management programme offered by Andhra University, Visakhapatnam and approved by AICTE"
306,"SRM Degree And PG College, Karimnagar",Karimnagar,Telangana,BBM,3 years,Full time,30,UG,,,Candidates seeking admission to the 1st year degree course must have passed Intermediate Examination or any other equivalent examination recognized by Satavahana University with Science Group are eligible for B.Sc. Course and with any combination for B.B.M. Candidates seeking admission to the science group should have obtained not less than 40% of marks in aggregate in the qualifying examination in the corresponding optional subjects. Candidates who have passed the qualifying examination in a medium other than English are also eligible to study in English medium .,"Bachelor of Business Management is a three-year full-time UG course offered by Satavahana Univeristy, Karimnagar"
307,"SRM Degree And PG College, Karimnagar",Karimnagar,Telangana,MBA,2 years,Full time,180,PG,0.534 lakhs,(AICTE) All India Council of Technical Education,"The candidate shall be of Indian National.
The Candidate should have passed the qualifying examination (10+2+3) or equivalent on the date of His / Her counseling with Mathematics as one of the subject in S.S.C for Admission into MBA and in (10+2) for MCA programmes. The candidate should also have secured a rank at the common entrance Test and satisfy other conditions laid down in these Rules.
Provided that the category B seats as specified in Rule 3 (ii) ( c ) above shall be filled on the basis of the rank obtained in the All India Common Entrance Test or common Entrance Test conducted by the State Agency.","Master of Business Administration is two years full time course offered by Jawaharlal Nehru Technological University, Hyderabad and approved by AICTE"
308,"Dr Agarala Eswara Reddi MBA College, Tirupati",Tirupati,Andhra Pradesh,MBA,2 years,Full time,120,PG,0.54 lakhs,(AICTE) All India Council of Technical Education,The candidate should have passed any graduation degree from any recognized college or University.,"This is a two year full time programme leading to a MBA in Human Resource Management from the Sri Venkateswara University, Tirupati and approved by AICTE
Specializations offered
HRM
Marketing
Finance
International Business
Banking and Insurance"
309,"Allagadda Institute of Management Science, Allagadda",Padakandla,Andhra Pradesh,MBA,2 years,Full time,,PG,0.55 lakhs,(AICTE) All India Council of Technical Education,The candidate should have passed in any graduate degree,MBA is a two year full time course.
310,"Aurobindo College of Business management, Olive PG College, Ibrahimpatnam",Adibhatla,Telangana,MBA,2 years,Full time,300,PG,,(AICTE) All India Council of Technical Education,Graduation from any Recognized University with relevant subjects.,"<p>Our master's programme in MBA is designed to mould the students to meet the challenges of today corporate world by adopting contemporary curriculum to produce quality professionals in the field of marketing, finance, systems, HRM and Computer Applications.</p>"
311,"Maris Stella College, Vijayawada",Vijayawada,Andhra Pradesh,BMS,3 years,Full time,,UG,,UGC,The candidate should have passed in 10+2 or any other equivalent course.,"This is a full time three year course affiliated to Krishna University, Machilipatnam and approved by UGC."
312,"Maris Stella College, Vijayawada",Vijayawada,Andhra Pradesh,MBA,2 years,Full time,60,PG,0.6 lakhs,(AICTE) All India Council of Technical Education,Bachelor’s degree in the relevant subject with minimum pass percentage as stipulated by the University.,"Master of Business Administration is two years full-time Post graduate management programme offered by Krishna University, Machilipatnam and approved by AICTE"
313,"Sri Sai MBA College, Nandikotkur",Nandikotkur,Andhra Pradesh,BM MAM,5 years,Full time,,PG,,(AICTE) All India Council of Technical Education,"Passed Intermediate (M.P.C., Bi.P.C., C.E.C., H.E.C., M.E.C.) and obtained at least 45% (40% for reverse category students).",The Course Shall Provide an under graduate Degree in 3 years i.e. Business Management (B.M.) followed by Master Degree in two years i.e. Master of Applied Management (MAM).
314,"Sri Sai MBA College, Nandikotkur",Nandikotkur,Andhra Pradesh,MBA,2 years,Full time,120,PG,,(AICTE) All India Council of Technical Education,The candidate should have passed graduate degree from any recognized college/ University.,"This is a full time two year course affiliated to Osmania University, Hyderabad and approved by AICTE."
315,"Sahaja School of Business, Peddapalli",Peddapalli,Telangana,MBA,2 years,Full time,210,PG,0.54 lakhs,(AICTE) All India Council of Technical Education,"A graduate approved by AIU with minimum 50% marks
have qualified in ICET / MAT / CAT / GMAT / ATMA / XAT.","Master of Business Administration is two years full time course offered by Jawaharlal Nehru Technological University, Kukatpally and approved by AICTE New Delhi"
316,"Sri Srinivasa Institute of Management, Tadipatri",Nandalapadu Rural,Andhra Pradesh,MBA,2 years,Full time,120,PG,0.54 lakhs,(AICTE) All India Council of Technical Education,The candidate should have passed graduate degree from any recognized college/ University.,"Master of Business Administration is two years full time course offered by Jawaharlal Nehru Technological University, Anantapur and approved by AICTE New Delhi"
317,"Sree Sai Kiranmai Institute of Business Management, Kadapa",Vontimitta,Andhra Pradesh,MBA,2 years,Full time,60,PG,0.54 lakhs,(AICTE) All India Council of Technical Education,The candidate should have passed graduate degree from any recognized college/ University.,"Master of Business Administration is a two years full-time postgraduate management program offered by Jawaharlal Nehru Technological University, Anantapur And approved by AICTE New Delhi"
318,"Sanskrithi School of Business, Puttaparthi",Puttaparthi,Andhra Pradesh,MBA,2 years,Full time,180,PG,0.54 lakhs,(AICTE) All India Council of Technical Education,Graduate in any discipline with minimum 50% marks from any UGC recognized University. Those appearing for the final year Bachelor's Degree can also apply. Candidates must qualify any of these Entrance Tests: CAT / MAT / ATMA / XAT. Selection will be on the basis of - Composite score in the above mentioned Entrance Tests Academic performance Personal interview and group discussion,"Master of Business Administration is two years full time post graduate management program offered by Jawaharlal Nehru Technological University, Anantapur and approved by AICTE New Delhi
MBA Course offered in the subjects given below-
Marketing
Finance
Human Resource
Information Technology"
319,"Sanskrithi School of Business, Puttaparthi",Puttaparthi,Andhra Pradesh,MBA PGDM Dual Degree,2 years,Full time,,PG,,(AICTE) All India Council of Technical Education,Graduate in any discipline with minimum 50% marks from any UGC recognized University. Those appearing for the final year Bachelor's Degree can also apply. Candidates must qualify any of these Entrance Tests: CAT / MAT / ATMA / XAT. Selection will be on the basis of - Composite score in the above mentioned Entrance Tests Academic performance Personal interview and group discussion,"A unique and exclusive Management program from SSB, offering a dual degree of MBA (affiliated to JNTU-A) and PGDBA (from AIMA), both recognized by AICTE.
MBA Specializations (Dual): Marketing, Finance, HRM, IT (Systems)
PGDBM Specialization (Dual): Sales & Marketing, Finance, HRM, Operations"
320,"Sanskrithi School of Business, Puttaparthi",Puttaparthi,Andhra Pradesh,PGDM,,Full time,,PG,,(AICTE) All India Council of Technical Education,Graduate in any discipline with minimum 50% marks from any UGC recognized University. Those appearing for the final year Bachelor's Degree can also apply. Candidates must qualify any of these Entrance Tests: CAT / MAT / ATMA / XAT. Selection will be on the basis of - Composite score in the above mentioned Entrance Tests Academic performance Personal interview and group discussion,"Post Graduate Diploma in Management is two years full-time post-graduate management program. PGDM course approved by AICTE and delivered through AIMA New Delhi is the national level program of the central Government of India. It is totally industry oriented on the line with IIMs for superior placements in the industry.
It is offered in the subjects given below-
Mark...See More"
321,"Stanford PG College, Nalgonda",Baswapur,Telangana,MBA,2 years,Full time,180,PG,0.54 lakhs,(AICTE) All India Council of Technical Education,The candidate should have passed any graduation degree from any recognised college or University.,"Master of Business Administration is two years full-time Post graduate management programme offered by Osmania University, Hyderabad and approved by AICTE"
322,"Subrabhath Institute of Management and Computer Studies, Keesara",Secunderabad,Telangana,MBA,2 years,Full time,180,PG,0.54 lakhs,(AICTE) All India Council of Technical Education,"""Bachelor degree holder of Osmania University or a degree recognized by the University as equivalent there to and (or) as per the rooms laid down by the University with Mathematics as one of the subjects at 10th class level.
Conveyors Quota 70% of total admissions:The candidate seeking admission must qualify in the Entrance Examination conducted by the appropriate authority in the year of admission as per the norms prescribed by the University.
Management Quota-30% of total admissions:The admission of non-resident Indians and candidates admitted in lieu of them will be as per the University Rules in force on the date of the admission.""","The Master of Business Administration (M.B.A) is a Post Graduate course offered as two year i.e., four semesters Full time day programme. Offers specialization in specializations in Finance, Marketing, HRM and Systems"
323,"Subrabhath Institute of Management and Computer Studies, Keesara",Secunderabad,Telangana,MBA ll Shift,2 years,Full time,60,PG,,(AICTE) All India Council of Technical Education,Any degree,This is a 2 year full time course.
324,"Shree Vashista Institute of Management Studies, Karimnagar",Karimnagar,Telangana,MBA,2 years,Full time,240,PG,0.54 lakhs,(AICTE) All India Council of Technical Education,The candidate should have graduated in with minimum 50% marks form and recognized university,"Masters of Business Management is a two-years full-time postgraduate course offered by Kakatiya University,Warangal and approved by AICTE New Delhi"
325,"Sree Vyshnavi MBA College, Anantapur",Gooty,Andhra Pradesh,MBA,2 years,Full time,120,PG,0.55 lakhs,(AICTE) All India Council of Technical Education,The candidate should have passed graduate degree from any recognized college/ University.,"Masters of Business Management is a two-years full-time postgraduate course offered by Jawaharlal Nehru Technological University, Anantapur approved by AICTE New Delhi
Course Specializations
Marketing
Systems
Human Resource Management
Finance"
326,"St Vincent De Paul Degree College, Eluru",Eluru,Andhra Pradesh,MBA HR Finance and Marketing,2 years,Full time,60,PG,,(AICTE) All India Council of Technical Education,The candidate should have passed in graduate degree,MBA HR Finance and Marketing is a 2 year full time course.
327,"TKR Institute of Management and Science, Hyderabad",Hyderabad,Telangana,MBA,2 years,Full time,180,PG,0.54 lakhs,(AICTE) All India Council of Technical Education,The candidate should have passed graduate degree from any recognized college/ University.,"Master of Business Administration (MBA) Programme:
It is approved by the All India Council for Technical Education (AICTE), New Delhi. It is a full time course offered through four semesters
affiliated to Osmania University. The programme’s focus is to impart quality management education conforming to global standards.
The programme offers tremendous opportunitie...See More"
328,"TMSS College of Management Studies, Rangareddy",Balapur,Telangana,MBA,2 years,Full time,120,PG,0.54 lakhs,(AICTE) All India Council of Technical Education,The candidate should have passed graduate degree from any recognized college/ University.,"Masters of Business Management is a two-years full-time postgraduate course offered by Osmania University, Hyderabad and approved by AICTE New Delhi"
329,"Thushara PG School of Information Science and Technology, Warangal",Warangal,Telangana,MBA,2 years,Full time,120,PG,0.7 lakhs,(AICTE) All India Council of Technical Education,"1. The candidates should be Indian Nationals and should satisfy local/non-local status requirements laid down in the Andhra Pradesh Educational Institutions (Regulations of Admission) Order, 1974 as amended up to date.
2. The candidates other than Indian Nationals should satisfy the rules of the Universities concerned.
3. The candidates seeking admission Should have passed recognized Bachelors Degree Examination of minimum three years duration with at least 50% marks (45% marks in case of reserved categories) in the qualifying examination.
4. The qualifying Degree obtained by Distance Mode Program should have recognition by a joint committee of UGC, AICTE, and DEC.
5. The candidates who are appearing for the final year degree examination shall also be eligible to appear for ICET-2012.
6. Admission into any college depends on its Recognition/Affiliation by the Statutory Bodies.
7. Qualifying marks in ICET-2012 is 25% and no minimum marks are prescribed for SC/ST candidates.
Mere qualification in the entrance test does not entitle a candidate to have been admitted into MBA/MCA course unless the candidate:
i. appears for Counseling at the notified Centers.
ii. Applies in response to the admission notification issued by the authority concerned (for part-time/evening/distance mode).
iii. satisfies all the eligibility conditions of admission stipulated by the authority","Master of Business Administration is 2-year duration course approved by AICTE and affiliated with Kakatiya University, Warangal."
330,"Ushodaya Institute of Management and Technology, Rangareddy",Ibrahimpatnam,Telangana,MBA,2 years,Full time,,PG,,(AICTE) All India Council of Technical Education,Candidates applying for admission to the first year of MBA (Full-Time) Program must have pursued at least a 3-year Bachelor's Degree Program after 12 years of formal schooling. The minimum requisite percentage of marks is 50%.,"Masters of Business Management is a two-years full-time postgraduate course offered by Jawaharlal Nehru Technological University, Hyderabad"
331,"Ushodaya Institute of Management and Technology, Rangareddy",Ibrahimpatnam,Telangana,PGDM,2 years,Full time,120,PG,,(AICTE) All India Council of Technical Education,Graduation with 50% marks in any discipline with qualifying score in CMAT/ MAT/ CAT/ ATMA/ XAT/ ICET/ Any other state CET.,"Post Graduate Diploma in Management is a two-years full-time postgraduate course offered by Jawaharlal Nehru Technological University, Hyderabad and approved by AICTE"
332,"Unity PG College, Nalgonda",Bhuvanagiri,Telangana,MBA,2 years,Full time,120,PG,,(AICTE) All India Council of Technical Education,"A Graduate in any discipline with 50 % aggregate marks and in case of SC/ST 45 % are eligible for admissions. Final Year graduates awaiting for results can apply for admissions ,Herewith submitting their Marksheets of graduation once the results are declared.",Master of Business Administration is two-years duration full time course. Unity always aims to deliver to the highest quality standards setting pathways for next generation leaders by transforming professional enrichment education.
333,"Vinayaka College of IT and Business Management, Kondapak",Kondapak,Telangana,MBA,2 years,Full time,120,PG,0.54 lakhs,(AICTE) All India Council of Technical Education,The candidate should have passed graduate degree from any recognized college/ University.,"Masters of Business Management in Dual Specialization in Marketing / HR/Finance/Systems is a two-years full-time postgraduate course offered by Osmania University, Hyderabad and approved by AICTE New Delhi"
334,"Vinuthna College of Management, Warangal",Hasanparthy ,Telangana,MBA,2 years,Full time,120,PG,0.54 lakhs,(AICTE) All India Council of Technical Education,The candidate should have passed graduate degree from any recognized college/ University.,"Masters of Business Management is a two-years full-time postgraduate course offered by Kakatiya University,Warangal and approved by AICTE New Delhi"
335,"Vidya Dayini College of Information Technology, Rangareddy",Mallapur,Telangana,MBA,2 years,Full time,180,PG,0.54 lakhs,(AICTE) All India Council of Technical Education,"Candidates applying for admission to the first year of MBA (Full-Time) Programme must have pursued at least a 3-year Bachelor's Degree Programme after 12 years of formal schooling in any of the following disciplines. The minimum requisite percentage of marks in different disciplines is as follows :-
With ICET - 50%
Without ICET - Above 50%","The MBA program of VDCIT is affiliated to Osmania University and is approved by AICTE. The admission of the students is based on a State-wide entrance test called Integrated Common Entrance Test (I-CET), which tests the students in the areas of English language, Quantitative and Analytical abilities.
The course curriculum is prescribed by Osmania University and is ...See More"
336,"Vaageswari Institute of Management Sciences, Karimnagar",Ramakrishna Colony,Telangana,MBA,2 years,Full time,180,PG,0.54 lakhs,(AICTE) All India Council of Technical Education,The candidate should have passed graduate degree from any recognized college/ University.,"Masters of Business Management is a two-years full-time postgraduate course offered by Jawaharlal Nehru Technological University, Hyderabad and approved by AICTE New Delhi"
337,"Vasavi Institute of Management and Computer Science, Pedda Palli",Peddapalle,Andhra Pradesh,MBA,2 years,Full time,120,PG,0.55 lakhs,(AICTE) All India Council of Technical Education,"The candidate should have graduate degree with exams.
Bachelor of Degree from any discipline from any UGC recognized university.
Qualified the entrance exam conducted by Board of Technical Education, AP.","Master of Business Administration is two years full-time Post graduate management programme offered by Jawaharlal Nehru Technological University, Anantapur and approved by AICTE"
338,"Vidya Jyothi Institute of Management and Technology, Kurnool",Dinnedevarapadu,Andhra Pradesh,MBA,2 years,Full time,120,PG,,(AICTE) All India Council of Technical Education,any degree,This is a 2 year full time program.
339,"St Vincent PG College, Ranga Reddy",Ghatkesar,Telangana,MBA,2 years,Full time,180,PG,0.54 lakhs,(AICTE) All India Council of Technical Education,The candidate should have Graduation degree from any recognized University.,"Master of Business Administration is two-years duration full-time course affiliated to Osmania University, Hyderabad and approved by All India Council for Technical Education."
340,"VR College of Management and information Technology, Warangal",Hanamkonda,Telangana,MBA,2 years,Full time,180,PG,0.54 lakhs,(AICTE) All India Council of Technical Education,The candidate should have graduate degree. Applicant who has secured rank in the I-CET examination,This is a 2 year full time course.
341,"Vestal Academy of Information Technology and Management, Eluru",Eluru,Andhra Pradesh,MBA,2 years,Full time,60,PG,0.54 lakhs,(AICTE) All India Council of Technical Education,Bachelor's Degree or equivalent in any discipline from a recognised university.,"Vestal Academy of Information Technology and Management offers two-year full-time Master of Business Administration(MBA) approved by AICTE, Ministry of HRD, Govt of India."
342,"Vision Institute of Management, Guntur",Bapatla,Andhra Pradesh,MBA,2 years,Full time,60,PG,0.54 lakhs,(AICTE) All India Council of Technical Education,The candidate should have passed in graduate degree,MBA is a 2 year full time program.
343,"Vivek Vardhini School of Business Management, Hyderabad",Hyderabad,Telangana,MBA,2 years,Full time,120,PG,0.72 lakhs,(AICTE) All India Council of Technical Education,The candidate should have passed graduate degree from any recognized college/ University.,"The School of Business Management, Vivek Vardhini College had its inception in the year 2003. It is the newest entrant to the Vivek Vardhini Education Society. It offers 3 specializations i.e Finance, HRM, Marketing and systems.(RDBMS,E- Business)"
