,College,City,State,Course,Duration,Study mode,Approved intake,Course level,Course Fee,Approval,Eligiblity,Course_Detail
0,"Maharaja Ranjit Singh College of Professional Sciences, Indore",Indore,Madhya Pradesh,BBA,3 years,Full time,,UG,0.75 lakhs,UGC,The candidate should have passed in 10+2 or its equivalent from any recognized Board / University,"It is a three year duration full-time course. Affiliated to Devi Ahilya Vishwavidyalaya , Indore"
1,"Maharaja Ranjit Singh College of Professional Sciences, Indore",Indore,Madhya Pradesh,MBA,2 years,Full time,,PG,1 lakh,UGC,Candidate Desirous of seeking admission in MBA programme should be a graduate in any discipline from a recognized university,"It is a two year duration full-time course. affiliated to Devi Ahilya Vishwavidyalaya , Indore"
2,"Maharaja Ranjit Singh College of Professional Sciences, Indore",Indore,Madhya Pradesh,MBA Financial Administration,2 years,Full time,,PG,1 lakh,UGC,Candidate Desirous of seeking admission in MBA programme should be a graduate in any discipline from a recognized university,"It is a two year duration full-time course. affiliated to Devi Ahilya Vishwavidyalaya , Indore"
3,"Aurora's Degree College, Hyderabad",Hyderabad,Telangana,BBA,3 years,Full time,,UG,,UGC,"Candidates who have passed the intermediate public examination conducted by the Board of Intermediate Education AP, or any other examination recognized as equivalent there to with any group with aggregate marks prescribed by the university are eligible for admission into BBA I Year course.",BBA - is a three year undergraduate program affiliated to Osmania University.
4,"MAEER's Arts Commerce and Science College, Pune",Pune,Maharashtra,PG Diploma in International Business,1 year,Full time,,PG,,,Bachelors Degree in any stream from any statutory University or Foreign University with 50% marks 45% in case of reserved category candidate,This is a one to two year full time course
5,"Indian Institute for Production Management, Kansbahal",Kansbahal,Odisha,BBA,3 years,Full time,,UG,,,Pass in +2 Arts / Science / Commerce. Candidates appearing for final year +2 examinations /awaiting results are also eligible.,"It is three year duration full-time course. Bachelor in Business Administration, a three year full time programme was started in the year 2015 with affiliation from Sambalpur University and approved by Department of Higher Education, Odisha. The Course emphasises the various disciplines of management studies such as Finance, Marketing, HR and IT which formulates the b...See More"
6,"Indian Institute for Production Management, Kansbahal",Kansbahal,Odisha,MBA,2 years,Full time,60,PG,1.9 lakhs,,Pass in Graduation with a Minimum Mark of 50% (45 % in case of SC / ST) with a valid score in any Entrance Examination (OJEE / CAT / XAT / MAT / CMAT / ATMA). Candidates appearing for final year degree examinations /awaiting results are also eligible.,"Master of Business Management it is two years PG Course. The MBA programmes at IIPM, Kansbhal take a long-term view of business education and prepare students for long and fulfilling careers. We provide multi-disciplinary, application based curriculum which Enhance life skills and practical knowledge that allows Student to create innovators, thought-leaders, and entre...See More"
7,"Indian Institute for Production Management, Kansbahal",Kansbahal,Odisha,MBA Financial Management,2 years,Full time,,PG,,,Pass in Graduation with a Minimum Mark of 45% (40 % in case of SC / ST). Candidates appearing for final year degree examinations /awaiting results are also eligible.,It is two year duration full-time course.
8,"Indian Institute for Production Management, Kansbahal",Kansbahal,Odisha,PGDM,2 years,Full time,,PG,,,Pass in Graduation with a Minimum Mark of 50% or a valid score in any Entrance Examination (OJEE / CAT / XAT / MAT / CMAT / ATMA). Candidates appearing for final year degree examinations /awaiting results are also eligible.,"Post‐Graduate DiplomaManagement is two years full-time course.
PGDM is one of the sought after programme of Indian Institute of Production Management, Kansbahal. It is widely acclaimed for its strong curriculum in the industry and academic circles. It is designed not only to impart the knowledge of core subjects such as Accounting, Economics, Finance and Marketing ...See More"
9,"Bharatesh Education Society's Global Business School, Belgaum",Belagavi,Karnataka,MBA,2 years,Full time,60,PG,3.2 lakhs,(AICTE) All India Council of Technical Education,Candidate Desirous of seeking admission in MBA programme should be a graduate in any discipline from a recognized university,"This is a full time two year course. the course is approved by AICTE, Affiliated to Rani Channamma University, Belagavi"
10,"GH Raisoni College of Commerce Science and Technology, Nagpur",Nagpur,Maharashtra,BBA,3 years,Full time,,UG,,,An intermediate certificate of std. XII with Arts/Science/Commerce from a recognized institution of higher education in India or equivalent thereof from foreign system,It is 3-year duration full-time course.
11,"PDEA's College of Engineering, Pune",Pune,Maharashtra,MBA,2 years,Full time,60,PG,1.73 lakhs,(AICTE) All India Council of Technical Education,The candidate should have Graduation degree from any recognized University.,"Master of Business Administration is two-year duration full-time course affiliated to Savitribai Phule Pune University, Pune and approved by All India Council for Technical Education."
12,"Doon PG college of Agriculture Science and Technology, Dehradun",Dehradun,Uttarakhand,B. Sc Forestry,4 years,Full time,60,UG,,UGC,The candidate should have passed 10+2 (P.C.B. / P.C.M.) or equivalent with 45% marks.,This is a 4-year full-time programme divided into two Semesters in the academic year.
13,"Doon PG college of Agriculture Science and Technology, Dehradun",Dehradun,Uttarakhand,BBA,3 years,Full time,60,UG,,UGC,The candidate should have passed 10+2 with 45% marks.,This is a three-year full-time programme divided into two Semesters in the academic year.
14,"Doon PG college of Agriculture Science and Technology, Dehradun",Dehradun,Uttarakhand,M. Sc Forestry,2 years,Full time,30,PG,,UGC,"The candidate should have passed B.Sc. (Forestry), B.Sc. (C.B.Z.) or equivalent with 50% marks.",This is a two-year full-time programme divided into two Semesters in the academic year.
15,"Doon PG college of Agriculture Science and Technology, Dehradun",Dehradun,Uttarakhand,MIB,2 years,Full time,60,PG,,UGC,The candidate should have passed Graduate from any stream with 50% marks.,Master of International Business is a two-year full-time programme divided into two Semesters in the academic year.
16,"Seshadripuram College, Bengaluru",Bengaluru,Karnataka,BBA,3 years,Full time,,UG,,,12th Pass from any recognized board or equivalent.,The aim of the department of Business Management is to create a stimulating and challenging atmosphere for students to hone their management skills in order to become dynamic leaders in the business world. The faculty members are not only well qualified but also have immense practical knowledge about the inner workings of a business enterprise. And this makes them pro...See More
17,"Christian Eminent College, Indore",Indore,Madhya Pradesh,BBA,3 years,Full time,,UG,,UGC,Higher Secondary(10+2) Certificate Examination of M.P. Board or its equivalent Examination.,It is 3 year full time course.
18,"Christian Eminent College, Indore",Indore,Madhya Pradesh,BBA Foreign Trade,3 years,Full time,,UG,,UGC,Higher Secondary(10+2) Certificate Examination of any discipline of M.P. Board or its equivalent Examination.,It is 3 year full time course.
19,"Sunstone Business School, Bangalore",Bengaluru,Karnataka,Post Graduate Program Management,1 year,Full time,,PG,,,Minimum of 3 years of work experience after graduation in technology and related areas.,"Sunstone Program is divided into 3 levels of 4-months duration. After successful evaluation during admission process, students can register for PGPM Level 1 Once you successfully clear Level 1, you become eligible for advanced levels- PGPM Level 2 and Level 3. You are allowed to take breaks after completing any level. Students will receive certificates after completin...See More"
20,"SDJ International College, Surat",Surat,Gujarat,BBA,3 years,Full time,140,UG,,UGC,The candidate should have passed in 10+2.,The 3-year Bachelor of Business Administration (BBA) Program is distributed over six semesters.
21,"Government Mohindra College, Patiala",Patiala,Punjab,BBA,3 years,Full time,50,UG,,UGC,The candidate should have passed in 10+2 in any stream.,"This is a full time three year course affiliated to Panjab University, Chandigarh and approved by UGC."
22,"Amity University, Raipur",Kharora,Chhattisgarh,MBA,2 years,Full time,,PG,3.76 lakhs,UGC,"Graduation (min 50%) and MAT- 550, CAT/XAT - 80 percentile, NMAT 65 percentile, GMAT - 500 Or Amity Written Test",It is 2 year full time course.
23,"Aurora's Technological and Management Academy, Hyderabad",Ghatkesar,Telangana,MBA,2 years,Full time,60,PG,0.54 lakhs,(AICTE) All India Council of Technical Education,"A candidate seeking admission into Two years MBA program must satisfy the following criteria:
A pass in bachelor's degree in any field with 45% marks in aggregate.
Must have qualified in Integrated Common Entrance Test (ICET) conducted by TS State Council of Higher Education, Govt of AP.
The candidates should satisfy local/non-local status requirement as laid down in the TS Educational institutions (Regulation of Admissions) Order 1974 as amended from time to time.
The candidates will be admitted strictly in accordance with the merit secured at the ICET.
The Management admits the remaining 30% under Management and NRI quota",Masters in Business Administration offered By Jawaharlal Nehru Technological University Hyderabad Approved By All India Council of Technical Education is a two year full time course
24,"Nalanda College, Biharsharif",Bihar Sharif,Bihar,BBM,3 years,Full time,,UG,,UGC,The candidates who have passed the intermediate/+2 examination or equivalent exam in any discipline are eligible to apply. Appearing candidates may also apply and take the entrance examination. But they must produce their marks card in original at the time of admission.,"Management is an important economic category which has become the magic mantra of the present day corporate world. In the technological phases of capitalism, management has been accorded the place of pride and prominence to cope with the pulls and pressures of the market economy and to help steer safely the corporate ship in the turbulent waters of global owned the ca...See More"
25,"Nalanda College, Biharsharif",Bihar Sharif,Bihar,MBA,2 years,Full time,60,PG,1.26 lakhs,(AICTE) All India Council of Technical Education,"A three year Bachelor’s degree (12+2+3) or equivalent degree in any discipline from a recognized University is the eligibility criteria for Post-graduate studies with a minimum of 45% aggregate marks. Candidates appearing for the final examination of a qualifying bachelor’s degree can also apply. Such candidates, if selected, will be admitted provided they produce evidence of having minimum eligibility requirement on the day of admission, failing which their right of admission to the MBA programme would stand forfeited. In special case they may be admitted provisionally unless they submit the eligibility requirement and that too within stipulated time failing which their admission will be cancelled and no amount deposited will be refunded. If any student by mistake is admitted or fraudulently seeks admission with less than 45% of marks at degree level, his admission will be cancelled when detected and no amount will be refunded.","M.B.A. is a prestigious study programme which is drawing large number of highly talented youth from diverse sections of society. The demand for management professionals is growing at a very fast pace, right from agriculture to manufacture and in the multiple areas of trade and marketing in corporate sector as well as in non-corporate sector. Perhaps there is no area o...See More"
26,"Indira Gandhi Institute of Co Operative Management, Lucknow",Lucknow,Uttar Pradesh,MBA,2 years,Full time,60,PG,0.7 lakhs,(AICTE) All India Council of Technical Education,Pass or appeared in the Bachelor's Degree Examination of three years duration in any discipline OF A University and clearded entrance test conducted by U.P. Technical University for MBA Class. Eligible candidates are required to appear at UPTUSEE for the respective year and admission will be made on the basis of merit list drawn as per UPTUSEE.,"IGICM offers a two-year Master of Business Administration (MBA) course from the year 2004. IGICM seeks to mould its young students who come from different academic backgrounds and with diverse skills in to competent professionals of tomorrow. The MBA course has been recognised by the ALL India Council for Technical Education (AICTE), Government of India and affiliated...See More"
27,"College of Commerce, Patna",Patna,Bihar,BBM,3 years,Full time,,UG,,UGC,The candidate should have passed in 10+2 with the relevant subject.,"This is a full time three year course affiliated to Magadh University, Bodhgaya."
28,"College of Commerce, Patna",Patna,Bihar,MBA,2 years,Full time,,PG,,UGC,Graduate With atleast 50% marks and CAT/MAT/CMT valid score.,"This is a full time two year course affiliated to Magadh University, Bodhgaya."
29,"National Academy of Agricultural Research Management, Hyderabad",Hyderabad,Telangana,PGD Management Agriculture,2 years,Full time,60,PG,11.27 lakhs,"Indian Council of Agricultural Research, New Delhi","The candidate should have passed in Post Graduate in Agriculture/Social Sciences/Physical Sciences/Management/Life
Sciences/ Engineering/Law",PGDMA is a 2 year full time course.
30,"National Academy of Agricultural Research Management, Hyderabad",Hyderabad,Telangana,PGDT Management Agriculture,1 year,Full time,,PG,,"Indian Council of Agricultural Research, New Delhi","The candidate should have passed in Post Graduate in Agriculture/Social Sciences/Physical Sciences/Management/Life
Sciences/ Engineering/Law
or
Graduate in Agriculture/Social Sciences/Physical Sciences/Management/Life Sciences/
Engineering/ Law with two years work experience",Post Graduate Diploma in Technology Management in Agriculture (PGDTMA) of one year Duration 2 semesters in distance mode in course in collaboration with University of Hyderabad Offered By University of Hyderabad Appproved By All India Council for Technical Education And Indian Council of Agricultural Research
31,"London Management Academy, Hyderabad",Hyderabad,Telangana,BBA,3 years,Full time,,UG,,,The candidate should have passed in 10+2 any stream,BBA is a 3 year full time course.
32,"London Management Academy, Hyderabad",Hyderabad,Telangana,MBA,2 years,Full time,120,PG,0.54 lakhs,(AICTE) All India Council of Technical Education,The candidate should have passed in any graduate degree,MBA is a 2 year full time course.
33,"London Management Academy, Hyderabad",Hyderabad,Telangana,PGDM,2 years,Full time,120,PG,0.6 lakhs,,The candidate should have passed in graduate degree,"PGDM is a 2 year full time course in Human Resource Management
Marketing
Finance
International Business"
34,"RVS Institute of Management Studies and Research, Coimbatore",Sulur,Tamil Nadu,MBA,2 years,Full time,120,PG,4 lakhs,(AICTE) All India Council of Technical Education,"Selection is based on XAT / CAT/ MAT score. Graduates from any discipline can apply if they have a minimum of 50 percentile score in CAT or MAT. Graduates who have not taken up any entrance examinations specified above can take RVS Entrance Exam. Minimum 50% average marks in 10th, 12th and UG Degree is required",
35,"SRM Arts and Science College, Kanchipuram",Kanchipuram,Tamil Nadu,MBA,2 years,Full time,60,PG,0.6 lakhs,(AICTE) All India Council of Technical Education,The candidate should have graduate degree,MBA is a 2 year full time course.
36,"University Department of Management Science, Dr Babasaheb Ambedkar Marathwada University, Aurangabad",Aurangabad,Maharashtra,MBA,2 years,Full time,60,PG,,(AICTE) All India Council of Technical Education,The candidate should have Graduation degree from any recognized University.,"Master of Business Administration is two-years duration full-time course affiliated to Dr. Babasaheb Ambedkar Marathwada University, Aurangabad."
37,"University Department of Management Science, Dr Babasaheb Ambedkar Marathwada University, Aurangabad",Aurangabad,Maharashtra,MBA Evening,3 years,Full time,60,PG,,,The candidate should have Graduation degree from any recognized University.,"Master of Business Administration Evening is three-years duration full-time course affiliated to Dr. Babasaheb Ambedkar Marathwada University, Aurangabad."
38,"University Department of Management Science, Dr Babasaheb Ambedkar Marathwada University, Aurangabad",Aurangabad,Maharashtra,Post Graduate Diploma in Health Services Management,1 year,Full time,40,PG,,,The candidate should have Graduation degree from any recognized University.,"Post Graduate Diploma in Health Services Management is one-year duration full-time course affiliated to Dr. Babasaheb Ambedkar Marathwada University, Aurangabad."
39,"University Department of Management Science, Dr Babasaheb Ambedkar Marathwada University, Aurangabad",Aurangabad,Maharashtra,Post Graduate Diploma in Human Resource Management,1 year,Full time,30,PG,,,The candidate should have Graduation degree from any recognized University.,"Post Graduate Diploma in Human Resource Management is one-year duration full-time course affiliated to Dr. Babasaheb Ambedkar Marathwada University, Aurangabad."
40,"University Department of Management Science, Dr Babasaheb Ambedkar Marathwada University, Aurangabad",Aurangabad,Maharashtra,Post Graduate Diploma in Retail Management,1 year,Full time,30,PG,,,The candidate should have Graduation degree from any recognized University.,"Post Graduate Diploma in Retail Management is one-year duration full-time course affiliated to Dr. Babasaheb Ambedkar Marathwada University, Aurangabad."
41,"Rajeev Gandhi College of Management Studies, Navi Mumbai",Navi Mumbai,Maharashtra,MMS,2 years,Full time,120,PG,1.04 lakhs,(AICTE) All India Council of Technical Education,"For Centralised Criteria Admission [as per DTE rules]:
(1) Passed with minimum of 50 % marks in aggregate [45 % in case of candidates of backward class categories belonging to Maharashtra State only] in any Bachelor's degree of minimum three years duration in any discipline, recognized by the Association of Indian Universities.
(2) Appeared for CET, GD & PI, conducted by the competent authority and secured non-zero score.
(3) For admissions under Management Seats, the eligibility is same as above. Admissions will be strictly on the basis of merit of the candidates.
(4) For the candidates outside Maharashtra state / J & K and under reserved quota, the rules are as prescribed by the Directorate of Technical Education.",MMS is a full time two year course offered By Mumbai University Approved By All India Council for Technical Education.
42,"Sir M Visvesvaraya Institute of Management Studies and Research, Mumbai",Mumbai,Maharashtra,MMS,2 years,Full time,60,PG,2.44 lakhs,(AICTE) All India Council of Technical Education,The candidate should have graduate degree with 50% marks.,Masters in Management studies is a 2 years Post graduate course.
43,"Sir M Visvesvaraya Institute of Management Studies and Research, Mumbai",Mumbai,Maharashtra,PGDEBM,2 years,Full time,,PG,,,The candidate should have graduate degree.,This is a full time two year course.
44,"RM Dhariwal Sinhgad Management School, Pune",Pune,Maharashtra,MBA,2 years,Full time,180,PG,1.84 lakhs,(AICTE) All India Council of Technical Education,"Graduate degree from any discipline with 50% marks or equivalent as per AIU / UGC / MHRD (45% for reserved category, Maharashtra State) and should have a valid score of Entrance Exam of CET / CAT / MAT / CMAT / GMAT / XAT / ATMA.","Master in Business Administration is two-year duration full-time course affiliated to Savitribai Phule Pune University, Pune and approved by All India Council for Technical Education. The following Specializations are available in MBA:
1. Marketing Management
2. Financial Management
3. Information Technology Management
4. Operations Management
5. Human Resource M...See More"
45,"RM Dhariwal Sinhgad Management School, Pune",Pune,Maharashtra,MBA II Shift,2 years,Full time,60,PG,1.84 lakhs,,"Graduate degree from any discipline with 50% marks or equivalent as per AIU / UGC / MHRD (45% for reserved category, Maharashtra State) and should have a valid score of Entrance Exam of CET / CAT / MAT / CMAT / GMAT / XAT / ATMA.","Master in Business Administration II Shift is two-year duration full-time course affiliated to Savitribai Phule Pune University, Pune."
46,"RM Dhariwal Sinhgad Management School, Pune",Pune,Maharashtra,PGDBM Part Time,2 years,Part Time,60,PG,,,"Graduate degree from any discipline with 50% marks or equivalent as per AIU / UGC / MHRD (45% for reserved category, Maharashtra State).","Post Graduate Diploma in Business Management is two-year duration Part-Time course affiliated to Savitribai Phule Pune University, Pune."
47,"RM Dhariwal Sinhgad Management School, Pune",Pune,Maharashtra,Post Graduate Diploma in Financial Services Part Time,1 year,Part Time,60,PG,,,"Graduate degree from any discipline with 50% marks or equivalent as per AIU / UGC / MHRD (45% for reserved category, Maharashtra State).","Post Graduate Diploma in Financial Services is one-year duration Part-Time course affiliated to Savitribai Phule Pune University, Pune."
48,"RM Dhariwal Sinhgad Management School, Pune",Pune,Maharashtra,Post Graduate Diploma in Foreign Trade Part Time,1 year,Part Time,60,PG,,,"Graduate degree from any discipline with 50% marks or equivalent as per AIU / UGC / MHRD (45% for reserved category, Maharashtra State).","Post Graduate Diploma in Foreign Trade is one-year duration Part-Time course affiliated to Savitribai Phule Pune University, Pune."
49,"RM Dhariwal Sinhgad Management School, Pune",Pune,Maharashtra,Post Graduate Diploma in Import Export Management Part Time,1 year,Part Time,60,PG,,,"Graduate degree from any discipline with 50% marks or equivalent as per AIU / UGC / MHRD (45% for reserved category, Maharashtra State).","Post Graduate Diploma in Import Export Management is one-year duration Part-Time course affiliated to Savitribai Phule Pune University, Pune."
50,"RM Dhariwal Sinhgad Management School, Pune",Pune,Maharashtra,Post Graduate Diploma in Marketing Management Part Time,1 year,Part Time,60,PG,,,"Graduate degree from any discipline with 50% marks or equivalent as per AIU / UGC / MHRD (45% for reserved category, Maharashtra State).","Post Graduate Diploma in Marketing Management is one-year duration Part-Time course affiliated to Savitribai Phule Pune University, Pune."
51,"RM Dhariwal Sinhgad Management School, Pune",Pune,Maharashtra,Post Graduate Diploma in Material and Logistics Management Part Time,1 year,Part Time,60,PG,,,"Graduate degree from any discipline with 50% marks or equivalent as per AIU / UGC / MHRD (45% for reserved category, Maharashtra State).","Post Graduate Diploma in Material and Logistics Management is one-year duration Part-Time course affiliated to Savitribai Phule Pune University, Pune."
52,"Maharashtra Institute of Management, Pune",Walchandnagar,Maharashtra,MBA,2 years,Full time,120,PG,1.4 lakhs,(AICTE) All India Council of Technical Education,Students seeking admission to MBA course of University of Pune must be a graduate in any discipline (minimum three years integrated degree course of a statutory University) with 50% mark (45% in case of students of backward castes belonging to Maharashtra state only). OR The candidate appeared for the final year of any bachelor degree (of a minimum of three years integrated degree course any statutory university) may be considered for provisional admission.,This is a two year full time Programme leading to a Master Degree in Management.
53,"SCS Autonomous College, Puri",Puri,Odisha,MBA,2 years,Full time,60,PG,0.9 lakhs,(AICTE) All India Council of Technical Education,The candidate should have passed Graduation in the concerned subject.,It is 2-year duration full-time course.
54,"Poona Institute of Management Sciences and Entrepreneurship, Pune",Pune,Maharashtra,MBA,2 years,Full time,120,PG,1.5 lakhs,(AICTE) All India Council of Technical Education,Passed with minimum of 50% marks in aggregate or equivalent CGPA in any Bachelor’s degree awarded by any of the Universities,MBA is a Two Years Full time (Each year consists of two semesters) & it affiliated by Savitribai Phule Pune University
55,"Poona Institute of Management Sciences and Entrepreneurship, Pune",Pune,Maharashtra,MBA Human Resource Development,2 years,Full time,60,PG,,(AICTE) All India Council of Technical Education,A students seeking admission to this course must have a Bachelor's degree of any statutory University or other recognised foreign university.,"The MBA-HRD programme is developed keeping in mind the changes in the practices of the industry, evolution in technology and the expectations of industry, students and faculty members at large.
Duration
Two Years Full time (Each year consists of two semesters)"
