,College,City,State,Course,Duration,Study mode,Approved intake,Course level,Course Fee,Approval,Eligiblity,Course_Detail
247,"Digboi College, Tinsukia",Borbil Gaon No.3,Assam,PGDCA,1 year,Full time,20,PG,,,Candidates who have passed the Bachelor Degree Course in any stream from any recognised University with at least 40% marks can apply for the admission into PGDCA course. Relaxation will be as per Govt. rules. Students appearing in the Bachelor's Degree Final Examination whose results have not yet been declared can also apply.,"Digboi College has introduced Post-Graduate Diploma in Computer Applications (PGDCA) course as a regular full time course of Dibrugarh University from the academic session 2013-14. Its academic session will begin from 16th July, 2014."
248,"Lahowal College, Dibrugarh",Lahowal,Assam,PGDCA,1 year,Full time,,PG,0.077 lakhs,,Graduation from any recognized university with relevant subjects.,"This is a full time one year course affiliated to Dibrugarh University, Dibrugarh."
249,"Amguri College, Sivasagar",Namti Bangali,Assam,BCA Self Financed,3 years,Full time,,UG,,,The candidate should have passed in 10+2 with the relevant subject.,"Bachelor of Computer Application is three years fulltime Self Financed course. This is affiliated to Dibrugarh University, Dibrugarh."
250,"Amguri College, Sivasagar",Namti Bangali,Assam,PGDCA Self Financed,1 year,Full time,,PG,,,The candidate should have passed in the relevant graduate degree.,"Post Graduate Diploma in Computer Application is one years fulltime Self Financed course. This is affiliated to Dibrugarh University, Dibrugarh."
251,"Sibsagar College, Sivasagar",Jula Goan,Assam,BCA Self Financed,3 years,Full time,,UG,,,10+2 with 45% marks in aggregate (40% for SC/ ST candidates) having passed in Mathematics or Statistics or Commercial Arithmetic and Statistics.,"Bachelor Computer Applications is a full-time three year course affiliated to Dibrugarh University, Dibrugarh."
252,"Sibsagar College, Sivasagar",Jula Goan,Assam,PGDCA,1 year,Full time,,PG,,,Graduate in any discipline with 40% marks in aggregate,"Post Graduate Diploma in Computer Applications is a full-time one year course affiliated to Dibrugarh University, Dibrugarh."
253,"Sibsagar Commerce College, Sivasagar",Deoulia Khat,Assam,BCA,3 years,Full time,,UG,,,The candidate should have passed in 10+2 with the relevant subject.,"Bachelor of Computer Application is 3 years fulltime course and affiliated to Dibrugarh University, Dibrugarh."
254,"Sibsagar Commerce College, Sivasagar",Deoulia Khat,Assam,PGDCA,1 year,Full time,,PG,,,The candidate should have passed in the relevant graduate degree.,"Post Graduate Diploma in Computer Applications is full time one year course and affiliated to Dibrugarh University, Dibrugarh."
255,"Swahid Peoli Phukan College, Namti",Namti Chariali,Assam,BCA,3 years,Distance,,UG,,,The candidate should have passed in 10+2 with the relevant subject.,"This is a full-time three year course affiliated to K.Krishna Kanta Handiqui State Open University.
This is a distance education programme."
256,"Maharaja Agrasen Mahavidyalaya, Bareilly",Bareilly,Uttar Pradesh,BCA,3 years,Full time,160,UG,0.6 lakhs,UGC,Intermediate pass with PCM Group securing at least 45% marks in aggregate and there should not be grace in mathematics.,"This is 3 years undergraduate course approved from UGC and affiliated to Mahatma Jyotiba Phule Rohilkhand University, Bareilly."
257,"Maharaja Agrasen Mahavidyalaya, Bareilly",Bareilly,Uttar Pradesh,PGDCA,1 year,Full time,40,PG,0.125 lakhs,UGC,Graduation passed in any stream with at least 45% marks.,"This is 1 year Post graduate course approved from UGC and affiliated to Mahatma Jyotiba Phule Rohilkhand University, Bareilly."
258,"Suraj Bhan Institute of Information Technology, Bareilly",Bareilly,Uttar Pradesh,BCA,3 years,Full time,,UG,,,The candidate should have passed Intermediate/10+2 (With Maths).,"This is three years full-time Bachelor Degree Programme and affiliated to Mahatma Jyotiba Phule Rohilkhand University, Bareilly."
259,"Suraj Bhan Institute of Information Technology, Bareilly",Bareilly,Uttar Pradesh,PGDCA,1 year,Full time,,PG,,,The candidate should have passed Graduation.,"This is One-year full-time Post Graduate Diploma Programme and affiliated to Mahatma Jyotiba Phule Rohilkhand University, Bareilly."
260,"Dharamveer Institute of Education and Technology, Bijnor",Bijnor,Uttar Pradesh,BCA,3 years,Full time,,UG,,UGC,The candidate should have passed in 10+2 with the relevant subject.,"This is a full time two year course affiliated to Mahatma Jyotiba Phule Rohilkhand University, Bareilly."
261,"Dharamveer Institute of Education and Technology, Bijnor",Bijnor,Uttar Pradesh,PGDCA,1 year,Full time,,PG,,UGC,Graduation from any Recognized university with relevant subjects.,"This is a full time one year course affiliated to Mahatma Jyotiba Phule Rohilkhand University, Bareilly."
262,"Government College, Safidon",Safidon,Haryana,BCA,3 years,Full time,,UG,,UGC,The candidate should have passed 10+2 science stream from any recognized college/ board.,"Bachelor of computer applications is a three-year full-time UG course offered by Kurukshetra University, Kurukshetra and Approved by UGC"
263,"CMK National PG Girls College, Sirsa",Sirsa,Haryana,BCA Self Finance,3 years,Full time,90,UG,0.5 lakhs,UGC,The candidate should have passed 10+2 any stream from any recognized college/ board.,"Bachelor of Computer Application is a three-year full-time UG Self Finance course offered by Chaudhary Devi Lal University, Sirsa and Approved by UGC"
264,"Guru Nanak Khalsa College, Yamuna Nagar",Yamuna Nagar,Haryana,B.Com Computer Application,3 years,Full time,,UG,,UGC,The candidate should have passed 10+2 any stream from any recognized college/ board.,"Bachelor of Commerce in Computer Application is a three-year full-time UG course offered by Kurukshetra University, Kurukshetra and Approved by UGC"
265,"Guru Nanak Khalsa College, Yamuna Nagar",Yamuna Nagar,Haryana,B.Sc Computer Application,3 years,Full time,,UG,,UGC,The candidate should have passed 10+2 science stream from any recognized college/ board.,"Bachelor of Science in Computer Application is a three-year full-time UG course offered by Kurukshetra University, Kurukshetra and Approved by UGC"
266,"Guru Nanak Khalsa College, Yamuna Nagar",Yamuna Nagar,Haryana,BCA Self Finance,3 years,Full time,,UG,,UGC,The candidate should have passed 10+2 any stream from any recognized college/ board.,"Bachelor of Computer Application is a three-year full-time UG Self Finance course offered by Kurukshetra University, Kurukshetra and Approved by UGC"
267,"DAV College for Girls, Yamunanagar",Yamuna Nagar,Haryana,B.Com Computer Application,3 years,Full time,,UG,0.376 lakhs,UGC,"a) A person who has passed any one of the following examinations with English as one of the subjects shall be eligible to join the first year of the Bachelor of Commerce Course.
b) Senior Secondary Certificate Examination (10+2 Standard) of Board of School Education, Haryana or an Examination recognized by the Academic Council as equivalent thereto with atleast 40% marks in the Commerce Group or 50% marks in Non-Commerce Group (Humanities & Science).","Bachelor of Commerce in Computer Application is a three-year full-time UG course offered by Kurukshetra University, Kurukshetra and Approved by UGC"
268,"DAV College for Girls, Yamunanagar",Yamuna Nagar,Haryana,B.Sc Computer Application,3 years,Full time,,UG,0.379 lakhs,UGC,"A candidate shall be eligible to join the first year of B.Sc., if she has passed Senior Certificate Examination (10+2 Standard) of Board of School Education, Haryana or its equivalent examinations thereto in Science Group with English as one of the subjects and has obtained at least 40% marks in aggregate﻿","Bachelor of Science in Computer Application is a three-year full-time UG course offered by Kurukshetra University, Kurukshetra and Approved by UGC"
269,"DAV College for Girls, Yamunanagar",Yamuna Nagar,Haryana,BCA,3 years,Full time,,UG,0.716 lakhs,UGC,"A person who has passed Senior Secondary Certificate Examination (10+2 Standard) of Board of School Education, Haryana or its equivalent examination with 50% marks in the aggregate having English and Mathematics as their subjects (five subjects) taken in 10+2 shall be eligible to join the first year of this course.﻿","Bachelor of Computer Application is a three-year full-time UG course offered by Kurukshetra University, Kurukshetra and Approved by UGC"
270,"DAV College for Girls, Yamunanagar",Yamuna Nagar,Haryana,PGDCA,1 year,Full time,,PG,0.224 lakhs,UGC,"A person who has passed Graduation from Kurukshetra University or an examination recognized as equivalent thereto shall be eligible to join any of these diploma courses.
Note : a) In case of SC/ST candidates minimum pass marks in the qualifying examination will be considered as minimum eligibility condition for admission to a particular course.
b) The candidates who are placed under compartment in B.A./B.Sc./B.Com. examination will not be allowed admission to Post-Graduate courses in any faculty.
c) Though the minimum percentage of marks fixed by the university is 45% marks, the admission will be on merit basis.","Post Graduate Diploma in Computer Application is a one year course offered by Kurukshetra University, Kurukshetra and approved by UGC"
271,"DAV College for Girls, Yamunanagar",Yamuna Nagar,Haryana,PGDCA II Shift,1 year,Full time,,PG,0.224 lakhs,UGC,"A person who has passed Graduation from Kurukshetra University or an examination recognized as equivalent thereto shall be eligible to join any of these diploma courses.
Note : a) In case of SC/ST candidates minimum pass marks in the qualifying examination will be considered as minimum eligibility condition for admission to a particular course.
b) The candidates who are placed under compartment in B.A./B.Sc./B.Com. examination will not be allowed admission to Post-Graduate courses in any faculty.
c) Though the minimum percentage of marks fixed by the university is 45% marks, the admission will be on merit basis.","Post Graduate Diploma in Computer Application is a one year course offered by Kurukshetra University, Kurukshetra,Under Evening shifts and approved by UGC"
272,"DAV College, Sadhaura",Saidupur,Haryana,BCA,3 years,Full time,,UG,,UGC,"Qualifying Examination passed: 10+2 Examination with 50% Marks of Haryana Board or equivalent as recognized by K. U. Kurukshetra.
English as one of the subjects in the qualifying Examination.
Mathematics as one of the subjects in the qualifying Examination.","Bachelor of Computer Application is a three year UG course approved by UGC. Subject Offered in Computer & Programming Fundamentals, PC Software, Computer-Oriented Numerical Methods etc…"
273,"DAV College, Sadhaura",Saidupur,Haryana,PGDCA,1 year,Full time,,PG,,UGC,Degree holders with minimum 40% marks.,"Post Graduate Diploma in Computer Application is a two year PG course approved by UGC. Subject Offers Computer Fundamentals
P.C. Software
Computer Networking
Data Structure
Software Engineering
Computer Organisation"""
274,"Hindu Girls College, Jagadhri",Jagadhri,Haryana,BCA,3 years,Full time,,UG,0.5388 lakhs,UGC,The candidate should have passed in 10+2 science stream.,"This is a full time three year course affiliated to Kurukshetra University, Kurukshetra and approved by UGC."
275,"Hindu Girls College, Jagadhri",Jagadhri,Haryana,PGDCA,1 year,Full time,,PG,0.1919 lakhs,UGC,Graduation from any recognized university with relevant subjects.,"This is a full time one year course affiliated to Kurukshetra University, Kurukshetra and approved by UGC."
276,"Fateh Chand College for Women, Hisar",Hisar,Haryana,BCA,3 years,Full time,20,UG,,UGC,"1)The state board of education, board or equivalent pass in 10 + 2 examination.2)The Central Board of Education passed the 10 + 2 in the class.","Bachelor of Computer Application is a three-year full-time UG course offered by Kurukshetra University, Kurukshetra and Approved by UGC"
277,"Raghunathpur College, Purulia",Raghunathpur,West Bengal,BCA,3 years,Full time,30,UG,,UGC,10+2 from any Recognized Board with relevant subjects.,This is a normally three years full time course.
278,"Debra Thana Sahid Kshudiram Smriti Mahavidyalaya, Debra",Paschim Medinipur,West Bengal,BCA,3 years,Full time,,UG,,UGC,10+2 from any Recognized Board with relevant subjects.,It is a three year full time course.
279,"Shah Satnam Ji PG Boys College, Sirsa",Sirsa,Haryana,BCA,3 years,Full time,80,UG,,,"Minimum qualification for BCA 10+2 with maths as on the subject ,the candidate must have secured 50% in Science/Commerce/Arts in Qualifying examination","Bachelor of Computer Application is a three-year full-time UG course offered by Chaudhary Devi Lal University, Sirsa"
280,"Don Bosco College, Golaghat",Singimari,Assam,PGD Computer Applications,1 year,Full time,,PG,0.19 lakhs,,The candidate should have passed graduation in any stream with at least 40% marks in aggregate.,"Post Graduate Diploma in Computer Applications is one year full time course and affiliated to Dibrugarh University, Dibrugarh."
281,"Dhemaji College, Dhemaji",Dhemaji,Assam,BCA,3 years,Full time,20,UG,,,The candidate should have passed 10+2 with relevant combination.,"Bachelor of Computer Applications is three years full time course and affiliated to Dibrugarh University, Dibrugarh."
282,"Dhemaji College, Dhemaji",Dhemaji,Assam,PGD Computer Applications,1 year,Full time,15,PG,0.16 lakhs,,The candidate should have passed graduation.,"Post Graduate Diploma in Computer Applications is three years full time course and affiliated to Dibrugarh University, Dibrugarh."
283,"Moridhal College, Dhemaji",Moridhal Ghat,Assam,PGD Computer Applications,1 year,Full time,,PG,,"Directorate of Higher Education, Government of Assam",The candidate should have passed graduation with relevant combination.,"Post Graduate Diploma in Computer Applications is one year full time course and affiliated to Dibrugarh University, Dibrugarh."
284,"Veena Memorial Degree College, Karauli",Kosra,Rajasthan,BCA,3 years,Full time,10,UG,,,The candidate should have passed in 10+2 any stream.,BCA is a three year full time course.
285,"LBS Academy, Kota",Kota,Rajasthan,BCA,3 years,Full time,,UG,,,The candidate should have passed in 10+2 any stream.,BCA is a three year full time course.
286,"LBS Academy, Kota",Kota,Rajasthan,PGDCA,1 year,Full time,,PG,,,The candidate should have passed in related graduate degree,PGDCA is a one year full time course.
287,"Seth Gyaniram Bansidhar Podar College, Jhunjhunu",Nawalgarh,Rajasthan,BCA,3 years,Full time,,UG,0.76 lakhs,,The candidate should have passed in 10+2 any stream.,BCA is a three year full time course.
288,"Government Degree College, Bhaderwah",Bhaderwah,Jammu and Kashmir,BCA,3 years,Full time,,UG,,UGC,The admission to courses BA/ B.Sc/B.Com/B.C.A. part- I shall be open to a person who has passed the higher secondary part-II examination (10+2) pattern of J&K; state Board of School education or an examination recognized as equivalent there to. Admission in BCA shall be made by entrance test through University of Jammu.,"Bachelor of Computer Application is a three-year full-time UG course offered by University of Jammu, Jammu and Approved by UGC"
289,"Bhupal Nobles Girls College, Udaipur",Udaipur,Rajasthan,BCA,3 years,Full time,,UG,,UGC,The candidate should have passed 10+2 any stream from any recognized college/ board.,"Bachelor of Computer Application is a three-year full-time UG course offered by Mohanlal Sukhadia University, Udaipur and Approved by UGC"
290,"New Look Girls PG College, Banswara",Banswara,Rajasthan,BCA,3 years,Full time,,UG,0.72 lakhs,,Any candidate who has passed HSC (10 + 2) exam from any stream with secured minimum 50% marks.,"BCA is a three-year full-time University Programme in Computer Application resulting in the award of Bachelor’s Degree in Computer Application.
The BCA Programme prepares you for a professional career in Computing and Information Technology. It gives you an in-depth knowledge of software engineering, information systems and the practical skills to apply this knowl...See More"
291,"New Look Girls PG College, Banswara",Banswara,Rajasthan,PGDCA,1 year,Full time,,PG,0.15 lakhs,,The candidate should have passed graduate degree from any recognized college/ University.,"Post Graduate Diploma in Computer Applications is one years full-time PG course offered by Mohanlal Sukhadia University, Udaipur"
292,"Bishop Ambrose College, Coimbatore",Coimbatore,Tamil Nadu,B.Com Computer Application,3 years,Full time,,UG,,,The candidate should have passed 10+2 or equivalent from any recognized board. Selection will be based as per the university norms.,"Bachelor of Commerce in Computer Application is a three-year full-time UG course offered by Bharathiar University, Coimbatore"
293,"Bishop Ambrose College, Coimbatore",Coimbatore,Tamil Nadu,BCA,3 years,Full time,,UG,,,The candidate should have passed 10+2 or equivalent from any recognized board. Selection will be based as per the university norms.,"Bachelor of Computer Application is a three-year full-time UG course offered by Bharathiar University, Coimbatore"
294,"Bishop Thorp College, Tiruppur",Tiruppur,Tamil Nadu,B.Com Computer Application,3 years,Full time,,UG,,,The candidate should have passed 10+2 any stream from any recognized college/ board.,"Bachelor of Commerce in Computer Application is a three-year full-time UG course offered by Bharathiar University, Coimbatore and Approved by UGC"
295,"Bishop Thorp College, Tiruppur",Tiruppur,Tamil Nadu,BCA,3 years,Full time,,UG,,,The candidate should have passed 10+2 any stream from any recognized college/ board.,"Bachelor of Computer Application is a three-year full-time UG course offered by Bharathiar University, Coimbatore and Approved by UGC"
296,"Cherran College for Women, Tirupur",Arasampalayam,Tamil Nadu,B.Com,3 years,Full time,,UG,0.48 lakhs,,The candidate should have passed 10+2 any stream from any recognized college/ board.,"Bachelor of Commerce Computer Application is a three-year full-time UG course offered by Bharathiar University, Coimbatore"
297,"Cherran College for Women, Tirupur",Arasampalayam,Tamil Nadu,BCA,3 years,Full time,,UG,0.48 lakhs,,The candidate should have passed 10+2 any stream from any recognized college/ board.,"Bachelor of Computer Application is a three-year full-time UG course offered by Bharathiar University, Coimbatore"
298,"Dr RANM Arts and Science College, Erode",Erode,Tamil Nadu,B.Com Computer Application,3 years,Full time,60,UG,,UGC,The candidate should have passed 10+2 any stream from any recognized college/ board.,"Bachelor of Commerce in Computer Application is a three-year full-time UG course offered byBharathiar University, Coimbatore, and Approved by UGC"
299,"Dr RANM Arts and Science College, Erode",Erode,Tamil Nadu,BCA,3 years,Full time,50,UG,,UGC,The candidate should have passed 10+2 any stream from any recognized college/ board.,"Bachelor of Computer Application is a three-year full-time UG course offered byBharathiar University, Coimbatore, and Approved by UGC"
300,"Pioneer College of Arts and Science, Coimbatore",Coimbatore,Tamil Nadu,BCA,3 years,Full time,120,UG,,UGC,The candidate should have passed 12th (35%),"Bachelor of Computer Application is a three-year full-time UG course offered by Bharathiar University, Coimbatore and Approved by UGC"
301,"Pioneer College of Arts and Science, Coimbatore",Coimbatore,Tamil Nadu,PGDCA,1 year,Full time,30,PG,,UGC,The candidate should have passed in Degree (40%),"Post Graduate Diploma in Computer Application is a one-year full-time course offered by Bharathiar University, Coimbatore and Approved by UGC"
302,"SAN International College of Arts and Science, Coimbatore",Pichanur,Tamil Nadu,BCA,3 years,Full time,,UG,0.9 lakhs,,The candidate should have passed in 10+2 any stream.,BCA is a three year full time course.
303,"SAN International College of Arts and Science, Coimbatore",Pichanur,Tamil Nadu,MCA,3 years,Full time,,PG,,,The candidate should have passed in related graduate degree,MCA is a three year full time course.
304,"Dream Valley College, Gwalior",Adupurajagir,Madhya Pradesh,BCA,3 years,Full time,,UG,,UGC,The candidate should have passed 10+2 any stream from any recognized college/ board.,"BCA can very well serve as an open sesame to brilliant professional career in IT. The students who dream to bloom in a successful IT professional are most welcome to kick start their career here at Dream Valley College which offer to its students BCA with a global. It is designed for student who are interested in pursuing rewarding careers in foundational courses, lat...See More"
305,"Dream Valley College, Gwalior",Adupurajagir,Madhya Pradesh,PGDCA,1 year,Full time,,PG,,UGC,The candidate should have passed graduate degree with the related subject from any recognized college/ University.,The objective of this programme is to develop system programmers and analysts to meet the manpower requirement of fast developing software industry. The programme is designed to enrich the programming and analysis ability of students. This programme imparts skills in software development and gives an opportunity for any graduates to become computer professionals.
306,"GR College for Professional Studies, Gwalior",Baraua Nurabad,Madhya Pradesh,B.Com Computer Application,3 years,Full time,,UG,,,The candidate should have passed 10+2 any stream from any recognized college/ board.,"Bachelor of Commerce in Computer Application is three years full time course offered by Jiwaji University, Gwalior"
307,"GR College for Professional Studies, Gwalior",Baraua Nurabad,Madhya Pradesh,BCA,3 years,Full time,,UG,,,The candidate should have passed 10+2 any stream from any recognized college/ board.,"Bachelor of Computer Application is a three-year full-time UG course offered by Jiwaji University, Gwalior"
308,"Parvatibai Gokhale Vigyan Mahavidyalaya, Gwalior",Gwalior,Madhya Pradesh,BCA,3 years,Full time,80,UG,,,The candidate should have passed in 10+2 any stream.,BCA is a 3 year full time course.
309,"VIPS College, Gwalior",Baraua,Madhya Pradesh,BCA,3 years,Full time,,UG,,,Minimum Education Qualification for admission is Higher Secondary 10+2 or equivalent examination with 50% Marks in Science or math Candidate belongs to SC/ST Category 5% relaxation in Higher Secondary10+2 Marks,BCA is a three year full time course.
310,"VIPS College, Gwalior",Baraua,Madhya Pradesh,PGDCA,1 year,Full time,,PG,,,Minimun Education Qualification for admission is Graduation or equivalent examination with 50% in any discipline Maximum age limit is 26 years Candidate belongs to SC/ST/OBC Category 5% relaxation in Graduation Marks,PGDCA is a one year full time course.
311,"Ambah PG College, Morena",Ambah,Madhya Pradesh,BCA,3 years,Full time,,UG,,,The candidate should have passed in 10+2 any stream.,BCA is a 3 year full time course.
312,"Ambah PG College, Morena",Ambah,Madhya Pradesh,PGDCA,1 year,Full time,,PG,,,The candidate should have passed in related graduate degree,PGDCA is a 1 year full time course.
