,College,City,State,Course,Duration,Study mode,Approved intake,Course level,Course Fee,Approval,Eligiblity,Course_Detail
0,"BVM Holy Cross College, Kottayam",Cherppunkal,Kerala,BCA,3 years,Full time,60,UG,,,"Candidate shall be required to have passed the Plus Two / VHSE/ or equivalent examination with Physics, Chemistry, Mathematics or
Computer Science as optional subjects.","Bachelor of Computer Application is three years full time course and affiliated to Mahatma Gandhi University, Kottayam."
1,"Bishop Speechly College for Advanced Studies, Pallom",Pallom,Kerala,BCA,3 years,Full time,40,UG,,,The candidate should have passed 10+2 level with related combination.,"Bachelor of Computer Applications is three years full time course and affiliated to Mahatma Gandhi University, Kottayam."
2,"Ettumanoorappan College, Kottayam",Ettumanoor,Kerala,BCA,3 years,Full time,60,UG,,,Candidates shall be required to have passed the Plus TWO/ equivalent examination in Science Stream with Mathematics/Computer Science as compulsory subjects.,"Bachelor of Computer Applications is three years full time course and affiliated to Mahatma Gandhi University, Kottayam."
3,"MES College, Erattupetta",Thidanad,Kerala,BCA,3 years,Full time,,UG,,,A pass in Plus Two or equivalent in science stream with Mathematics/Computer Science as optional.,"Bachelor of Computer Application is three years full time course and affiliated to Mahatma Gandhi University, Kottayam."
4,"Mar Kuriakose Arts and Science College, Kottayam",Marangattupilly,Kerala,BCA,3 years,Full time,30,UG,,Government of Kerala,"The candidate should have passed plus two or equivalent examination with Physics, Chemistry and Computer Science or Mathematics.","Bachelor of Computer Applications is three years full time course. Affiliated to Mahatma Gandhi University, Kottayam."
5,"MC Varghese College of Arts and Science, Kottayam",Ettumanoor,Kerala,BCA,3 years,Full time,40,PG,,State Government,The candidate should have passed 10+2 level with related combination.,"Bachelor of Computer Applications is three years full time course and affiliated to Mahatma Gandhi University, Kottayam."
6,"MES College, Erumeli",Erumeli South,Kerala,BCA,3 years,Full time,60,UG,,,"A pass in +2, VHSE or equivalent exam with physics, Chemistry and Maths or Computer Science.","Bachelor of Computer Application is three years full time course and affiliated to Mahatma Gandhi University, Kottayam."
7,"PG Radhakrishnan Memorial Sree Narayana College, Kottayam",Kottayam,Kerala,BCA,3 years,Full time,40,UG,,,"A pass in Plus Two or equivalent examination with Physics, Chemistry, Maths/Computer Science as optional and candidates who have passed C.B.S.E class XVII examination with any of subjects Physics, Chemistry, Mathematics, Geology/Geography.","Bachelor of Computer Application is three years full time course and affiliated to Mahatma Gandhi University, Kottayam."
8,"Baselios Poulose II Catholicos College, Ernakulam",Piramadam,Kerala,BCA,3 years,Full time,,UG,0.03 lakhs,,The candidate should have passed in 10+2 any stream.,BCA is a 3 year full time course.
9,"Vasundhara kala mahavidyalaya, Solapur",Solapur,Maharashtra,BCA,3 years,Full time,,UG,,,The candidate should have passed in 10+2 any stream.,BCA is a 3 year full time course.
10,"CB Khedgi's Basaveshwar Science Raja Vijaysinh Commerce and Raja Jaysinh Arts College, Akkalkot",Akkalkot,Maharashtra,BCA,3 years,Full time,,UG,,,The candidate should have passed in 10+2 any stream.,BCA is a 3 year full time course.
11,"Baselios Poulose Second College, Ernakulam",Piramadam,Kerala,BCA,3 years,Full time,30,UG,,UGC,The candidate should have passed in 10+2 with the relevant subject.,"This is a full-time three-year course affiliated to Mahatma Gandhi University, Kottayam and approved by UGC."
12,"Presentation College of Applied Sciences, Ernakulam",Puthenvelikara,Kerala,B.Com Computer Application,3 years,Full time,60,UG,,,The candidate should have passed in 10+2 with the relevant subject.,"This is a full-time three-year course affiliated to Mahatma Gandhi University, Kottayam."
13,"Presentation College of Applied Sciences, Ernakulam",Puthenvelikara,Kerala,BCA,3 years,Full time,30,UG,,,The candidate should have passed in 10+2 with the relevant subject.,"This is a full-time three-year course affiliated to Mahatma Gandhi University, Kottayam."
14,"ILM College of Arts and Sciences, Ernakulam",Rayamangalam,Kerala,BCA,3 years,Full time,30,UG,,UGC,The candidate should have passed in 10+2 with the relevant subject.,"Bachelor of Computer Application self Financing is three years in full-time course affiliated by Mahatma Gandhi University,Kottayam and approved by UGC."
15,"Mar Elias College, Kothamangalam",Kottappady,Kerala,BCA,3 years,Full time,40,UG,,,The candidate should have passed in 10+2 with the relevant subject.,"Bachelor of Computer Application is three years in full-time course affiliated to Mahatma Gandhi University, Kottayam."
16,"Mar Gregorios Abdul Jaleel Arts and Science College, North Paravur",Mannam,Kerala,BCA,3 years,Full time,40,UG,,Government of Kerala,The candidate should have passed in 10+2 with the relevant subject.,"Bachelor of Computer Application is three years in full time affiliated by Mahatma GandhiUniversity ,Kottayam"
17,"Mount Carmel College, Ernakulam",Varappetty,Kerala,BCA,3 years,Full time,30,UG,,,The candidate should have passed in 10+2 with the relevant subject.,"Bachelor of Computer Applications is a three year UG course affiliated to Mahatma Gandhi University, Kottayam."
18,"Nirmala Arts and Science College, Ernakulam",Mulanthuruthy,Kerala,BCA,3 years,Full time,,UG,1.09 lakhs,,The candidate should have passed in 10+2 with the relevant subject.,"This is a full-time three-year course affiliated to Mahatma Gandhi University, Kottayam."
19,"Siena College of Professional Studies, Edacochin",Kochi,Kerala,BCA,3 years,Full time,60,UG,1.3 lakhs,,"A pass in Higher Secondary Exam (+2) or equivalent examination with Physics, Chemistry, Maths or Computer Science.","This is a full-time three-year course affiliated to Mahatma Gandhi University, Kottayam."
20,"SNGIST Arts and Science College, Ernakulam",Ernakulam,Kerala,BCA,3 years,Full time,,UG,1.18 lakhs,,The candidate should have passed in 10+2 with the relevant subject.,"This is a full-time three-year course affiliated to Mahatma Gandhi University, Kottayam."
21,"St Ann's College, Angamaly",Angamaly,Kerala,BCA,3 years,Full time,30,UG,1.12 lakhs,,"Candidates, with a pass in Plus Two or equivalent examination in Science stream with Mathematics/Computer Science as a compulsory subject are eligible to apply","This is a full-time three-year course affiliated to Mahatma Gandhi University, Kottayam."
22,"St Thomas Arts and Science College, Ernakulam",Kochi,Kerala,BCA,3 years,Full time,40,UG,,,"Candidates who have passed the following examinations should produce eligibility certificate from the respective authorities:
(a) HSC Examination of Kerala Government (Private Study).
(b) Private candidates from the CBSE under the Open School System.
(c) Higher Secondary or equivalent examination conducted by other State Boards in India.","This is a full-time three-year course affiliated to Mahatma Gandhi University, Kottayam."
23,"Catholicate College, Pathanamthitta",Pathanamthitta,Kerala,BCA,3 years,Full time,30,UG,,UGC,The candidate should have passed in 10+2 with the relevant subject.,"This is a full-time three-year course affiliated to Mahatma Gandhi University, Kottayam and approved by UGC."
24,"Sree Narayana Guru Memorial Arts and Science College, Alappuzha",Thuravoor Thekku,Kerala,B.Com Commerce with Computer Application,3 years,Full time,,UG,,UGC,A pass in the Higher Secondary or any other Examination accepted by the University as equivalent thereto with any subject combination.,"It is 3 year full time course with affiliation of University of Kerala,Thiruvananthapuram and approved by UGC."
25,"Sree Narayana Guru Memorial Arts and Science College, Alappuzha",Thuravoor Thekku,Kerala,BCA,3 years,Full time,,UG,,UGC,A pass in the HSE/Technical Higher Secondary/Vocational Higher Secondary Examination of Govt.of Kerala or CBSE or ICSE or Pre Degree Examination of the University of Kerala or any other examination recognised as equivalent there to by the University of Kerala with Mathematics as one of the optional subjects.,"It is 3 year full time course with affiliation of University of Kerala,Thiruvananthapuram and approved by UGC."
26,"Shriman Bhausaheb Zadbuke Mahavidyalaya, Barshi",Barshi,Maharashtra,BCA,3 years,Full time,180,UG,,,The candidate should have passed in 10+2 any stream.,BCA is a 3 year full time course.
27,"Shriram Institute of Information Technology, Paniv",Paniv,Maharashtra,BCA,3 years,Full time,,UG,,,The candidate should have passed in 10+2 any stream.,BCA is a 3 year full time course.
28,"Sangola College, Sangola",Kedarwadi,Maharashtra,BCA,3 years,Full time,,UG,,UGC,12th pass out and Solapur university CET.,"It is 3-year duration full-time course approved by UGC and affiliated to Solapur University, Solapur."
29,"Sangola College, Sangola",Kedarwadi,Maharashtra,MCA,3 years,Full time,,PG,,UGC,Graduate (B.C.A / B.Sc(ECS)) pass out and Solapur university CET.,"It is 3-year duration full-time course approved by UGC and affiliated to Solapur University, Solapur."
30,"Vidyan Mahavidyalaya, Sangola",Sangola,Maharashtra,BCA,3 years,Full time,,UG,0.557 lakhs,UGC,"H. Sc. Pass with minimum 35% from Science, Arts, Commerce or any + 2 (Vocational Courses).","It is 3-year duration full-time course approved by UGC and affiliated to Solapur University, Solapur."
31,"Vidyan Mahavidyalaya, Sangola",Sangola,Maharashtra,MCA,3 years,Full time,,PG,0.718 lakhs,UGC,Candidate should have Any Graduate degree.,"It is 3-year duration full-time course approved by UGC and affiliated to Solapur University, Solapur."
32,"Parumala Mar Gregorios College, Thiruvalla",Kadapra,Kerala,BCA,3 years,Full time,40,UG,,,A pass in plus two or any other equivalent Examinations in science stream with mathematics / computer Science as a compulsory subject.,"Bachelor of Computer Application is three years full time course and affiliated to Mahatma Gandhi University, Kottayam."
33,"Al Azhar College of Arts and Science, Idukki",Idukki,Kerala,BCA,3 years,Full time,,UG,,,The candidate should have passed in 10+2 any stream,BCA is a three year full time course
34,"Mar Sleeva College of Arts and Science, Idukki",Vathikudy,Kerala,BCA,3 years,Full time,30,UG,,,The candidate should have passed 10+2 level with related combination.,"Bachelor of Computer Application is three years full time course and affiliated to Mahatma Gandhi University, Kottayam."
35,"Sanjo College, Rajakkad",Valiya Mullakkanam,Kerala,BCA,3 years,Full time,30,UG,,Government of Kerala,"Eligibility for admission to BCA degree course is a pass in Pre-degree, Plus Two or equivalent examinations in science stream with Mathematics/Computer science as optional. Candidates who have passed CBSE class XII examination with the subjects English, Physics, Chemistry, Biology and Informatics Practices are also eligible to apply.","Bachelor of Computer Application is three years full time course and affiliated to Mahatma Gandhi University, Kottayam."
36,"St Antony's College, Kanjirappally",Kanjirappally,Kerala,BCA,3 years,Full time,40,UG,,,The candidate should have passed 10+2 level with related combination.,"Bachelor of Computer Application is three years full time course and affiliated to Mahatma Gandhi University, Kottayam."
37,"St Aloysius College, Alappuzha",Kuttanad Taluk,Kerala,PGDCA,2 years,Full time,,PG,,,The candidate should have passed graduation.,"Post Graduate Diploma in Computer Applications is two years full time course and affiliated to Mahatma Gandhi University, Kottayam."
38,"Fr Porukara CMI College of Advanced Studies, Alappuzha",Kuttanad Taluk,Kerala,BCA,3 years,Full time,30,UG,,,"The candidate should have passed 10+2 or equivalent in Chemistry, Physics and Mathematics / Computer Science as optional.","Bachelor of Computer Application is three years full time course and affiliated to Mahatma Gandhi University, Kottayam."
39,"St Mary's College, Sulthan Bathery",Sultan Bathery,Kerala,BCA,3 years,Full time,24,UG,0.11 lakhs,,The candidate should have passed 10+2 with related combination.,"Bachelor of Computer Application is three years full time course and affiliated to University of Calicut, Malappuram."
40,"Janta Vidya Mandir Ganpat Rai Rasiwasia PG College, Bhiwani",Charkhi Dadri,Haryana,BCA Self Finance,3 years,Full time,60,UG,,UGC,Senior Secondary Examination (10+2) passed of Board School Education Haryana. Bhiwani or an equivalent examination recognized by this Board.,CA is a three full time degree programme. This course ensures the development of technical graduates in the information technology world. The BCA qualifiers can appear for the exam of MCA or Master of Computer Science. Students can also join any private sector as well as public sector organization with BCA degree.
41,"Banwari Lal Jindal Suiwala College, Bhiwani",Tosham,Haryana,BCA,3 years,Full time,40,UG,,UGC,12th Pass from any recognized board or equivalent.,"It is 3 year full time course with affiliation of Maharshi Dayanand University, Rohtak and approved by UGC."
42,"Mahila Mahavidyalaya, Jhojhu Kalan",Jhojhu Khurd,Haryana,BCA,3 years,Full time,30,UG,,UGC,"A candidate who has passed + 2 examination from any recognized Board/University in India the equivalence of which is recognized by Maharishi Dayanand University is eligible for admission to the 1st year of BA degree course if she has obtained 33% marks in the aggregate of the qualifying examination.
Candidates who have passed + 2 examination from the recognized Open Schools are eligible for admission to B.A.1st year course only if their result is shown as ""Pass"" in their certificate issued by the said Open Schools and they have obtained the equisite percentage of marks prescribed under the University Regulations for admission to the concerned course. In case their result has not been shown as ""Pass"" in the relevant column of the said certificate, they being ineligible will not be admitted.","It is 3 year full time course with affiliation of Maharishi Dayanand University, Rohtak and approved by UGC."
43,"Maa Omwati Degree College, Palwal",Kushak,Haryana,B.Com Computer Applications,3 years,Full time,120,UG,,UGC,10+2 or equivalent along with 40% marks,"It is 3 year full time course with affiliation of Maharshi Dayanand University, Rohtak and approved by UGC."
44,"Maa Omwati Degree College, Palwal",Kushak,Haryana,BCA,3 years,Full time,120,UG,,UGC,Students who have passed 10+2 examination. In case of Sc categories candidates who have secured the minimum pass marks in qualifying examination.,"It is 3 year full time course with affiliation of Maharshi Dayanand University, Rohtak and approved by UGC."
45,"GGD SD College, Palwal",Palwal,Haryana,B.Com Computer Applications,3 years,Full time,,UG,,UGC,12th Pass from any recognized board or equivalent.,"It is 3 year full time course with affiliation of Maharshi Dayanand University, Rohtak and approved by UGC."
46,"GGD SD College, Palwal",Palwal,Haryana,BCA,3 years,Full time,180,UG,,UGC,12th Pass from any recognized board or equivalent.,"It is 3 year full time course with affiliation of Maharshi Dayanand University, Rohtak and approved by UGC."
47,"Goverment Post Graduate Nehru College, Jhajjar",Jhajjarrural,Haryana,BCA,3 years,Full time,80,UG,,UGC,"Senior Secondary Examination (10+2) of Board of School Education Haryana, Bhiwani with 45% marks in aggregate or an equivalent examination recognised by this University.
OR
Three years Diploma Course from Polytechnic (after 10th class ) or any other exam recognised as equivalent thereto by the State Board of Technical Education Haryana.","It is 3 year full time course with affiliation of Maharshi Dayanand University, Rohtak and approved by UGC."
48,"Vaish Arya Kanya Mahavidyalaya, Bahadurgarh",Bahadurgarh,Haryana,BCA,3 years,Full time,180,UG,,UGC,12th Pass from any recognized board or equivalent.,"It is 3 year full time course with affiliation of Maharshi Dayanand University, Rohtak and approved by UGC."
49,"Maharaja Agarsen PG College for Women, Jhajjar",Silani,Haryana,BCA,3 years,Full time,60,UG,,UGC,12th Pass from any recognized board or equivalent.,"It is 3 year full time course with affiliation of Maharshi Dayanand University, Rohtak and approved by UGC."
50,"Sh LN Hindu College, Rohtak",Rohtak,Haryana,BCA,3 years,Full time,240,UG,0.61 lakhs,UGC,The candidate should have passed in 10+2 with the relevant subject.,"This is a full time three year course affiliated to Maharshi Dayanand University, Rohtak and approved by UGC."
51,"Saini Co Education College, Rohtak",Rohtak,Haryana,BCA,3 years,Full time,60,UG,,,The candidate should have passed 10+2 any stream from any recognized college/ board.,"Bachelor of Computer Application is a three-year full-time UG course offered by Maharshi Dayanand University, Rohtak"
52,"Kishan Lal Public College, Rewari",Taorurural,Haryana,BCA Self Finance,3 years,Full time,120,UG,0.791 lakhs,UGC,"Senior Secondary Examination (10+2) of Board of School Education Haryana, Bhiwani with 45% marks in aggregate or an equivalent examination recognized by this University.
OR
Three years Diploma Course conducted by State Board of Technical Education OR any other examination recognized by the State Board of Technical Education as equivalent thereto.","Bachelor of Computer Application is 3 year Self Finance course offered by Maharishi Dayanand University, Rohtak and approved by UGC"
53,"Government College, Gohana",Sonepat,Haryana,BCA,3 years,Full time,60,UG,,UGC,The candidate should have passed 10+2 any stream from any recognized college/ board.,"Bachelor of Computer Application is a three-years full-time course offered by Maharishi Dayanand University, Rohtak and approved by UGC and accredited by NAAC""B+"""
54,"Hindu Girls College, Sonepat",Sonipat,Haryana,BCA,3 years,Full time,60,UG,,UGC,The candidate should have passed 10+2 any stream from any recognized college/ board.,"Bachelor of Computer Application is a three-year full-time UG course offered by Maharshi Dayanand University, Rohtak and Approved by UGC"
55,"Tika Ram PG Girls College, Sonepat",Sonipat,Haryana,BCA,3 years,Full time,60,UG,,UGC,The candidate should have passed 10+2 any stream from any recognized college/ board.,"Bachelor of Computer Application is a three-year full-time course offered by Maharishi Dayanand University, Rohtak approved by University Grants Commission"
56,"Tika Ram PG Girls College, Sonepat",Sonipat,Haryana,PGDCA,1 year,Full time,30,PG,,UGC,The candidate should have passed graduate degree with the related subject from any recognized college/ University.,"Post Graduate Diploma in Computer Application is a one full-time PG diploma course offered by Maharshi Dayanand University, Rohtak and Approved by UGC"
57,"Kanya Mahavidyalaya, Kharkhoda",Kharkhoda,Haryana,BCA,3 years,Full time,60,UG,,UGC,The candidate should have passed in 10+2 with the relevant subject.,"This is a full time three year course affiliated to Maharshi Dayanand University, Rohtak and approved by UGC."
58,"Government Degree College, Bhadarwah",Bhaderwah,Jammu and Kashmir,BCA,3 years,Full time,,UG,,UGC,who has passed the higher secondary part-II examination (10+2) pattern of J&K; state Board of School education or an examination recognized as equivalent there to.,"Bachelor of Computer Application is a three-year full-time UG course offered by University of Jammu, Jammu and Approved by UGC"
59,"Government Degree College, Kathua",Chak Luden,Jammu and Kashmir,BCA,3 years,Full time,40,UG,,,The candidate should have passed in 10+2 any stream,BCA is a three year full time course
60,"Government Degree College, Poonch",Kotan,Jammu and Kashmir,BCA,3 years,Full time,,UG,0.13 lakhs,,The candidate should have passed in 10+2 any stream,BCA is a three year full time course
61,"Government Post Graduate College, Rajouri",Rajouri,Jammu and Kashmir,BCA,3 years,Full time,30,UG,0.38 lakhs,UGC,one who has obtained at least 45% of the aggregate marks (40% Marks for SC/ST candidates) in 10+2 Exams (with or without Mathematics).,"Bachelor of Computer Application is a three-year full-time UG course offered by University of Jammu, Jammu and Approved by UGC"
62,"Government Post Graduate College, Rajouri",Rajouri,Jammu and Kashmir,MCA,3 years,Full time,21,PG,,UGC,The candidate should have passed graduate degree with the related subject from any recognized college/ University.,"Master of Computer Application is a two years full-time PG course offered by University of Jammu, Jammu and Approved by UGC"
63,"Government Gandhi Memorial Science College, Jammu",Jammu,Jammu and Kashmir,BCA,3 years,Full time,30,UG,0.39 lakhs,UGC,"All students who are the state subjects of J & k and have passed Higher Secondary Semester II Examination (Class XII) of J & K State Board of School Education or an examination recognized as its equivalent by the University of Jammu is only eligible for admission to BCA/ B.Sc. Semester-I. However wards of Central Govt. employees, Army and Para-military personnels serving n J&K; are also eligible for admission. Students seeking admission in Semester I should have secured minimum of 45% marks in class XII examination for admission to B.Sc Semester I and 50% marks for admission to BCA Semester I","Bachelor of Computer Application is a three-year full-time UG course offered by University of Jammu, Jammu and Approved by UGC"
64,"Sant Rocha Singh Degree College, Jammu",Jammu,Jammu and Kashmir,BCA,3 years,Full time,,UG,,,The candidate should have passed in 10+2 any stream.,BCA is a 3 year full time course.
65,"Government Degree College for Women, Anantnag",Anantnag,Jammu and Kashmir,BCA,3 years,Full time,,UG,0.31 lakhs,,The candidate should have passed in 10+2 any stream.,BCA is a 3 year full time course.
66,"Government College for Women, Srinagar",Srinagar,Jammu and Kashmir,BCA,3 years,Full time,,UG,0.11 lakhs,,The candidate should have passed in 10+2 with the relevant subject.,"This is a full-time three-year course affiliated to University of Kashmir, Srinagar."
67,"Mahila College, Chaibasa",Chaibasa,Jharkhand,BCA,3 years,Full time,,UG,,,"A girl student may take admission in the vocational course if she has passed the intermediate examination or +2 examinations or any other examination recognized by the University as equivalent thereto.
The candidates who have secured at least 45% marks in the Intermediate or +2 Examinations under the disciplines of arts, science and commerce are eligible for seeking admission to the B.C.A.","This is a full-time three-year course affiliated to Kolhan University, Chaibasa."
68,"Jain College, Jamshedpur",Jamshedpur,Jharkhand,BCA Hons,3 years,Full time,,UG,,"Ministry of HRD, Ranchi, Jharkhand",The candidate should have passed in 10+2 with the relevant subject.,"This is a full-time three year course affiliated to Kolhan University, Chaibasa and approved by Ministry of HRD, Ranchi, Jharkhand."
69,"KMPM Vocational College, Jamshedpur",Jamshedpur,Jharkhand,BCA Honours,3 years,Full time,60,UG,1.11 lakhs,,The candidate should have passed in 10+2 with 45% marks.,"Bachelor of Computer Application Honours is a 3 years Under graduate course Affiliated to Kolhan University, Chaibasa"
70,"Sahibganj College, Sahibganj",Sahibganj,Jharkhand,BCA,3 years,Full time,60,UG,0.3 lakhs,,The candidate should have passed in 10+2 with the relevant subject.,"This is a full-time three year course affiliated to Sido Kanhu Murmu University, Dumka."
71,"Guru Nanak College, Dhanbad",Dhanbad,Jharkhand,BCA,3 years,Full time,60,UG,,,The candidate should have passed in 10+2 with the relevant subject.,"This is a full-time three year course affiliated to Vinoba Bhave University, Hazaribagh."
72,"Sanjay Gandhi Memorial College, Ranchi",Ranchi,Jharkhand,BCA,3 years,Full time,,UG,0.37 lakhs,UGC,The candidate should have passed in 10+2 with the relevant subject.,"This is a full-time three year course affiliated to Ranchi University, Ranchi."
73,"Sri Sathya Sai College For Women, Bhopal",Bhopal,Madhya Pradesh,BCA,3 years,Full time,60,UG,,,The candidate should have passed in 10+2 any stream.,BCA is a 3 year full time course.
74,"Sri Sathya Sai College For Women, Bhopal",Bhopal,Madhya Pradesh,PGDCA,1 year,Full time,30,PG,,,The candidate should have passed in related degree,PGDCA is a 1 year full time course.
75,"DVS College of Arts and Science, Shivamogga",Shivamogga,Karnataka,BCA,3 years,Full time,,UG,,,The candidate should have passed in 10+2 any stream,BCA is a three year full time course
76,"Government First Grade College, Thirthahalli",Thirthahalli,Karnataka,BCA,3 years,Full time,30,UG,,UGC,Candidates must be 10+2 passed in any discipline from a recognized board of education.,Bachelor of Computer Applications (BCA) is a full time three years course affiliated to Kuvempu University.
77,"Smt Danamma Channabasavaiah College of Arts Commerce Science and Management Studies, Kolar",Kolar,Karnataka,BCA,3 years,Full time,,UG,,UGC,Candidates must be 10+2 passed in any discipline from a recognized board of education.,Bachelor of Computer Applications (BCA) is a full time three years course affiliated to Bangalore University and approved by UGC.
78,"Sri Bhagawan Mahaveer Jain First Grade College, Kolar",Kolar Gold Fields,Karnataka,BCA,3 years,Full time,,UG,,UGC,Candidate who have passed 12th or equivalent from recognized Institution.,"Bachelor of Computer Applications is three-years duration full-time course affiliated to Bangalore University, Bangalore and approved by University Grants Commission."
79,"Bapatla College of Arts and Sciences, Guntur",Bapatla,Andhra Pradesh,BCA,3 years,Full time,,UG,,,The candidate should have passed in 10+2 any stream,BCA is a three year full time course
