,College,City,State,Course,Duration,Study mode,Approved intake,Course level,Course Fee,Approval,Eligiblity,Course_Detail
52,"Sainik Law College, Allahabad",Sarai Chachaq,Uttar Pradesh,LLB,3 years,Full time,,UG,,(BCI) Bar Council of India,The candidate should have passed any Graduate or equivalent degree from any recognized College or University.,"Bachelor of Laws (LLB) is three-years (6 Semesters ) full-time program affiliated with Allahabad State University, Allahabad and approved by Bar Council of India. "
53,"Raj Narayan Pandey Law College, Allahabad",Sahson,Uttar Pradesh,BA LLB Integrated,5 years,Full time,120,UG,,(BCI) Bar Council of India,The candidate should have passed 12th from a recognized board.,"Bachelor of Arts + Bachelor of Laws (BA LLB) is five-years (10 Semesters) full-time Integrated programme in Law affiliated with Chhatrapati Shahu Ji Maharaj University, Kanpur with the approval of Bar Council of India. "
54,"Raj Narayan Pandey Law College, Allahabad",Sahson,Uttar Pradesh,LLB,3 years,Full time,120,UG,,(BCI) Bar Council of India,12th Pass from any recognized board or equivalent.,"Bachelor of Laws (LLB) is three-years (6 Semesters ) full-time program affiliated with Chhatrapati Shahu Ji Maharaj University, Kanpur and approved by Bar Council of India."
55,"Ch Jaswant Singh Mahavidyalaya, Etawah",Bharthana,Uttar Pradesh,LLB,3 years,Full time,,UG,,,The candidate should have passed 10+2 any stream from any recognized college/ board.,Bachelor of Legislative Law is a 3 years full-time course affiliated to Chhatrapati Shahu Ji Maharaj University.
56,"G Singh Law College, Allahabad",Sahson,Uttar Pradesh,LLB,3 years,Full time,300,UG,,(BCI) Bar Council of India,The candidate should have passed in graduation in related stream,"Bachelor of Laws is full time three year course degree offered by Chhatrapati Shahu ji Maharaj University, Kanpur and approved by Bar Council of India."
57,"G Singh Law College, Allahabad",Sahson,Uttar Pradesh,LLB Integrated,5 years,Full time,,UG,,(BCI) Bar Council of India,The candidate should have passed in 10+2 related stream stream.,"Bachelor of Laws Integrated is full time five year course degree offered by Chhatrapati Shahu ji Maharaj University, Kanpur and approved by Bar Council of India."
58,"Savitri Devi Shankar Lal Mahavidyalaya, Allahabad",Karchana,Uttar Pradesh,LLB,3 years,Full time,,UG,0.03 lakhs,(BCI) Bar Council of India,The candidate should have passed in 10+2 any graduate degree,LLB is a 3 year full time course.
59,"Ram Sajivan Singh PG College, Kaushambi",Jayantipur,Uttar Pradesh,LLB,3 years,Full time,,UG,,(BCI) Bar Council of India,The candidate should have passed any Graduate or equivalent degree from any recognized College or University.,"Bachelor of Laws (LLB) is three-years (6 Semesters ) full-time program affiliated with Chhatrapati Shahu ji Maharaj University, Kanpur and approved by Bar Council of India."
60,"Sri Sathya Sai College For Women, Bhopal",Bhopal,Madhya Pradesh,BA LLB,5 years,Full time,60,UG,,(BCI) Bar Council of India,The candidate should have passed in 10+2 related stream.,"BA LLB is a full-time five years duration course Affiliated to Barkatullah University, Bhopal Approved by Bar Council of India."
61,"Sri Sathya Sai College For Women, Bhopal",Bhopal,Madhya Pradesh,LLB,3 years,Full time,60,UG,,(BCI) Bar Council of India,The candidate should have passed in any graduate degree,"LLB is a full-time three years duration course Affiliated to Barkatullah University, Bhopal Approved by Bar Council of India."
62,"Bhai Gurdas College of Law, Sangrur",Sangrur,Punjab,BA LLB,5 years,Full time,160,UG,,(BCI) Bar Council of India,The candidates who have passed 10+2 examination with minimum 45% marks (40% marks for S.C./S.T/PH) and should not be above 20 years of age (22 Year for SC/ST/OBC) on first of July of the year of admission.,"Bachelor of Arts and Bachelor of Laws is full time five year course degree offered by Punjabi University, Patiala and approved by Bar Council of India."
63,"Bhai Gurdas College of Law, Sangrur",Sangrur,Punjab,LLB,3 years,Full time,80,UG,,(BCI) Bar Council of India,The candidates who have passed graduate degree from any recognized university with minimum 45% marks (40% marks for S.C./S.T/PH) are eligible to apply.,"Bachelor of Laws is full time three year course degree offered by Punjabi University, Patiala and approved by Bar Council of India."
64,"Rayat and Bahra College of Law, Mohali",Sahauran,Punjab,B.Com LLB,5 years,Full time,,UG,,(BCI) Bar Council of India,Minimum eligibility 10+2 or equivalent.,It is 5 year full time integrated course.
65,"Rayat and Bahra College of Law, Mohali",Sahauran,Punjab,BA LLB,5 years,Full time,160,UG,,(BCI) Bar Council of India,"+2 PSEB or equivalent examination recognized by Punjabi University, Patiala 45% marks in +2 (40% for SC/ST/Physically Handicap) Age not more than 20 yrs on 1st July, 2014 (22yrs in case of SC/ST/OBC)","BA LLB is 5 year full time integrated course with affiliation of Punjabi University, Patiala and approved by BCI."
66,"Jaipur School of Law, Jaipur",Jaipur,Rajasthan,PG Diploma in Criminology and Criminal Administration,1 year,Full time,60,Diploma,0.35 lakhs,(BCI) Bar Council of India,The candidate should have passed in the relevant graduate degree.,"This is a full-time one-year course affiliated to Maharaj Vinayak Global University, Jaipur and approved by Bar Council of India."
67,"RK College of Law, Firozabad",Milikhan Jahanpur,Uttar Pradesh,BA LLB Integrated,5 years,Full time,,UG,,(BCI) Bar Council of India,The candidate should have passed 12th from a recognized board.,"Bachelor of Arts + Bachelor of Laws (BA LLB) is five-years (10 Semesters) full-time Integrated programme in Law affiliated with Dr. Bhim Rao Ambedkar University, Agra with the approval of Bar Council of India. "
68,"RK College of Law, Firozabad",Milikhan Jahanpur,Uttar Pradesh,LLB,3 years,Full time,,UG,,,After GraduationThe candidate should have passed any Graduate or equivalent degree from any recognized College or University. ,"Bachelor of Laws (LLB) is three-years (6 Semesters ) full-time program affiliated with Dr. Bhim Rao Ambedkar University, Agra  (approval awaited)"
69,"St Mother Teresa Law Degree College, Lucknow",Lonapur,Uttar Pradesh,LLB,3 years,Full time,180,UG,0.61 lakhs,(BCI) Bar Council of India,"Secured marks, which shall not be below 45% (44.5% and above shall be treated as 45%) of total marks in case of general category applicants and 40% of total marks in case of SC and ST applicants.","Bachelor of Laws is three years full time duration course offered by University of Lucknow, Lucknow and approved by Bar Council of India"
70,"St Mother Teresa Law Degree College, Lucknow",Lonapur,Uttar Pradesh,LLB Five Year,5 years,Full time,,UG,,(BCI) Bar Council of India,The candidate is passed 10+2 standard or equivalent examination from recognised board.,"LLB Five Year is a full-time five years duration course Affiliated to University of Lucknow, Lucknow Approved by Bar Council of India."
71,"LRS College of Law, Nagina",Nagina,Uttar Pradesh,BA LLB Integrated,5 years,Full time,120,UG,,(BCI) Bar Council of India,A candidate for admission to this course shall have passed the PUC / 10+2 years of schooling recognized by the educational authorities of the central or state government,"Bachelor of Arts + Bachelor of Laws (BA LLB) is five-years (10 Semesters) full-time Integrated programme in Law affiliated with Mahatma Jyotiba Phule Rohilkhand University, Bareilly with the approval of Bar Council of India. "
72,"LRS College of Law, Nagina",Nagina,Uttar Pradesh,LLB,3 years,Full time,180,UG,,(BCI) Bar Council of India,A candidate for admission to this course shall have passed the PUC / 10+2 years of schooling recognized by the educational authorities of the central or state government,"Bachelor of Laws is three years full time course offered by Mahatma Jyotiba Phule Rohilkhand University, Bareilly and approved by Bar Council of India"
